tag,helpful,weighted_vote_score,comment,date,minutes,early_access
not recommende,14,0.5829640626907349,"sorti le 24 oct. 2023 et toujours des bugs day one non fixé (avis donné en 25/02/2024) une simulation d'economie inexistante - changer les taxes ne change pas la demande... une simulation de traffic inexistante - couper les acces de votre ville,  votre population de dira rien  bref ça ressemble a un jeu de gestion mais au final ca ressemble plus a une escroquerie",2024-02-25 17:33:36,5341,False
recommende,9,0.6283783316612244,"Après avoir beaucoup joué à de nombreux city builder (la série SimCity, CitiesXL, même le SimCity 2013, c'est dire...,) et ayant plusieurs centaines d'heures sur Cities skylines 1, et aujourd'hui un peu plus de 115h sur ce deuxième opus, je peux enfin essayer de donner un avis objectif.  C'est un bon city builder plus complet de base et un peu plus joli que le premier volet. Par contre ne vous attendez pas à un framerate élevée, pour ma part ayant joué des années durant à SimCity 4 à 8 images par seconde avec de grandes villes cela ne m'a pas rebuté (les vrais savent de quoi je parle)  Le jeu ayant depuis sa sortie reçu des mises à jour salvatrices, et des pack de bâtiments à thème gratuit, ces derniers mois font que nous arrivons enfin à un jeu jouable. D'autres packs de bâtiments sont d'ailleurs encore à venir.  Les gros point faibles sont l'absence à ce jour d'outils de modding pour incorporer des bâtiments créés par la communauté. De facto il n'y a pas encore la diversité qu'offrait CS1 en la matière (pas de mods de monuments ou de bâtiments donc). Néanmoins il y a déjà des mods ""code"" modifiant/enrichissant le fonctionnement du jeu, l'interface, ou les outils.  Un autre point faible à mon sens, mais qui était déjà présent dans CS1, est la passivité des habitants et de la ville face à nos choix. Vous pouvez interdire les voitures thermiques dans la ville que tout le monde sera content.  Nos actes non aucune conséquence, vous pouvez mettre le budget de la santé à zéro sans aucune contestation. On se retrouve finalement avec une ville sans réelle personnalité (on aurait aimé qu'elle acquière des traits de caractère en fonction de nos actes, à la façon de Crusader Kings par exemple.  La jauge de bonheur est inutile, les habitants sont toujours très contents. Les politiques sont peu nombreuses très fades (et sans conséquence/contrepartie). Ça manque d'ailleurs de politique au sens général, il y a un acte manqué avec le concept de district. On aurait aimé voir des notions de contre pouvoir /contestations entre district ou contre nous.   Nul ne sait si ces derniers point pourront être amélioré, nous savons par contre qu'ils planchent sur les outils de modding, la planche de salut ultime pour un jeu au développement compliqué, héritant des limitations de son moteur de jeu (Unity) et démoulé trop tôt.  Néanmoins le jeu est recommandable à ce jour, ça manque encore de challenge et on est encore un peu trop dans le ""city painting"" sans consistance, ça s'améliore mais lentement. Pourquoi pas à la faveur d'une promotion pour l'unique city builder urbain potable du marché , les DLC sont par contre dispensable.",2025-02-16 21:09:00,7088,False
not recommende,13,0.6255956292152405,"(+) La taille des bâtiments plus réaliste, les centrales et écoles occupent beaucoup de place, une bonne chose. (+) La possibilité d'améliorer les bâtiments, même si ça reste extrêmement basique (+) Une direction artistique plus 'réelle', même si tout n'est pas égal.  (-) La gestion financière de la ville me semble moins poussée que celle du un, ou du moins pas meilleure. (-) L'équipe d'animation de Colossal qui a décidée de se toucher les couilles tout au long du développement, pas d'animation de construction (terrain vague avec une grue), pas d'animation lors des interventions de police, pompier, pompes funèbres, pas d'animation dans les parcs. Une méchante impression d'être dans une ville morte. (-) Les décrets et politiques de quartier qui se comptent presque sur les doigts d'une seule main. (-) Impossibilité d'ouvrir plusieurs menus en même temps. Exemple, impossible de voir les statistiques de consommations du courant et la fenêtre de budget des centrales. (-) Le nouveau système de route est pas mal, mais n'est pas une révolution non plus. Pas de possibilité de définir des priorités sur les routes (route principale, cédez le passage), bien que ce soit possible de mettre un ""stop"". (-) Une optimisation faite avec le cul, des bugs graphiques au niveau de routes et des ombres, un LOD complétement pété sur certain bâtiments (pas tous), qui donne l'impression d'avoir un bâtiment tiré d'un jeu de PS1.  J'ai plus le sentiment de jouer sur une grosse bêta pas finie du tout (accès anticipé). Le fait d'avoir la plupart des fonctionnalités du 1 tirés des DLCs qui ne sont pas présentes rend le jeu bien fade en l'état actuel.",2023-10-29 01:02:29,417,False
not recommende,10,0.5735498666763306,"Du foutage de gueule de la part des développeurs, plus d'un an après sa sortie, toujours autant pété et buggué. Sachant que ce jeu a été développé avec pour objectif en tête : sortir sur console. Résultat la version PC est merdique et la version console aux abonnés absent et sans cesse reportée pour ""raisons techniques"", comprenez : ""On y arrive pas à l'adapter sur console alors démerdez-vous. """,2025-03-25 19:56:22,36611,False
not recommende,6,0.5638217329978943,"Je suis conscient que ma durée de jeu est très courte mais, vu les conditions, elle est à mes yeux amplement suffisante pour me faire une bonne idée de la bête.  J'ai changé de PC au printemps 2022, avec pour objectif de pouvoir jouer à fond avec MSFS et, heureuse surprise, CS1 avec 4-5000 assets.  J'ai donc opté pour une config de I7 11700K, RTX 3080 TI, 64 go ddr. Donc une config relativement haut de gamme, et en tous cas supérieure aux nouvelles specifications recommandées pour CS2.   Mon test s'est donc déroulé en 2 étapes:   - D'une part en démarrant d'une carte vierge.   Premier constat, vous pouvez tout de suite oublier la 4k. Même en paramètres moyens, vous obtiendrez 30ips au grand maximum et des saccades à vous filer la nausée.  En 1440, paramètres toujours moyens, vous vous approcherez de conditions décentes, à une cinquantaine d'IPS, sans trop d'a-coups, sauf en dézoomant où ça reste médiocre et où j'ai étrangement pu constater un scintillement au niveau de l'eau. Décentes ne signifie pas confortables.  - d'autre part, en chargeant une sauvegarde depuis   https://www.gamestar.de/artikel/cities-skylines-2-savegame,3402618.html   A savoir une ville de 100 000 habitants. Et là, c'est une tout autre musique, bien moins agréable, mais qui permet de vraiment voir CS2 dans son rôle de city builder.  En 1440/ params moyens, je suis tombé à 22ips. Le gpu à 100% et la vram à 94%. En 1080/params moyens, pas vraiment mieux, puisqu'à 43 ips de moyenne (parce qu'en plus, on doit se taper des chutes incessantes qui font aller de 53 à 33, plus un antialising aux portes de l'inexistant.), le gpu à 85-90% et la vram à plus de 90%.  Bien entendu, j'ai suivi également les recommandations de CO en désactivant la profondeur de champ, qualité de l'éclairage et des volumétriques.   Ces résultats sont catastrophiques à plus d'un titre.   D'une part, arriver à des performances aussi médiocres avec une config haut de gamme n'est pas acceptable. D'autre part, on parle bien d'un jeu en vanilla, c'est à dire sans dlc (la spécialité maison) ni mods (incontournables mais gourmands). Avec les dlc et mods, on peut évoquer une réduction de 30% des performances en étant optimiste, sans même mentionner l'impact inévitable sur le CPU, particularité des city builders. Enfin, j'arrive à ça alors que PDX/CO ont revu les les configs minimales et recommandées à la hausse en fin de développement, et on est loin d'un confort de jeu correct. Alors pour les PC de génération précédente, je n'ose imaginer leur calvaire.  Bon, à ce stade, j'ai pris la décision de me faire rembourser le jeu. Les supposées améliorations ne servent à rien du tout sur un jeu proprement dégueulasse et limite injouable. J'y ai quand même jeté un oeil, tant par acquis de conscience que par politesse. Quand on développe une suite durant 3 ans avec des mods talentueux en guise de modèles, je serai tenté de dire qu'il n'y a rien d'exceptionnel à avoir amélioré la construction de routes. J'oserais même un ""encore heureux"".  Ce qui me mène aux mods, justement. Bon, pour le meilleur et pour le pire, l'écosystème des mods était sur steam. Le meilleur par la variété, la liberté, et la gratuité. Le pire quand un mod couteau suisse n'était plus mis à jour et semait la pagaille.  Maintenant, tout serait hébergé sur PDX. Ca ne me réjouit pas du tout quand je vois à la fois la mentalité de ce studio qui a sacrément décliné depuis 15 ans. Pour tout dire, mettre les mods entre leurs mains me semble risqué quand je vois l'ambiance toxique qui règne dans leurs forums. Juste mon opinion, qui n'est pas franchement objective.   En conclusion, PDX/CO nous on livré une copie non pas paresseuse, mais franchement loupée.   Des performances, non seulement très en deçà de ce qu'on est droit d'attendre, mais globalement instables dès lors qu'on parvient à aller sous les 90% du GPU, me laissent à penser que les soucis ne viennent pas que de l'optimisation mais peut-être bien d'une trop grande ambition mal maîtrisée. En  d'autres termes, je crains qu'il ne faille bien plus qu'un patch pour régler ça, mais carrément faire une croix sur certaines options de jeu selon la taille de la ville.  [url=https://store.steampowered.com/curator/39131147-Jeux-joue/] Si vous aimez cette évaluation, vous pouvez suivre mon groupe de curation ! [/url]",2023-10-25 11:15:34,32,False
recommende,4,0.5586419701576233,Excellent jeu de construction et gestion de ville. Attention il faut avoir un ordi et une carte graphique performante sans quoi le jeu ne fonctionnera pas.,2024-08-28 16:10:55,5019,False
recommende,7,0.556987464427948,"Ayant acheté le jeu depuis le début, il est clair que la sortie a été précipitée. Mais cela fait maintenant plusieurs mois que les équipes travaillent à des améliorations et le résultat est là : le jeu est désormais bien plus jouable, des concessions ont été faites (Pack Beach Properties inclus au jeu de base) et les équipes se recentrent sur les sujets les plus importants. A terme, le jeu deviendra la nouvelle référence, j'en suis sûr. Moi je continue à l'explorer et à m'amuser avec, alors oui, maintenant je le recommande !",2024-04-28 09:13:40,3484,False
recommende,18,0.6018380522727966,"Tout comme le premier jeu, Cities Skylines 2 est un très bon jeu. C’est un plaisir d’y jouer.   Beaucoup d’améliorations ont été effectuées et on sent clairement que la communauté à été écoutée dans l’élaboration du jeu. Il y a beaucoup plus de fonctionnalités incluses dans le jeu de base comparé à cities skylines 1, ce qui est vraiment appréciable.   Cependant, aujourd’hui, le jeu vient de sortir, il manque encore du contenu comparé au premier jeu et il faut avouer qu’il n’est pas très bien optimisé (Il faut vraiment faire attention à ses réglages et avoir une bonne configuration afin de profiter de ce beau jeu). Mais pas d’inquiétude, les vrais joueurs de cities skylines savent que ça va vite être corrigé et que le jeu va être grandement amélioré au fil du temps, tout comme l’a été le premier dans ses débuts.  Ainsi, même si ce n’est pas un lancement parfait, comme c’est le cas pour de nombreux jeux, il faut dire que c’est un très bon début et que ce jeu deviendra très vite, parfait et d’autant mieux que le premier opus.",2023-10-25 03:37:46,232,False
not recommende,7,0.5515251755714417,"Après 10 heures de jeu le constat est catastrophique. Le jeu est nul et je ne ressent aucune excitation à y jouer. Après cette publication je vais désinstallé le jeu et voir l'année prochaine si le jeu à évolué dans le bon sens.  A chaque fois que j'ai fait des cessions de ce jeu, il me donnait envie de rejouer au un.  Je ne vais pas m'étendre sur l'optimisation du jeu qui était scandaleux au lancement, cela à déjà été largement décrier.  Une des choses qui me déplait le plus, c'est de ne pas pouvoir voir les bâtiments se construire au fur et à mesure, surtout quand ils évolues. Les bâtiments s'upgrade d'un coup sans qu'on s'en rende compte. Ce que j'adorait dans le un et Simcity 4 c'était de voir ma ville grandir en voyant les bâtiments s'élever et évoluer.  Le jeu est moche. Les bâtiments et les véhicules ne sont pas très beaux, et ne sont pas très variés. Pourtant si on zoom de très prêt, c'est bourré de petit détail qui mettent les bâtiments en valeur, mais vue que la plupart du temps on joue en vue aérienne, on ne distingue que des toits gris ou blanc en hiver. Rendant l’ensemble très fade.  Ce qui m'a déçu aussi c'est que je viens de débloquer les résidences à haute densité, mais malheureusement il va falloir attendre encore des heures et des heures de gameplay pour que ma population s'agrandisse car aucun building ne se construit.  Construire une ligne de bus est une vrai plaie. Faut d'abord construire des arrêts de bus dans la ville et ensuite se souvenir on ou les a placé pour les relier à une ligne de bus que l'on créé. Sur le jeu précédent c’était tellement super simple et efficace ou les arrêts de bus se créaient en même temps.  Autre point très décevant, même si c'est prévu normalement, il n'y pas de Mods. Et pas de Workshop sur Steam alors que cette fonctionnalité est tellement éprouvé et top.  Je suis sur qu'il y a encore des tas de détails négatifs comme cela qui m'ont énervé, frustré, mais qu'ils ne me reviennent pas en tête. Le jeu me donne l'impression qu'on est plus dans de la micro gestion, et qu'ils ont fait la même erreur que Maxis avec Sim City World.  Je vais terminé malgré tout avec quelques éléments positifs qui m'ont plu. Les ronds points. Les parkings. Les routes. Les gros bâtiments administratifs (même si cela renfonce ce sentiment de micro gestion)  Ces points positifs ne sont pas malheureusement pas assez nombreux pour me donner envie d'y jouer d'avantage pour le moment.  Passé la découverte du jeu, il ne m'excite plus et me fruste de plus en plus, avec la sensation que le développement de la ville ralenti et s'étire.",2023-12-02 11:20:22,576,False
recommende,8,0.6014218926429749,"Que vaut cette suite, vaux-elle le coup? C'est un grand oui. Si vous avez aimé le 1, vous aimerez le 2. Si vous voulez découvrir le genre, sautez le pas aussi, ou testez le 1er opus avant: cette suite l'améliore grandement.  Pourquoi cette suite vaut le coup et quels sont les points négatifs? Avant tout, je précise que je refuse de comparer ce jeu maintenant, à peine sorti, pas vraiment patché, avec un CS1 sortant de 8 ans de mises à jour et comportant 90 mods et 3k d'assets. La comparaison serait biaisée et illogique, en plus de ne pas concerner tous les joueurs. Dans les deux cas, il s'agira d'une comparaison entre les possibilités offertes par les deux jeux vanilla. Et la limitation à 5k caractères me limite dans le développement.  Les points positifs/améliorés par rapport au premier:  - Les routes. Trop à dire dessus mais vous avez une grande liberté de création et le visuel est bien mieux que dans l'opus précédent.  - Les graphismes. Plus réalistes, passage de 4 à 6 cases pour des bâtiments à l'échelle bien meilleure, surtout pour les bâtiments municipaux. Meilleur visuel.  - Le gameplay, amélioré et approfondi. Le RCI est bien plus diversifié. Un panel bien plus complet pour des skylines plus réalistes. Les bâtiment municipaux vont pouvoir être améliorés avec des éléments à rajouter dans l'enceinte du bâtiment, ou à côté, pour en améliorer la portée et/ou l'efficacité. La délimitation de zones pour les champs et les décharges par zones et non par cases. Pleins de petits détails en plus, le jeu est très bien réussi de ce côté la. La taille des cartes: passez de 36 à 150 km² environ en vanilla. La gestion des 4 saisons et du temps, pour simuler des journées de 24h.  - La circulation: Gros point de débat, avec des gens craignant des villes vides, d'autres une circulation bête... rien de tout ça. Avec une ville de 120k habitants plutôt bien desservie (l'équivalent de Cork en Irlande) je peux vous dire que ça bouchonne. Soyez cohérents et la circulation le sera.  - La vie dans votre ville! Un fourmillement de petits détails et évènements viendra rendre votre ville, quelque soit son stade de développement, vivante.  Les points qui n'ont pas changé (et relèvent d'une petite déception)  - Le quadrillage/zonage, toujours aussi perfectible et se cassant trop facilement, toujours pas de bâtiment épousant les angles. - Les cartes de jeu, ça manque de possibilités pour bien se projeter, soit à cause d'un relief trop punitif, soit d'eau bien trop présente. La quantité de ressources en terres fertiles est toujours aussi ridicule (comptez ~20 km² tout au plus de terres fertiles dont une partie dans l'espace urbain de votre future ville). Les zones de départ sont perfectibles aussi, disons qu'on a pas le choix que de commencer ici et pas ailleurs. - La diversité des bâtiments. Ca passe pour les usines, commerces et petits bureaux mais pour les maisons, immeubles et tours de bureaux, c'est moins varié. Une critique du premier qui revient dans le 2, bien que tout ça sera agrémenté d'assets lors de futures MAJ.  Les points négatifs  Forcément, l'optimisation. Tout a été dit la dessus, je vais pas m'étaler mais le jeu n'est pas prêt. Même moi avec ma 5700X 8c, 6700hq 12Go, 32 Go de RAM, mon GPU est sollicité à 99%. Je n'ai pas de crash et les bugs sont rares, mais l'opti est un gros chantier et les devs en sont conscients. C'est la le principal reproche fait: comment estropier un jeu avec un tel potentiel.  2e point négatif, surement pas fini, les catastrophes. Tornades affreuses et incohérentes, feux de forêt sans traces de cramé sur la zone sinistrée, et c'est tout. Je n'ai rien vu d'autre. Et je ne vois pas beaucoup de communication dessus, mais je serait très fortement étonné si c'était une fonctionnalité terminée car la dessus, CS1 était beaucoup mieux.  3e point négatif: les immeubles européens. En combinant le quadrillage perfectible et le look pas fou des immeubles, je trouve que l'intérêt de jouer en Europe ne vaut pas le coup.  4e point: le relief est toujours un talon d'Achille du jeu.  Conclusion:  Ce problème d'optimisation a refroidi de nombreux joueurs et de testeurs. Mais le jeu en lui-même c'est le digne successeur du premier opus, même en sortant d'un CS1 moddé. J'ai pas envie de descendre le jeu même si j'ai été logiquement déçu par les annonces de CO d'avant la sortie, car en jouant, je me sentirai très hypocrite de participer au bashing ambiant alors que je prend énormément de plaisir dessus. J'ai résumé ce que moi j'ai vu, ce qui m'a sauté aux yeux, avec évidemment une dimension très personnelle, puisque c'est un avis personnel, d'autres résumeront autrement :noel:  Bref, bon jeu à tous et je souhaite le meilleur au futur de cet opus :oui:",2023-11-14 14:06:14,2887,False
not recommende,12,0.5992714166641235,"60H de jeux et 295 000 Habitants;( avec un déficit de - 150 000 par mois, je suis monter a 75 000 0000 €, pas compris le principe du calcul  !!   bilan  :   Je le trouve beaucoup moins intéressant et beaucoup moins complet que le premier ! Énormément de défaut et la ou dans cities skyline 1 c'était travailler et complexe avec une multitude de choix et d'option, la c'est tout simple. Je donne des exemples, les métros et les trains, tout la même chose, et je ne vous explique même pas pour raccorder les lignes ou en créé, c'est une catastrophe, beaucoup de difficulté a jointer deux voie ensemble. ( il faut deviner a quelle profondeur est la ligne pour raccorder une nouvelle ..) le sous sol, on ne voie presque rien, par rapport au premier, c'est horrible, impossible de distinguer exactement les routes, rame de métro ou de train. J'ai un pc Gaming a 4 000 euros, tout neuf, et impossible de jouer avec vitesse 2 ou 3, même en réglant les graphisme au minimum, a 50% de la carte, le jeux sature. Pour l'eau c'est une catastrophe, on fait lisser le terrain, et la des énormes lac apparaisse et inonde tout le cartier. impossible de pomper l'eau, ça existe plus. beaucoup de chose et de détaille on disparue et sont plus simple dans le 2 par rapport au un, Un grand dommage. Il n'y a quasiment plus de règle, ou de lois pour les quartiers. juste les camions interdit dans la ville, les ralentisseur qui accentue les bouchons, les véhicule a moteur interdit dans le cartier et le stationnement payant. sinon il n'y a plus rien du tout !!!!! Mais pourquoi ?? Il n'y a même plus des option comme privilégier les vélos, a ou il me semple que çà n'existe pas dans le 2. Ou d'autre pour la nuit et tout.        Le tourisme ? juste 4 ou 5 bâtiments a débloque. ??!!  Les industries ?! On m'explique ? juste des ronds a faire sur des ressource et tout ce fait tout seul. plus rien a géré. on laisse le temps passer. Quasiment plus rien non plus pour les piétons, juste une route piéton, uniquement. On ne peut plus rien faire pour eux mis a part cette route ! J'en est plein d'autre mais après  ça va faire un roman de 50 pages.  Le seul point positif ; le graphisme !! le top du top  Je suis très déçu, pourtant j'ai tenu 60H mais j'ai fait plusieurs fois le tour du jeux, rien a faire de plus, sur le un j'ai plusieurs partie, une ou toute ma ville est baser sur le tourisme ( qui n’existe presque plus) et sur l’éducation avec universitaire, et d'autre baser sur les industrie, plus de  300H sur le un et je ne m'en lasse pas. Lui le 2, je m’arrête a 60H et j'attend des éventuelle mise a jours ou option additionnel.  Je rajoute car j'ai oublier, ou sont les routes avec voie de Bus ou taxis ????? pourquoi plus de route avec les arbres, obliger de les rajouter par une option qui est inutilisable et énervant a mettre en place, et grosse perte de temp.",2023-11-10 18:06:08,3627,False
