tag,helpful,weighted_vote_score,comment,date,minutes,early_access
recommende,0,0.5,"Le Jeu est devenu stable, enfin, c'est beaucoup plus plaisant à jouer dans ces conditions !   Le jeu est bon, il est bien pensé et complet !",2024-11-27 02:29:56,931,False
not recommende,0,0.5,"Le jeu est top, beaucoup de nouveautés par rapport au premier.. MAIS je ne peux aujourd'hui pas mettre un avis positif après 1 an tant qu'il n'aura pas été optimisé.. Vous pouvez avoir un ""PC de la NASA"", le jeu va crash ou autre.. c'est vraiment dommage !",2024-11-01 23:55:19,2806,False
not recommende,0,0.5,"il est pas trop mal, mais faut pas ce mentir c'est les joueurs qui termine le jeu entre les packs et les mods les devs on trouvé la recette magique pour rien foutre.   couple a ça l’instabilité du jeu qui devient de pire en pire (plantage sec et soudain), ben c'est compliqué de recommander le jeu",2024-10-31 23:42:45,6631,False
not recommende,0,0.5,Impossible de lancer le jeu alors que mon PC est compatible avec ce jeu. Je déconseille donc ce car je ne veut pas que cela arrive a d'autres personne. Le jeu est sorti il y a 1 an est toujours des gros bug c'est simplement inadmissible!,2024-10-28 10:57:53,17,False
not recommende,0,0.5,"Un très bon jeu de gestion de ville et de construction, mais franchement au bout d'une cinquantaine d'heures, on a déjà tous fait et on tourne en rond.  Il faut encore attendre pour que les modder produisent plus de contenu pour relevé le niveau du jeu et son gameplay.",2024-10-27 02:05:27,4395,False
not recommende,0,0.5,"Premier lancement : Crash Ensuite, je lance ma partie, je fais une route pour tester, je veux la retirer en retournant en arrière et la, surprise !  Pas de ctrl + V ! Je suis halluciné, 1 an que le jeu est sorti et y a pas l'option la plus utile et la plus basique, ça commence bien cette histoire Après avoir testé avec Move it, cela ne change rien, ça ne fonctionne que dans certains cas, pas dans la majorité.  Remboursement illico.",2024-10-14 18:04:25,44,False
recommende,0,0.5,La prise en main est assez facile et offre beaucoup de possibilité. Ils ont fait des mise à jours appréciables même si des bugs persistent. Il faut vraiment un bon ordinateur pour le faire tourner alors attention. Je recommande,2024-10-04 14:29:35,5472,False
not recommende,0,0.5,"I'm very disappointed with Cities Skiline 2. A lot of bugs, the economy doesn't make any sense and makes the game simply unusable. As a fan of Cities Skyline 1, I strongly regret having pre-ordered this game. However, it has potential, but is far from a finished game.",2024-09-13 00:12:11,5024,False
not recommende,0,0.5,"Le jeu fonctionne au ralenti, impossible d'accélérer ou de ralentir la vitesse du temps. Le graphisme  présente de nombreuses anomalies. Les véhicules roulent n'importe comment, ce qui crée des embouteillages. Si vous voulez l'acheter, attendez que tout ça soit corrigé.",2024-09-12 09:07:15,6509,False
recommende,0,0.5,"- Très bon jeu, j'ai adoré jouer au premier opus et le second est tout aussi agréable à jouer. Malgré un lancement peu intéressant, Cities Skylines II à réussis à rattraper son retard et apporter de belles nouveautés, principalement grâce à leur nouvelle IA sur la gestion du trafic, la gestion financière qui est légèrement plus compliqué au fur et à mesure que la ville grandie. - La dernière mise à jour rajoute encore pas mal de positif, en apportant la possibilité de décorer ça ville avec divers objets et éléments naturels. - En revanche le jeu, à encore quelques problèmes de performances, il arrive souvent que la population freeze ou ce déplace au ralenti quand les villes deviennent assez conséquentes. L'encastrement entre les éléments de décorations est encore assez limité sur les possibilités. - Le jeu n'est pas encore parfait, mais s'améliore grandement grâce aux patchs réguliers. Je vous recommande le jeu.",2024-09-05 12:57:22,8294,False
recommende,0,0.5,"La simulation est plus réaliste que CS 1, les graphiques sont splendides et l'échelle est plus agréable.",2024-09-03 23:47:15,71362,False
recommende,0,0.5,"Ce jeu est superbe. Sans doute meilleur que CS 1. Dommage qu'il ne soit pas en core optimisé. Obligé de de jouer en ""moyen"" sur les détails et de désactiver un bob nombre de paramètres graphiques et ce malgré une config PC tout à fait correcte.",2024-07-29 10:41:43,2060,False
recommende,0,0.5,"Bon, que dire... Une belle amélioration depuis le début, mais il reste encore du chemin à faire avant de trouver un jeu ""parfait"". Depuis le dernier gros patch (Economy 2.0), le jeu est vraiment devenu plus intéressant ! Néanmoins, il faut encore des mises à jour pour corriger des bugs, comme les sans-abris qui restent bloqués... Je mets un avis positif, car on voit que les développeurs ont pris les critiques au sérieux et tentent de corriger et d'améliorer le jeu ! Je le recommande à l'achat à présent, mais soyez prévenus que tout n'est pas encore parfait. Pour les accros aux city builders comme moi, le jeu devient enfin plus ou moins stable :)  Edit : Depuis la maj anniversaire 2025 le jeu est nettement plus stable et de plus en plus complet ! Je recommande aussi les ""regions packs"" qui ajoutent beaucoup de contenu gratuit ! Par contre pour le faire tourner correctement il faut un bon pc.. malgré les derniers patchs.",2024-07-09 16:55:38,21158,False
not recommende,0,0.5,Jeu très bien et encore plus depuis l'arrivé des mods mais le jeu crash dès que je le lance impossible de jeu. Je suis très déçu...,2024-07-07 23:20:35,2878,False
recommende,0,0.5833333134651184,"J'ai énormément joué sur Cities Skylines (1) avant de jouer sur celui ci. Et..... je ne vois aucune véritable amélioration de jeu.  Les points positifs : grosse amélioration graphique (heureusement car on est en 2024), le système de temps/argent est beaucoup plus simple a comprendre  Les points négatifs : y en à tellement! tout les ajouts par rapport au CS1 sont éclaté ou inutiles, le problème de circulation n'est pas arrangé (changement de voie à des point bien précis qui cause des bouchons sur des 8 voies avec 5000 habitants!), il y a des mods très efficaces sur CS1 qui auraient pu être réutilisés sur le jeu de base.",2024-05-14 15:50:17,3151,False
not recommende,4,0.4988662302494049,"J'avais joué quelque dizaines d'heure sur le gamepass à sa sortie. Si on arrive à supporter les bug, un jeu pas optimisé du tout, et les plantages à répétition, le jeu est cool. Là, je l'ai repris en solde sur steam, car j'ai plus le gamepass depuis longtemps.... Et force est de constater que les développeurs n'ont strictement rien amélioré en 1 an! Toujours des crash (plusieurs en 30 minutes de jeu...) et un jeu qui tourne a 20 FPS en 5140*1440 avec une RTX 3080, DLSS obligatoire et bonjour la mocheté! Demande de remboursement effectuée",2024-12-28 16:36:38,32,False
recommende,0,0.4958920180797577,"Après une série de rattrapages, 9 mois de travail et de patience, on arrive à un jeu « de base » vraiment agréable et addictif. Donc désormais on attend les extensions qui rendront le jeu un peu plus intéressant et plus profond.",2024-06-25 21:36:20,1593,False
not recommende,0,0.4958677887916565,"Once again Paradox is failing their customers. Just installed latest update and the game will simply crash on load. From the missing graphical optimizations at first release to the failed economy overall and repetitive failed delivery on features committed to the community this game is nothing short than a scam and a joke.  I had decided to wait some time after launch to give Paradox a chance to fix their game but this is now beyond any kind of reasonable hope that CSII ever becomes the game that was advertized. Desinstalling and not coming back.",2024-12-11 23:24:00,2652,False
not recommende,1,0.4942791759967804,"Suite au patch Economy 2.0 le jeu, qui n'avait pas grand chose pour lui, si ce n'étais justement ne pas avoir a trop ce prendre la tête avec les finances, est devenu dur à un point ou l'amusement trépasse. Donc à chaque update/patch Colossal Order torpille un peu plus ce jeu.",2024-06-24 18:56:21,12074,False
not recommende,0,0.4901960790157318,Le jeu ne fait que planter et bloque aussi mon ordinateur obligé de redémarrer à chaque fois . Cela va mieux il fonctionne maintenant et beaucoup moins de bug cool :),2024-11-22 11:52:04,2954,False
not recommende,0,0.4901960790157318,Ma save est juste softlock. Pitié fix le jeu. J'adore la license mais pour le moment il vaut mieu jouer au 1. En espérant pouvoir changer mon évaluation un jour.,2024-09-14 12:36:01,10694,False
not recommende,3,0.4812447428703308,"Le jeu crash régulièrement sans aucun message d'erreur, ce qui est hyper frustrant. Il y a de nombreux bugs visuels comme des problèmes de texture et d'ombre qui gâchent vraiment le plaisir vouloir faire des choses jolies. Le comportement des véhicules est souvent étrange et illogique, ça détruit un peu l'immersion. C'est une grosse déception par rapport au premier du nom.",2024-05-26 17:24:08,1559,False
not recommende,5,0.47982802987098694,"Première fois que je joue à un jeu de gestion de ville. Pourtant j'ai regardé masse de tutos du jeu pour être bien préparé à ce jeu et... Ce jeu est une galère SANS NOM.  - Déjà, la base : il n'y a PAS de bouton retour... Mais A QUEL MOMENT ?! Ca pourrit l'expérience du jeu de A à Z. Même dans Zoo Tycoon il y a 30 ans il y avait ce bouton... - Impossible de tourner un bâtiment après l'avoir construit. Obligé de le détruire pour le replacer là où on veut vraiment... Suffit que la route devait s'accorder de l'autre côté que vous aviez prévu et bonsoir les galères.  - On ne peut pas construire maison par maison. - Dès que je créer une usine, à chaque fois on me dit que c'est pas raccordé à l'eau et à l'électricité alors que je pense que si car je vois les tuyaux souterrains et tout. Aucun tuto qui me dit pourquoi. J'imagine qu'il y a un truc que je n'ai mal fait ou pas fait, mais le jeu ne me dit pas pourquoi. Faut jouer aux devinettes...  En plus le jeu est cher. Je m'attendais à de la top qualité vu le prix, un truc hyper intuitif, bah non...",2025-02-21 10:50:54,293,False
not recommende,1,0.47826087474823,"Nul, sa beug ses lents, les graphisme on rien a voir avec les graphique que on voit sur les reseau sociaux, si vous voulez depenser 50Euros Pour rien se jeux et fait pour vous!",2024-09-10 18:25:47,41,False
recommende,0,0.4761904776096344,My favorite game.I play on crappy pc and work fantastic.,2025-04-26 00:08:35,12327,False
recommende,1,0.523809552192688,tres bon  jeu au quel on peut jouer des heures sans s en rendre compte (parfois quelques bug j ai un taxi qui fiat un accident dans un riviere),2025-01-09 18:51:42,700,False
not recommende,9,0.5693780183792114,Beaucoup de crash le jeu est instable est surtout nul tout le jeu ce ferme toute les 5 minutes sans raison  N'acheter surtout pas,2024-12-04 18:43:41,1159,False
recommende,0,0.46908316016197205,"Jeu excellent et magnifique, pratiquement aucun bug. Je recommande",2025-03-09 12:37:07,181,False
not recommende,7,0.4685629904270172,"Ce jeu est une véritable catastrophe... Je n'y trouve aucun point positif. Il est énorme en espace disque, les graphismes sont moche (On se croit revenu au temps de Sim City 2000), Les animation sont digne d'un ordinateur du siècle dernier... Les Paradox Mods mettent un temps fou a se télécharger à chaque fois quand ils ne plantent pas le jeu !!!! Les programmeurs ne sont vraiment pas à féliciter,  Je désinstalle et retourne sur la première version.",2025-03-02 17:13:37,1444,False
not recommende,4,0.5652173757553101,"Je n'ai pas pour habitude de me plaindre d'un jeu mais là j'aimerai tellement défendre ce jeu. Mais en l'état cela n'est pas possible. Une certaine stabilité dans le jeu était enfin d'actualité mais depuis l'ajout du pack France c'est reparti avec de nouveau plain de plantages durant la partie. Sauvegarde qui ne marche pas, menu de construction qui disparaît en pleine partie et qui fait planter le jeu... Après avoir désinstallé le jeu, le réinstaller et ben c'est toujours la même chose. Alors oui c'est un pack gratuit, alors on n'est pas obligé de l'installer mais sincèrement au prix ou j'ai payé le jeu, je pense avoir le droit d'en profiter pleinement. Alors chère éditeur au lieu de sortir des packs pour Cities premier du nom, travaillez sur le deux pour qu'enfin nous joueurs puissions jouer correctement. Nous sommes des joueurs, je pense que la majorité nous sommes des fans par contre nous ne sommes pas des billets de banque.",2024-10-29 16:25:34,2487,False
not recommende,1,0.5138888955116272,"En tant que fan de longue date de la série, j'attendais Cities: Skylines 2 avec impatience je l'avais précommandé, espérant qu'il corrigerait les défauts du premier opus tout en ajoutant des nouveautés. Malheureusement, après plusieurs heures de jeu, je dois dire que la déception est immense.  Le problème le plus flagrant, l’optimisation ou plutôt son absence. Peu importe votre configuration, même avec un PC haut de gamme, le jeu rame dès que votre ville commence à grandir. Les chutes de FPS sont constantes, et les temps de chargement sont interminables. Cela rend l'expérience pénible, surtout pour un jeu qui se veut un simulateur à grande échelle. C’est frustrant de devoir réduire les graphismes à un niveau minimal pour obtenir un résultat à peine jouable.  Ensuite, les bugs sont omniprésents. Routes invisibles, citoyens qui disparaissent, bâtiments qui ne se connectent pas correctement… Certains bugs sont mineurs mais cumulés, ils finissent par ruiner le plaisir de jouer. Sans parler des crashs aléatoires qui peuvent vous faire perdre plusieurs heures de progression si vous oubliez de sauvegarder.  Sur le plan des nouveautés, certaines idées sont intéressantes, comme la météo dynamique et les changements dans les besoins des citoyens, mais elles sont mal exploitées. Elles semblent plus être des gadgets que de véritables ajouts qui enrichissent le gameplay. De plus, beaucoup d'aspects qui auraient pu être améliorés depuis le premier opus restent inchangés : l’IA est toujours aussi incohérente et la gestion des transports, bien qu’annoncée comme améliorée...  On sent que le jeu a été lancé trop tôt. Cities: Skylines 2 aurait clairement mérité plusieurs années de développement supplémentaires pour peaufiner son contenu et optimiser ses performances. À ce stade, il donne l’impression d’être une version bêta vendue au prix fort, et que la priorité est sur le fait de sortir des DLC pour un jeu cassé.  Pour l’instant, je ne peux pas le recommander.",2024-12-19 15:22:20,202,False
recommende,1,0.5131467580795288,"j'aime bien ce jeu car il est relaxent,amusent,imaginaire, le point negatif c'est que il prend beucoup de stockage pour un petit pc",2025-01-10 15:19:58,1229,False
not recommende,2,0.5045871734619141,"Le jeu a crashé plusieurs fois sans raisons avec des heures de build à chaque fois, il y a quoi être dégouté... Perso j'abandonne je ne trouve pas cela jouable",2024-06-02 18:45:12,1987,False
recommende,0,0.45259392261505127,"Enfin, Cities: Skylines 2 atteint la stabilité tant attendue, sans plantages ni problèmes majeurs. Le jeu offre désormais une richesse suffisante en immeubles et options pour véritablement apprécier l'expérience urbaine qu'il propose. L'immersion et les possibilités de personnalisation sont enfin à la hauteur des attentes. Avec l'arrivée imminente de mods et DLC, l'aventure ne fait que commencer. J'ai hâte de voir comment la communauté et les développeurs vont encore enrichir cet univers. Cities: Skylines 2 démarre une nouvelle ère prometteuse, et c'est maintenant que tout devient passionnant.""",2025-03-18 22:28:31,9621,False
not recommende,2,0.5020920038223267,"tres beau graphisme mais  c'est tout . le systeme d'industrie est eclaté , le gestion du traffic routier est toujour voir meme pire que sur le 1 . on reste sur un jeu qui ne tourne que grace au contenu produit par la communauté . ils n'ont rien appris du 1 . c'est une honte . merci a la commu pour vos mods parce que visiblement il n'y a que vous qui bossée .",2024-08-23 13:34:40,2120,False
not recommende,1,0.5010729432106018,"Un jeu prometteur, mais des problèmes techniques gâchent tout  En tant que fan de la série, j’attendais beaucoup de Cities: Skylines II, mais l’expérience est loin d’être satisfaisante.  Points positifs : Des DLC gratuits bienvenus : Les développeurs ont ajouté quelques contenus via des mises à jour, ce qui montre une volonté d’amélioration, même si cela reste limité. Graphismes et idées ambitieuses : Le potentiel du jeu est indéniable avec des cartes gigantesques, des options de gestion avancées, et une attention aux détails comme le système de place de parking. Points négatifs : Optimisation désastreuse : Malgré un PC récent et performant, le jeu peine à tourner correctement. Les FPS chutent régulièrement, et cela gâche complètement l’expérience. Plantages inexplicables : Exemple frappant : utiliser trop de places de parking au bord des routes fait planter le jeu… Sérieusement ?! DLC insuffisants : Bien que gratuits, ces ajouts ne compensent pas les frustrations causées par les problèmes techniques. Manque de stabilité globale : Ces bugs et crashs montrent clairement que le jeu n’était pas prêt pour sa sortie. Verdict : Cities: Skylines II aurait pu être une belle évolution du genre, mais son état actuel est difficilement défendable. Même avec les quelques ajouts gratuits, les problèmes de performances et les plantages (aussi absurdes que frustrants) rendent le jeu difficile à recommander.  J’espère que les développeurs continueront à écouter la communauté et sortiront rapidement des correctifs. Pour l’instant, mieux vaut attendre.",2025-01-04 16:35:31,8653,False
not recommende,0,0.5,"au debut on peut jouer mes depuis un certain temps impossible de jouer le jeux charge jusqu'a 75%   et plant",2025-05-02 21:16:21,5030,False
recommende,0,0.5,"Jeu très complet, passionnant et vraiment très réaliste, je n'ai pas testé la 1ère version mais elle à l'air aussi très réussie, on peut y passer des heures non-stop car il y a toujours des choses à faire, on ne s'ennui jamais. A part ça, c'est vrai, le jeu demande un assez bon PC et il faut un peu baisser la qualité graphique du jeu pour une meilleure fluidité ( en tout cas sur le mien ). Je recommande Cities Skylines 2 (ou le 1 qui est à un prix plus abordable ) si vous aimez les jeu de gestion.",2024-12-27 14:12:13,379,False
recommende,0,0.5,Quelques heures et quelques échecs sont nécessaires pour mieux comprendre CS2. Mais sinon bon jeu où la tête doit fonctionner 👍,2024-11-28 03:47:21,13334,False
recommende,0,0.5,digne successeur du 1 mais doit être optimiser je ne peut que jouer en qualité très basse alors que j'ai pris l'édition ultime hâte de voir l'optimisation,2024-11-05 13:32:02,2728,False
recommende,1,0.5,le jeu est très réaliste mais demande un pc puissant,2024-09-22 19:50:30,2992,False
not recommende,0,0.5,"Le jeu est cool car il apport des nouveautés par rapport au premier du nom mais par contre le jeu crash régulièrement, quelques bugs visuel, on ne peut enlever les saisons, ...",2024-09-08 20:40:10,1302,False
recommende,0,0.5,"Meilleur et moins bien que le premier. Ce jeu a c'est petit soucis mes quand même pas mal d'avantage. En plus les soucis pourraient être réglé avec des mises a jour dans le future. En gros une autre expérience comparativement au 1 qui conviendra a pas mal de monde néanmoins.",2024-08-16 16:16:08,2200,False
recommende,0,0.5,"Très interessant, assez stable sur ma machine. Le jeu est beau quoi qu'en pense certains.",2024-08-05 17:07:40,1262,False
recommende,0,0.5,Le jeu est très bien. Mais depuis la dernière le jeu ne fonctionne plus du tous. de plus mes sauvegarde ne s'ouvre plus etc... c'est de pire en pire... franchement il est de ce réveiller chez paradox!!! De plus a chaque mise a jours le jeu est completement planter!!!!!!!!!!!!!!,2024-06-26 22:26:44,12493,False
recommende,0,0.5,"Le jeu est très très sympa a jouer, néanmoins manque un peu de contenu par rapport au 1er avec tout ses DLCs.",2024-06-26 13:00:41,8676,False
recommende,0,0.5,correct,2024-06-23 03:29:32,2759,False
not recommende,1,0.4987531304359436,"Jeu toujours pas finis, tourne super mal (j'ai un i9 12900K et une 3060 ti don hein),ne ressemble pas du tout a cities skylines 1 mais par contre du contenu payant est déjà dispo. On voit vite  les prioritées.",2025-01-18 23:52:42,715,False
recommende,1,0.4845975637435913,"This game was a hot mess when it got released, but i'm happy to see (especially since the economy 2.0) that the game is way more balanced and fun. Would absolutely recommend today",2024-06-30 13:39:59,12587,False
recommende,2,0.47999998927116394,"Il y a des améliorations par rapport à la 1ere version, mais avant de pouvoir entrer en détail, il y a un gros point négatif.... Où sont les sauvegardes automatiques ? Sur 6 heures de jeu, j'ai dû perdre 3 à 4 heures à cause de crashes, et il n'y a AUCUNE sauvegarde de secours. Ceci est désespérément nécessaire pour pouvoir donner un avis positif !  (EDIT: les crashs se passent toujours lors de l'édition routes ou de l'édition de surfaces p.ex. industrie agricole ou forestière, sauvegardez avant de faire ces éditions !)",2024-10-08 23:21:21,2015,False
not recommende,1,0.47826087474823,ses de  la criss de dompe ce jeu la  serieux ses pas roulable,2024-11-28 21:46:38,705,False
recommende,0,0.4761904776096344,"j adore ce jeux mais il y a des bugs :  1)  ecran jaune quand on veut construire des routes. 2) le jeux s arrete au bout de 40mn.  meme avec plusieurs solution .  merci",2025-01-21 17:34:40,3060,False
not recommende,1,0.4761904776096344,"pas de workshop donc pas de créations , on a juste les dlc trop cher pour ce qu'il propose de plus. presque 1 an après il n'y a a rien de mieux que le premier.",2024-11-18 15:25:33,1558,False
not recommende,6,0.5243991613388062,Arrivé à une taille de ville correct le jeu prend 85 à 90% de mon processeur qui est une AMD Ryzen 7 5800X 8-Core... ce qui fait que le jeu tourne au ralenti et ne donne aucunement envie de continuer... à quand une vraie optimisation du jeu?,2025-02-11 16:46:51,5454,False
recommende,1,0.523809552192688,oui au debut ça a etait une cata mais franchement aujour'dui en fevrier 2025 il es parfaitement jouable et tres plaisant meme sil demande toujours une assez grosse config,2025-02-02 02:08:22,23968,False
not recommende,4,0.523809552192688,Carrément de l'argent foutue en l'air. J'avais espéré une amélioration avec le temps mais forcé de constaté que rien ne s'améliore vraiment. On ne reçoit qu'en compensation des assets cosmétiques qui aurait clairement dû être présent à la sortie du jeu. J'aimerais être compatissant comme avec Cyberpunk mais qui à envie d'attendre encore 4 ans l'update véritable d'un city builder ?,2025-01-23 21:58:56,2991,False
not recommende,2,0.5205479264259338,"Aucun contenu ou presque , a éviter pour l'instant....",2024-05-09 20:06:34,1394,False
not recommende,18,0.5600224137306213,"Le jeu tombe au ralenti avant même avoir atteint  200k de population et rendu à 350k pop ,le jeu est encore pire . Dommage de payer pour ca...",2025-03-04 02:52:57,12228,False
not recommende,7,0.5590185523033142,"C'est devenu totalement injouable.  J'ai passé plus de 280 heures sans problème majeur, mais depuis que les développeurs enchaînent patch sur patch, la situation empire constamment. Désormais, le jeu oscille entre 7 et 20 FPS, ce qui rend l'expérience insupportable. Même à 20 FPS, c'est injouable. Bugs d'interface, freezes permanents : il n'y a pas d'autre mot pour décrire cette expérience désastreuse. Et c'est la même chose sur mes deux PC aux configurations différentes mais performantes. C'est tout simplement honteux.  Autre absurdité : impossible de désinstaller tous les mods depuis le jeu directement d'un coup. J'ai dû passer par leur site officiel pour m'en débarrasser et même d'ici il faut cliquer comme un demeuré sur chaque mod. Maintenant que je veux relancer une version propre du jeu, sans aucun mod ni asset, le jeu ne démarre même plus et plante systématiquement.  Le jeu a fait planté Steam plusieurs fois, je n'avais JAMAIS vu ça. Je n'arrive même plus a le télécharger après installation.  Clairement, le développement technique a été et continue de se faire à la truelle.  Il est grand temps d'arrêter de leur accorder du temps et du soutien qu'ils ne méritent visiblement pas. Je vous conseille vivement de boycotter ce jeu. La meilleure solution aujourd'hui reste malheureusement de désinstaller cette version catastrophique et de retourner sur Cities: Skylines 1 avec les mods qui, eux, fonctionnent.  Et pendant ce temps, Paradox préfère sortir des DLC ? Sérieusement ?",2025-03-22 01:38:54,18327,False
