tag,helpful,weighted_vote_score,comment,date,minutes,early_access
not recommende,87,0.7501751780509949,"Chez moi, le jeu tourne, il est joli et agréable à jouer. Des améliorations, il y en a MAIS -même si je ne suis pas contre le fait de vendre des DLC, ce jeu manque terriblement de CONTENU (pour le prix de base), qq parcs, qq ceci, qq cela...et c'est tout. On pouvait s'attendre à quelque chose de plus fourni...   2 septembre 2024: quasiment un an plus tard, on en est toujours au même stade concernant le contenu (ne parlons même pas dlc, presque du zéro pointé) Les belles promesses, allo? allo?  D'une lenteur hallucinante, j'ai presque 300 jeux dans ma ludothèque, et j'ai rarement vu ça, pourtant les gars ne sont pas 3 ...",2023-10-25 05:56:48,999,False
not recommende,51,0.7797771692276001,"Jeu très prometteur qui n'arrive pas à la cheville du 1er volet. Ils ont fait une superbe publicité mais malheureusement, le développement n'est pas au rendez-vous. Si j'avais pu essayer le jeu avant d'acheter, honnêtement je n'aurai pas payer 90 Euros pour ça.. Je crois qu'il y aura beaucoup de clients dans mon cas, s'ils ne rectifient pas le tir très vite avec une mise à jour GRATUITE et très complète, ce sera GAME OVER pour la License de City Skyline.",2024-03-02 21:42:31,9650,False
not recommende,23,0.7155299782752991,"J'aime beaucoup ce jeu, je l'avais précommandé ayant beaucoup aimé le 1. Je lui ais également laissé du temps  +6 mois après la sortie. Mais le jeu ne s'améliore pas,  Niveau performance des optimisations ont eu lieu mais sont insuffisante. Niveau contenu pour moi c'est ici le vrai problème, le contenu du jeu est inférieur à celui du 1, ce qui ne devrait pas être le cas une suite ne devrait pas faire reculer un jeu. Rien qu'au niveau des politiques applicable la différence est lunaire. (je parle bien entendu hors mods car les développeurs ne devraient pas se reposer sur ça pour faire avancer et améliorer un jeu ;) ).  Ce qui est également incompréhensible est le maintiens des DLC ça n'a aucun sens en voyant l'état du jeu de maintenir actuellement la sortie d'un quelconque DLC, à minima jusqu'à retrouver la qualité du premier opus.  Initialement je m'attendais à une amélioration graphique et à l'intégration des meilleurs mods qui améliorait le 1. On a eu uniquement les graphiques avec en échange un jeu qui tourne à 45 fps sur des machines de dernières générations (ryzen 9 et nvidia rtx).  En bref actuellement, je ne peux pas le recommander, j'espère honnêtement que les développeurs se concentreront sur le contenu et l'optimisation avant de continuer leurs DLC.",2024-06-01 14:24:10,3407,False
not recommende,55,0.7629930973052979,"Je suis extrêmement déçus de ce jeu.  Le jeu en lui même n'est pas mauvais, à mon avis il est même mieux que le premier. Mais les bugs gâchent complètement le jeu. Au départ je me suis dit que c'était normal et que les dev allaient corriger cela dans les semaines qui suivent. Mais non. Nous sommes en decembre et le jeu et toujours injouable (bien qu'il soit un peu plus jouable qu'en octobre). De plus certaines choses sont manquantes et les mods se font attendre ce qui donne l'impression que les dev on sorti un jeu pas terminé.  Franchement je ne vous le recommande pas pour le moment.  Edit : C'est de la grosse merde.  Edit 2 : Le jeu commence a voir de bonnes mise a jours, pas mal de bug on été patch et de nouveaux contenus ajoutés mais le jeu reste encore inferieur au premier.",2023-12-10 15:27:36,33173,False
not recommende,44,0.7526304721832275,"Les + : + Meilleur que CS1, ce qui n'est pas facile + Très beau même avec une configuration graphique définie sur ""moyen"" + Moins ""trafic road simulator"" que CS1 + Le nouvel outil de création de route est très satisfaisant  Les moins : - Injouable avec la config' recommandée en avançant dans la partie (environ 30k habitants pour ma part). Ce qui est très frustrant et explique ce vote négatif. - Toujours le même problème, selon moi, que CS1 : la zone d'action des services publiques (santé, police, pompier et école), que je trouve vraiment faible - Des manques/incohérences dans certaines explications, par exemple :  -- L'adéquation résidentielle qui, par moment, peut être flou -- ""pas assez de client"" alors que la demande en commerce est au max  -- Le trafic d'une route au rouge alors qu'il y a une dizaine de passages par heure, etc.",2023-12-22 15:56:55,5479,False
not recommende,24,0.6971188187599182,"À quand une optimisation digne de ce nom? 1 an après la sortie du jeu aucune amélioration niveau performance. Il serait peu être temps d'optimiser le jeu un minimum. Je suis un grand fan de la licence, je m'engage à changer cette évaluation dès lors que les problèmes seront réglé mais les patchs apportés depuis un an (hormis la maj refonte de l'économie) ont été très pauvres et n'ont pas vraiment apporté d'amélioration surtout en mid/late game avec des performances qui s’effondrent au fur et à mesure que l'on gagne en nombre d'habitant. C'est pour moi une grande déception considérant d'autant plus les propos tenus auprès des joueurs par le studio dans la presse. Le jeu n'est que prometteur pour le moment, je ne recommande pas en l'état actuel.  Edit: Malgré la maj Economy 2.0, le jeu a cruellement besoin d'une refonte dans sa simulation notamment en ce qui concerne la santé et la répartition de la population. Je suis obligé de jouer sans hôpitaux et cimetière/crématorium pour pouvoir être profitable et de laisser mourir la population de personnes âgées qui sont sur-représentés (35% de la population pour 25% d'adultes actifs) et le pire c'est que ça marche!! Je suis redevenu profitable au détriment du bonheur des habitants. Moral de l'histoire, la santé, les vieux... osef.",2024-10-23 15:42:38,24681,False
not recommende,85,0.7933006882667542,"En 15 ans de Steam, c'est bien la première fois que je prends la ""plume"" pour évaluer un jeu... Mais là, je trouve sincèrement que c'est abusé!  J'ai passé quasi 1900 heurs sur le 1er opus qui a eu un énorme succès, notamment grâce à la communauté via le workshop... Bin là, ça fait 5 mois que le jeu est sorti, il n'y en a toujours pas! On se demande à quoi on pensé les devs en sortant leur jeu sans LE petit truc qui à fait le succès de l’aîné...  Alors ce ne serait pas un énorme problème si le jeu était stable est bien fini, mais c'est bien loin d'être le cas! En plus de crash intempestifs, on ne peut pas dire que tout ceci soit hyper fluide. Sans parler des souci de valeur de terrain, de gestion de l'industrie obscure voire buggé, des trajets des véhicules complètements délirants qui foutent la ville en l'air....  En bref, pour le moment, à presque 5 mois de sa sortie, à part l'outil pour construire les routes, le jeu est fini à la pisse. Ce qui m'agace le plus, c'est qu'en attendant, il n'y a quasiment pas eu de patch pour corriger ça! Rien à part des mots et des promesses non tenues des devs pour le moment!  Alors le jeu a probablement un énorme potentiel comme son grand frère... Mais pour ma part, c'etait la dernière fois que j'achète un jeu Paradox à la sortie et sans réduction...  EDIT: Et bien, 10 jours après la rédaction de ce commentaire, on a le droit à un DLC payant au contenu famélique et le jeu n'est toujours pas vraiment fixé............",2024-03-16 11:55:11,10854,False
not recommende,19,0.6841437220573425,"Je ne recommande toujours pas le jeu depuis une semaine je n'arrive même pas a lancer une partie. le jeux crash toujours avant même d’être sur le menu. aucun tuto pour régler ce problème, aucune aide de la par de paradox. impossible de transférer mes fichiers sur leur site, aucun moyen de prendre contact avec eux, je reçois toujours une réponse négative de leur par et que je dois suivre la procédure habituelle de leur site qui n'est même pas en français et comme dit plus tôt je ne peux pas mettre me fichier pour analyse. mise à jour le 12.04.2025",2024-10-25 22:11:41,13594,False
not recommende,23,0.7310546040534973,"Beaucoup de crash sans explication. Pourtant, je possède une bonne configuration. Depuis que j'ai téléchargé le Pack French, c'est pire que avant. Beaucoup de potentiel, beaucoup de crash, trop peut optimisé.",2025-01-04 13:55:42,3032,False
not recommende,76,0.7159000635147095,"Si on peut reconnaître que le premier était une petite révolution dans le genre du city builder (mon genre de jeux préféré), sur lequel j'ai passé des centaines d'heures de plaisir, forcé de constater que la suite tient plus de la catastrophe industrielle. A croire que tous les mécanismes de jeux les plus appréciés ont été dégradé pour ne garder que les pires aspects.  Le placement des routes : si le 1er jeux était une plaie, des améliorations avaient été faites et on aurait pu attendre que ce retour d'expérience aurait été conservé... non visiblement il est plus simple de revenir a des placements encore plus mal foutu que le précédent ! on a beau faire de belles rues à angles droit, les cases de placement sont décalé... aucune explication, aucune logique... et ne parlons même pas de l'impossibilité totale de placer quoi que ce soit dans une rue qui n'est pas droite...  L'interface ultra épuré : vu la quantité pharaonique de mods on aurait pu penser que certaines idées seraient reprises : que dalle. toujours le minimum syndical et il faut comme le premier chercher et naviguer dans les différents menus et batiments pour avoir des infos, toujours pas de vu centralisé avec toutes les infos...  Les bâtiments : vous commencez une ville, tous les bâtiments proposés sont de taille totalement disproportionnés. Vous voulez construire un cimetière dans votre village de 500 habitants ? seul cimetière proposé, un truc colossale digne d'un tombeau pharaonique et plus grand que toute votre ville à ce stade... c'est quoi le concept ? le jeux prévois des sacrifices rituels annuels de la moitié de la population ??  Je passe le placement des canalisations d'évacuation d'eau usées : il faut zoomer au max pour réussir à positionner le raccord pile sur la zone de l'évacuation, car naturellement pas d'accroche magnétique, et les canalisations sont sur différents niveaux qu'il est difficile d’appréhender avec une caméra en biais...  Les supers nouveautés dont les gens parlent en commentaires : les canalisations qui passent par les routes, les bâtiments améliorables... Peut être s'agit-il de gens qui découvrent le genre ou sont trop jeunes, et pour vous je n'aurais que 3 mots : ""SIM CITY 2013"". je vois d'ici la première extension de cities skylines 2  : cities of tomorrow avec des tours à étages à construire... (vous l'aurez lu ici en premier)  Je ne parle même pas de l'optimisation du jeux déjà largement décrié ici.   Au final, ce qui est proposé aujourd'hui tient plus d'une beta sortie bien trop tôt et qui ne tient absolument pas compte du retour d'expérience des années de commentaires de la communauté du précédent opus. Il reste ma plus grosse déception depuis longtemps et j'espère pouvoir changer mon avis d'ici quand une version finale, patché et cohérente sera disponible",2023-10-27 14:31:31,31,False
not recommende,25,0.6560107469558716,"Le jeu n'est à mon sens pas jouable en l'état. Les FPS sont aux fraises, il manque trop d'éléments pour comprendre ce qu'il se passe dans sa ville ou pour la maitriser au mieux. Injouable sans mods qui ne sont pour le moment pas disponibles. Bonne base cependant, j'y reviendrai quand cette Alpha sera terminée.",2023-11-07 20:51:21,618,False
not recommende,25,0.6487366557121277,"Après quelques MAJ, le jeu est devenu jouable. Alors oui, il est plutôt joli cependant, nous sommes dans un jeu de gestion. Niveau gestion... Il est assez vide, très facile et pas très addictif. Bref, je le lance quand j'ai du temps à perdre quoi. Je trouve qu'on retrograde par rapport au premier. Alors oui, j'avais pas mal de DLC.  Vendez vous un jeu vide sans aucun intéret pour ensuite le blinder de DLC payant??? Je pense que oui... Très triste...",2023-12-21 18:23:43,339,False
recommende,68,0.696023166179657,"Bon, je me dois de rétablir un peu la vérité vu l'avalanche de commentaires négatifs, odieux voire franchement insultants que le jeu a reçu à sa sortie. Oui, il y avait des soucis d'optimisation, mais qui ont duré littéralement moins de 48 h le temps qu'un patch sorte. Maintenant, le jeu est parfaitement jouable, et pour peu que vous désactiviez la profondeur de champ (depth of field), vous pouvez tourner en ultra sans souci et avec des graphismes à couper le souffle ! J'ai pas la meilleure config du monde, même si elle est plutôt bonne, j'ai 16 Go de RAM, un processeur AMD Ryzen 7 5800 X et une carte graphique RTX 3070 de 8 Go, et le jeu est installé sur un disque dur externe, pourtant je tourne à 60 fps en permanence et en 4K, sans aucun lag ni aucun souci, alors ceux qui disent qu'encore aujourd'hui, avec des RTX 4080 ils dépassent pas les 15 fps, je me demande bien ce qu'ils font avec leur ordinateur... Donc si vous hésitez à prendre le jeu juste à cause des commentaires sur l'optimisation, n'hésitez plus et prenez le !!  Pour ce qui est du jeu lui-même, c'est du Paradox Interactive et on n'est clairement pas déçu. J'ai adoré le premier volet qui m'a permis de renouer avec les City Builders après avoir cherché pendant 10 ans un digne remplaçant à SimCity 4, eh bien celui-ci est comme le premier, mais en mieux et en plus joli ! Déjà, les graphismes sont absolument splendide, vous pouvez zoomer de très prêt si bien qu'en zoom maximal on se croirait presque dans les Sims ! La ville, les bâtiments, les rues, tout est très détaillé et c'est un régal de voir ses habitants, voitures, etc. vivre leur petite vie dans la ville. Le pathfinding semble avoir été clairement amélioré, en lien avec l'intelligence artificiel, et pour l'instant je trouve que la circulation est bien mieux gérée que dans CS 1 sans mods. Par exemple, les véhicules choisissent désormais spontanément la route la plus large et la meilleure pour aller là où ils doivent se rendre, plus d'embouteillages de camions poubelles ou de voitures dans une minuscule ruelle parce qu'elle fait gagner 15m de trajet par rapport à l'immense avenue vide qui contourne le quartier. L'outil pour placer les routes, d'ailleurs, une fois pris en main est extrêmement puissant et bien pensé, bien meilleur que celui du premier volet ; ainsi, désormais, l'on peut choisir à quel voie on attache sa route / voie, et donc faire des carrefours ou transitions beaucoup plus fluides et esthétiques, comme de belles voies d'insertion sur autoroute, par exemple, ou encore des raccords fluides et élégants pour vos voies ferrées. De même, l'on a enfin de vrais ronds-points faciles à placer et utiliser, et surtout qui ne font pas la taille d'un pâté de maison entier. Un nouveau système a également été mis en place qui permet d'améliorer les bâtiments existants, ainsi il n'est plus nécessaire de placer 50 cliniques médicales ou 30 écoles primaires dans votre ville de 50.000 habitants, vous pouvez simplement améliorer les bâtiments existants (un peu à la manière de SimCity de 2013), en ajoutant par exemple des garages supplémentaires à votre caserne de pompier, une annexe à votre clinique, des quais à votre gare, une bibliothèque à votre école, un héliport sur votre hôpital ou encore un centre de maintenance à votre dépôt ferroviaire. C'est très pratique et ça permet d'avoir un intermédiaire intéressant et bon marché lorsque vos services arrivent à saturation mais que vous n'avez pas les moyens de construire un nouveau bâtiment ou de remplacer ceux existant par un bâtiment de catégorie supérieur. Le zoning a été revu et il est plus pratique et intuitif qu'avant je trouve, et l'on a enfin une catégorie mixte ""commercial / résidentiel"" avec des immeubles dont le rez-de-chaussée est composé de commerces et les étages d'habitations, ce qui est beaucoup plus réaliste et surtout très pratique. Il est plus précis aussi, vous pouvez ainsi choisir quels endroits devront accueillir des pavillons simples, des maisons mitoyennes, des logements HLM ou des immeubles résidentiels ""classiques"" par exemple. Vous pouvez choisir entre le style européen et le style américain, ce qui est chouette, et d'ailleurs d'autres styles (notamment japonais, français et nord-est américain) ont été annoncés et devraient être disponibles GRATUITEMENT prochainement. Au niveau des critiques, il y a principalement deux points qui me chiffonnent pour le moment, déjà au niveau des bâtiments administratifs / de services, ils sont peu variés (un bâtiment par type en gros) donc cela peut vite devenir répétitif dans une grande ville, et en outre la plupart d'entre eux ont des tailles très imposantes, ce qui est réaliste pour une grande ou moyenne ville, mais beaucoup moins pour un petit village (par exemple le lycée est gigantesque, et le cimetière c'est vraiment... démesuré, il fait quasiment 300 m de long par 150 m de large, on dirait le Père Lachaise au grand complet aha) mais nul doute que d'autres bâtiments seront disponibles très rapidement via la communauté de moddeurs (par contre en ce qui concerne les bâtiments uniques, ils sont nombreux et variés, de même que les bâtiments growables dans les zones, et comme dit le fait de pouvoir ajouter des extensions / améliorations aux bâtiments permet de casser un peu cette monotonie). L'autre souci, à mon sens, concerne la demande RCI. J'avoue que je n'arrive à saisir la logique, j'ai une demande quasi constante pour de l'industrie et du commerce mais très faible pour des résidences, si bien que je me retrouve avec de gigantesques zones commerciales et industrielles mais des zones résidentielles qui peinent à se remplir, et au final des industries et commerces qui se plaignent du manque de personnel et du manque de clients... J'ai pourtant essayé d'améliorer mes quartiers résidentiels (en ajoutant des services, des parcs, etc.) et de diminuer les impôts, mais ça reste compliqué d'attirer du monde, ce qui est un peu frustrant car ça ralentit la croissance de la ville. Peut-être que c'est moi qui ne saisit pas quelque chose, mais j'espère néanmoins que ce sera corrigé et/ou qu'une option ou un mod permettra, comme sur le premier volet, de bloquer la demande au maximum pour se sentir plus libre dans son développement.  Je tiens également à souligner que cette version de base inclut d'origine des contenus disponibles dans le premier volet via des DLC. Par exemple, l'on dispose d'ores-et-déjà des services postaux, internet, des catastrophes (désactivables si on le souhaite) ou encore des tramways ou bien des spécialités industrielles précises et bâtiments / usines industriels uniques, ce qui est vraiment chouette. Bien sûr, le jeu ne reprend pas tous les contenus des DLCs de CS I, mais il faut aussi être réaliste à un moment donné : non seulement, cela aurait retardé énormément la sortie du jeu, mais en plus, il faut bien que les développeurs gagnent leur vie, et l'on sait aujourd'hui qu'il est très compliqué d'être rentable sur un tel jeu sans sortir par la suite des DLC. Et personnellement, non seulement je préfère payer le jeu de base une somme raisonnable et ensuite pouvoir choisir ce que je veux implémenter / rajouter dans mon jeu plutôt que d'attendre 3 ans de plus et de payer un jeu certes complet mais à €250, mais en plus je trouve que là pour le coup c'est très honnête de la part de Paradox Interactive : le jeu est extrêmement complet et sans lacune tel quel, et il a plus de fonctionnalités que la version de base de CS I, ce qui devient rare !  En bref, ce jeu est une petite pépite, et nulle doute que je vais passer un bon nombre d'heures dessus au cours des prochains temps. Pour moi c'est un must-have pour tout fan de city builders et maintenant que les problèmes d'opti ont été corrigés, c'est un sans faute ! Foncez l'acheter si vous aimez ce genre de jeu, vous ne serez pas déçus !! 10/10",2023-10-29 07:12:24,315,False
not recommende,23,0.6437512636184692,"10 ans que je suis sur Steam. Plus d'une centaine de jeux, et pourtant pour la première fois, je vais devoir donner mon avis de cette manière.  Joueur de Cities Skylines depuis le tout début, j'ai attendu avec impatience ce deuxième opus. Certes, le jeu était immature à sa sortie, et on pouvait (à la limite) le pardonner, tant le potentiel était énorme. Les mises à jour gratuites, les regions packs, c'est vraiment super et le jeu commence, après un an et demi, à enfin ressembler à quelque chose. En tout cas c'est ce que je pensais.  Après la déception du pack Japon (aucun bâtiment de haute densité, au Japon?), j'ai été agréablement surpris par le contenu du pack Chine, d'après le trailer. Et bien allons-y, lançons le jeu ! Grave erreur, 1h plus tard de bugs, de suppression de jeu, fichiers locaux, réinstallation, mise à jour (laborieuse) des mods, le jeu crash AVANT MÊME que je puisse accéder à ma partie. Je joue avec un PC à 2000€, RTX 3060 TI, 32GO de RAM, un processeur qui tient franchement la route, rien d'ouvert derrière (en prime). C'est plus que frustrant.  Alors oui, on attend tous le ""vrai"" workshop, celui de la communauté, celui qui a rendu CS1 tellement incroyable. Mais ce qu'on attend réellement, c'est de pouvoir jouer au jeu. Juste jouer et exploiter le contenu jusqu'alors promis.  Mission complètement ratée. Ne plus pouvoir lancer sa partie après avoir arrêté de jouer 1 mois, sérieusement ?   Bref, en conclusion : oui le jeu a du potentiel, évidemment, et fondamentalement le jeu va dans la bonne direction. Mais quand un jeu est annoncé à CINQUANTE EUROS en 2023, j'estime qu'en 2025, il doit être fonctionnel. Des bêtas d'autrs jeux fonctionnent mieux.",2025-03-01 21:59:25,7881,False
not recommende,21,0.6923683881759644,"Techniquement le jeu n'est pas ""mauvais"", je dirais juste qu'il n'est pas assez développé et qu'il manque cruellement de contenu. Il y a encore quelques bugs important et même avec des bonnes configurations graphiques, ça chauffe pas mal...  Honnêtement, attendre 6 mois ou 1 ans de plus que le jeu se développe et se peaufine ne m'aurait pas causé de problèmes...  Le jeu s'arrête seul, pensez à faire de sauvegardes régulières,  Il manque des petites choses pour rendre la vie ""de rue"" plus sympa visuellement, du genre kiosques et food-truck.  Il manque aussi des tables, des pontons de quais ou des bar flottants.  dommage le peu de cartes disponibles...   Bon, Vivement les workshop pour apporter de la variété..",2024-01-02 08:41:12,1713,False
not recommende,50,0.738643229007721,"500h de jeu sur CS2 j'ai eu le temps d'en faire le tour ...  A la base j'avais un i7, arrivé à 200k habitants ça n'avançait plus, alors j'ai testé sous Nvidia shadow, encore pire que sous mon i7, aussi au diable les varices j'ai acheté un i9 sur vitaminé avec la dernière carte graphique NVidia, on arrive à 300k habitants et hop ça lague ...sans compter des bouchons inextricables dans les bâtiments mêmes (taxis, aéroport, frêt, ...). Le gars qui a développé le frêt par exemple, ne sait pas comment on gère l'entrée et la sortie de marchandise (impossible de faire un sens unique, les camions se tapent 3 angles à 90° (d'où les bouchons), impossible de gérer la gestion de produits comme dans le 1), j'en passe et des meilleures.  Bref pour un jeu à ce prix et comme un con j'ai pris la version premium et je n'ose même plus le lancer ... Ma plus grosse déception depuis 10 ans !  Résumé soucis : - souci de congestion dans les bâtiments mêmes pour lesquels on ne peut inter agir (taxi, gare de frêt, commerces, ...) - déchets mal gérés - cimetières ne remplissent pas leur fonction - frêt développé avec les pieds ou par un politicien qui n'a jamais mis les pieds dans une entreprise (que ce soit avion ou train, même bataille) - trop limité en terme de développement, 300k habitants sur une bête de course alors que sur CS1 on touchait le million. - aucune gestion des produits - comme le 1 le transport des passagers par bateau est en bois de cagette - grands immeubles, toujours un problème de maisons trop petites même si tu as que des barres d'immeuble Seul truc à peu près fonctionnel : - transports en commun (métro, tramway, train de voyageurs) avion moyen moins  Conclusion : si tu aimes développer une ville de 30k habitants pour 80 balles, t'es maso vas-y fonce ...",2024-06-18 11:42:24,31266,False
recommende,9,0.6294910311698914,"Avant toute chose, je conseille à ceux qui veulent l'acheter de surveiller le développement comme s'il était en early access, car les dernières mises à jours ajouter par les développeurs ont rendu le jeu plus jouable dans ses performances, dans son gameplay, etc. Mais il reste encore dans le jeu de nombreux points à améliorer, je marque donc que je conseille le jeu, mais uniquement à ceux qui étaient déjà fan de Cities Skylines.",2024-08-02 18:51:14,5090,False
