tag,helpful,weighted_vote_score,comment,date,minutes,early_access
recommende,45,0.793495774269104,"Je sais que la lancement du jeu a été une catastrophe. Les commentaires m'ont beaucoup fait hésiter à payer (assez cher) pour le jeu.   Mais je ne regrette pas du tout de l'avoir foit.  Oui, parfois le jeu crash, Oui, il n'y a pas encore autant de mods que dans CS1 Oui, la performance peut être difficile pour certaines machines  Mais de là à dire que le jeu est un échec, un mensonge ou un manque de respect, NON !  Dans les dernières semaines, l'ajout des pack UK, DE et FR ont vraiment changé la donne.   J'ai énormement de plaisir à jouer, et tous les soirs je m'étonne de voir le jeu se faire descendre, malgré la bonne foi évidente de Colossal Order.  Je vous invite à passer outres les commentaires et à vous faire votre propre opinion, parce qu'après avoir longtemps hésité, c'est ce que j'ai fait, et j'ai été plus qu'agréablement surpris.",2024-12-06 13:24:29,26194,False
not recommende,57,0.7801047563552856,"Grosse déception depuis sa sortie. Pas d'optimisation, économie débile, crash fréquents... juste quelques jolies vidéos pour amater le pigeon. Je réessaye 1 an et demi plus tard pour voir s'il y a des progrès et c'est encore pire, même plus accès aux mods :(",2025-02-14 07:43:09,7863,False
not recommende,23,0.7155299782752991,"J'aime beaucoup ce jeu, je l'avais précommandé ayant beaucoup aimé le 1. Je lui ais également laissé du temps  +6 mois après la sortie. Mais le jeu ne s'améliore pas,  Niveau performance des optimisations ont eu lieu mais sont insuffisante. Niveau contenu pour moi c'est ici le vrai problème, le contenu du jeu est inférieur à celui du 1, ce qui ne devrait pas être le cas une suite ne devrait pas faire reculer un jeu. Rien qu'au niveau des politiques applicable la différence est lunaire. (je parle bien entendu hors mods car les développeurs ne devraient pas se reposer sur ça pour faire avancer et améliorer un jeu ;) ).  Ce qui est également incompréhensible est le maintiens des DLC ça n'a aucun sens en voyant l'état du jeu de maintenir actuellement la sortie d'un quelconque DLC, à minima jusqu'à retrouver la qualité du premier opus.  Initialement je m'attendais à une amélioration graphique et à l'intégration des meilleurs mods qui améliorait le 1. On a eu uniquement les graphiques avec en échange un jeu qui tourne à 45 fps sur des machines de dernières générations (ryzen 9 et nvidia rtx).  En bref actuellement, je ne peux pas le recommander, j'espère honnêtement que les développeurs se concentreront sur le contenu et l'optimisation avant de continuer leurs DLC.",2024-06-01 14:24:10,3407,False
not recommende,24,0.6971188187599182,"À quand une optimisation digne de ce nom? 1 an après la sortie du jeu aucune amélioration niveau performance. Il serait peu être temps d'optimiser le jeu un minimum. Je suis un grand fan de la licence, je m'engage à changer cette évaluation dès lors que les problèmes seront réglé mais les patchs apportés depuis un an (hormis la maj refonte de l'économie) ont été très pauvres et n'ont pas vraiment apporté d'amélioration surtout en mid/late game avec des performances qui s’effondrent au fur et à mesure que l'on gagne en nombre d'habitant. C'est pour moi une grande déception considérant d'autant plus les propos tenus auprès des joueurs par le studio dans la presse. Le jeu n'est que prometteur pour le moment, je ne recommande pas en l'état actuel.  Edit: Malgré la maj Economy 2.0, le jeu a cruellement besoin d'une refonte dans sa simulation notamment en ce qui concerne la santé et la répartition de la population. Je suis obligé de jouer sans hôpitaux et cimetière/crématorium pour pouvoir être profitable et de laisser mourir la population de personnes âgées qui sont sur-représentés (35% de la population pour 25% d'adultes actifs) et le pire c'est que ça marche!! Je suis redevenu profitable au détriment du bonheur des habitants. Moral de l'histoire, la santé, les vieux... osef.",2024-10-23 15:42:38,24681,False
not recommende,19,0.6841437220573425,"Je ne recommande toujours pas le jeu depuis une semaine je n'arrive même pas a lancer une partie. le jeux crash toujours avant même d’être sur le menu. aucun tuto pour régler ce problème, aucune aide de la par de paradox. impossible de transférer mes fichiers sur leur site, aucun moyen de prendre contact avec eux, je reçois toujours une réponse négative de leur par et que je dois suivre la procédure habituelle de leur site qui n'est même pas en français et comme dit plus tôt je ne peux pas mettre me fichier pour analyse. mise à jour le 12.04.2025",2024-10-25 22:11:41,13594,False
not recommende,23,0.7310546040534973,"Beaucoup de crash sans explication. Pourtant, je possède une bonne configuration. Depuis que j'ai téléchargé le Pack French, c'est pire que avant. Beaucoup de potentiel, beaucoup de crash, trop peut optimisé.",2025-01-04 13:55:42,3032,False
not recommende,23,0.6437512636184692,"10 ans que je suis sur Steam. Plus d'une centaine de jeux, et pourtant pour la première fois, je vais devoir donner mon avis de cette manière.  Joueur de Cities Skylines depuis le tout début, j'ai attendu avec impatience ce deuxième opus. Certes, le jeu était immature à sa sortie, et on pouvait (à la limite) le pardonner, tant le potentiel était énorme. Les mises à jour gratuites, les regions packs, c'est vraiment super et le jeu commence, après un an et demi, à enfin ressembler à quelque chose. En tout cas c'est ce que je pensais.  Après la déception du pack Japon (aucun bâtiment de haute densité, au Japon?), j'ai été agréablement surpris par le contenu du pack Chine, d'après le trailer. Et bien allons-y, lançons le jeu ! Grave erreur, 1h plus tard de bugs, de suppression de jeu, fichiers locaux, réinstallation, mise à jour (laborieuse) des mods, le jeu crash AVANT MÊME que je puisse accéder à ma partie. Je joue avec un PC à 2000€, RTX 3060 TI, 32GO de RAM, un processeur qui tient franchement la route, rien d'ouvert derrière (en prime). C'est plus que frustrant.  Alors oui, on attend tous le ""vrai"" workshop, celui de la communauté, celui qui a rendu CS1 tellement incroyable. Mais ce qu'on attend réellement, c'est de pouvoir jouer au jeu. Juste jouer et exploiter le contenu jusqu'alors promis.  Mission complètement ratée. Ne plus pouvoir lancer sa partie après avoir arrêté de jouer 1 mois, sérieusement ?   Bref, en conclusion : oui le jeu a du potentiel, évidemment, et fondamentalement le jeu va dans la bonne direction. Mais quand un jeu est annoncé à CINQUANTE EUROS en 2023, j'estime qu'en 2025, il doit être fonctionnel. Des bêtas d'autrs jeux fonctionnent mieux.",2025-03-01 21:59:25,7881,False
not recommende,50,0.738643229007721,"500h de jeu sur CS2 j'ai eu le temps d'en faire le tour ...  A la base j'avais un i7, arrivé à 200k habitants ça n'avançait plus, alors j'ai testé sous Nvidia shadow, encore pire que sous mon i7, aussi au diable les varices j'ai acheté un i9 sur vitaminé avec la dernière carte graphique NVidia, on arrive à 300k habitants et hop ça lague ...sans compter des bouchons inextricables dans les bâtiments mêmes (taxis, aéroport, frêt, ...). Le gars qui a développé le frêt par exemple, ne sait pas comment on gère l'entrée et la sortie de marchandise (impossible de faire un sens unique, les camions se tapent 3 angles à 90° (d'où les bouchons), impossible de gérer la gestion de produits comme dans le 1), j'en passe et des meilleures.  Bref pour un jeu à ce prix et comme un con j'ai pris la version premium et je n'ose même plus le lancer ... Ma plus grosse déception depuis 10 ans !  Résumé soucis : - souci de congestion dans les bâtiments mêmes pour lesquels on ne peut inter agir (taxi, gare de frêt, commerces, ...) - déchets mal gérés - cimetières ne remplissent pas leur fonction - frêt développé avec les pieds ou par un politicien qui n'a jamais mis les pieds dans une entreprise (que ce soit avion ou train, même bataille) - trop limité en terme de développement, 300k habitants sur une bête de course alors que sur CS1 on touchait le million. - aucune gestion des produits - comme le 1 le transport des passagers par bateau est en bois de cagette - grands immeubles, toujours un problème de maisons trop petites même si tu as que des barres d'immeuble Seul truc à peu près fonctionnel : - transports en commun (métro, tramway, train de voyageurs) avion moyen moins  Conclusion : si tu aimes développer une ville de 30k habitants pour 80 balles, t'es maso vas-y fonce ...",2024-06-18 11:42:24,31266,False
recommende,9,0.6294910311698914,"Avant toute chose, je conseille à ceux qui veulent l'acheter de surveiller le développement comme s'il était en early access, car les dernières mises à jours ajouter par les développeurs ont rendu le jeu plus jouable dans ses performances, dans son gameplay, etc. Mais il reste encore dans le jeu de nombreux points à améliorer, je marque donc que je conseille le jeu, mais uniquement à ceux qui étaient déjà fan de Cities Skylines.",2024-08-02 18:51:14,5090,False
not recommende,15,0.6200107336044312,"Faut que les dev / éditeurs arrètent de se foutre de la gueule du monde.  Le jeu est sorti dans un état minable en 10/2023, on a eu le droit à un DLC en début 2024 avant même des patchs de correction des bugs. Suite à la shitstorm ils ont décidé de rembourser le DLC. Aujourd'hui 8 mois après la sortie on attend une énorme mise à jour corrective, qui en fin de compte va nous permettre de payer plus cher nos tuiles, car il parait que le gros problème du jeu c'était qu'il était plus facile.  Ah et au fait, les mises à jour vont prendre jusqu'a 2 mois ingame pour s'appliquer... donc avec une simulation en x3 ça devrait prendre seulement 20 à 24h de jeu.  Bah oui tant qu'a faire ça aurait été bien de corriger les bugs plutôt que de vouloir changer la difficulté.   Quelle bande de clowns. Ah et au fait, la mise à jour prévue aujourd'hui (dans un post d'annonce datant... d'hier) n'arrivera finalement pas aujourd'hui.  Encore un rebondissement !  Edit 02/07/24 : Après le patch , soit 8 mois après la sortie, les bugs principaux du traffic qui se bloque (bug de collision (pas d'accident hein, juste un bug de collision dans les modèles 3D)) sont toujours là.",2024-06-19 19:55:46,3443,False
recommende,6,0.6090047359466553,"Pas encore super optimisé, nécessite des mods pour être réellement plaisant, mais le jeu est très bon et devient meilleur à chaque MAJ. Très gourmant, dès qu'on arrive sur une grosse ville les FPS peinent à dépasser les 30 (avec pourtant une grosse config)  Bref, à surveiller, déjà très bon en l'état actuel, faites vous votre propre avis ;)",2024-08-28 10:46:59,7435,False
not recommende,11,0.6052296161651611,"Malgré les beaux graphismes et un meilleur gameplay que Cities Skylines 1, le jeux a beaucoup trop de bugs et de crashs qui le rendent injouable...",2024-11-03 14:58:35,1718,False
recommende,12,0.6026458740234375,"- Niveau graphisme il y a un gap par rapport au 1er. Les lumières sont plus naturelles et nous sommes vraiment plongés dans l'univers de la ville. - Les bâtiments sont bien mieux dimensionnés, avec la possibilité de les modifiés à la SimCIty 5. - L'outil de construction des routes est nettement amélioré, même si un mod Road Anarchy et toujours le bienvenue. - La simulation est bien plus poussés, au détriment de la température du PC...  De plus, le jeu gagne en stabilité au fur et à mesure des patchs. J'attends avec impatience d'autre add-on. Amoureux de city-builder, foncé!",2024-06-25 09:49:26,9597,False
not recommende,16,0.596143901348114,"Un jeux très mal optimiser, des crash sans explication. J'ai ordinateur assez puissant pour faire tourner tout mes jeux sans problème, rare sont les jeux qui ne fonctionne pas mise a par celui la, même au bout de 60h de jeux je ne peu pas recommander un jeux qui ne fonction qu'a moitier. Les developeur prefère ajouter du contenu au jeux plutôt que régler leur optimisation. La configuration recommander par steam n'est même pas sufisante pour y jouer. Quelle dommage qu'un city builder qui a beaucoup a proposer sois aussi mal optimiser. Je souhaite beaucoup de courage et de patience a se qui veulent y jouer !",2024-11-01 15:51:12,3424,False
recommende,8,0.5838801860809326,"Le jeux est incroyable mais dommage qu'il crash ou bug quand la population est élevé, a cause de ca j'ai perdu ma ville qui etait tres developper et ou j'ai passer du temps",2024-11-01 15:24:07,4989,False
recommende,9,0.6283783316612244,"Après avoir beaucoup joué à de nombreux city builder (la série SimCity, CitiesXL, même le SimCity 2013, c'est dire...,) et ayant plusieurs centaines d'heures sur Cities skylines 1, et aujourd'hui un peu plus de 115h sur ce deuxième opus, je peux enfin essayer de donner un avis objectif.  C'est un bon city builder plus complet de base et un peu plus joli que le premier volet. Par contre ne vous attendez pas à un framerate élevée, pour ma part ayant joué des années durant à SimCity 4 à 8 images par seconde avec de grandes villes cela ne m'a pas rebuté (les vrais savent de quoi je parle)  Le jeu ayant depuis sa sortie reçu des mises à jour salvatrices, et des pack de bâtiments à thème gratuit, ces derniers mois font que nous arrivons enfin à un jeu jouable. D'autres packs de bâtiments sont d'ailleurs encore à venir.  Les gros point faibles sont l'absence à ce jour d'outils de modding pour incorporer des bâtiments créés par la communauté. De facto il n'y a pas encore la diversité qu'offrait CS1 en la matière (pas de mods de monuments ou de bâtiments donc). Néanmoins il y a déjà des mods ""code"" modifiant/enrichissant le fonctionnement du jeu, l'interface, ou les outils.  Un autre point faible à mon sens, mais qui était déjà présent dans CS1, est la passivité des habitants et de la ville face à nos choix. Vous pouvez interdire les voitures thermiques dans la ville que tout le monde sera content.  Nos actes non aucune conséquence, vous pouvez mettre le budget de la santé à zéro sans aucune contestation. On se retrouve finalement avec une ville sans réelle personnalité (on aurait aimé qu'elle acquière des traits de caractère en fonction de nos actes, à la façon de Crusader Kings par exemple.  La jauge de bonheur est inutile, les habitants sont toujours très contents. Les politiques sont peu nombreuses très fades (et sans conséquence/contrepartie). Ça manque d'ailleurs de politique au sens général, il y a un acte manqué avec le concept de district. On aurait aimé voir des notions de contre pouvoir /contestations entre district ou contre nous.   Nul ne sait si ces derniers point pourront être amélioré, nous savons par contre qu'ils planchent sur les outils de modding, la planche de salut ultime pour un jeu au développement compliqué, héritant des limitations de son moteur de jeu (Unity) et démoulé trop tôt.  Néanmoins le jeu est recommandable à ce jour, ça manque encore de challenge et on est encore un peu trop dans le ""city painting"" sans consistance, ça s'améliore mais lentement. Pourquoi pas à la faveur d'une promotion pour l'unique city builder urbain potable du marché , les DLC sont par contre dispensable.",2025-02-16 21:09:00,7088,False
not recommende,10,0.5735498666763306,"Du foutage de gueule de la part des développeurs, plus d'un an après sa sortie, toujours autant pété et buggué. Sachant que ce jeu a été développé avec pour objectif en tête : sortir sur console. Résultat la version PC est merdique et la version console aux abonnés absent et sans cesse reportée pour ""raisons techniques"", comprenez : ""On y arrive pas à l'adapter sur console alors démerdez-vous. """,2025-03-25 19:56:22,36611,False
recommende,4,0.5586419701576233,Excellent jeu de construction et gestion de ville. Attention il faut avoir un ordi et une carte graphique performante sans quoi le jeu ne fonctionnera pas.,2024-08-28 16:10:55,5019,False
recommende,2,0.5454545617103577,"Avec l'arrivée des mods, ce jeu devient enfin plus jouable et offre une vraie variété de contenu. Dommage qu'il faille cela pour agrémenter le jeu de base. A ce propos, le jeu ""nu"" reste plaisant et largement jouable. Toutefois, le manque de variété dans les bâtiments (de base / uniques / de services /...) rend le jeu fade. On a vite l'impression que tout est pareil partout. Il manque clairement des bâtiments ""à thème"". Alors oui, des packs régionaux sont arrivés, mais ça ne fait pas tout. Au fil des patchs, le jeu s'est amélioré au niveau des performances. Il plante parfois, mais à priori c'est plutôt un problème venant de Microsoft et ses mises à jour de Windows 11 foireuses que du jeu en lui-même. Quoi qu'il en soit, le jeu tourne bien, avec tous les graphismes à fond, sur ma machine (AMD 5800X3D, 32Go RAM, Nvidia RTX4080).  Y'a-t-il du challenge ? Pas tellement. Hormis les débuts de partie où il faut un peu faire gaffe à l'argent, ensuite c'est masse de pognon. Par exemple, ma ville actuelle de 250'000 habitants génère 20'000'000 de crédits par mois... Le plus dur, comme dans tous les City Builders, c'est d'organiser sa ville de façon à ne pas l'engorger. Mais encore une fois, rien d'infaisable dès lors qu'on a pris certaines routines.  J'espère vraiment qu'il y aura des DLC ou des mods permettant des installations cablées (téléphérique, télésièges, ...) pour créer une zone ""montagne"". Peut-être aussi la possibilité d'avoir des transports de différentes sortes dans chaque domaine (bus de ligne, bus articulés, autocar, navette, par exemple). Les développeurs auraient largement pu amélioré cela, sachant qu'ils ont créés un premier opus qui a fait l'objet de nombreuses critiques (positives et négatives). Je trouve que le travail fourni manque de profondeur et qu'on aurait pu s'attendre à mieux d'un second opus. Mais bon, ça reste une bonne franchise et elle va s'améliorer avec le temps, c'est certain.  Pour les ronchons qui trouvent que les performances sont mauvaises, dites-vous bien que ce sont des franchises crées pour tenir plusieurs années. Donc autant que ce soit très (trop) exigeant au départ, mais que ça reste agréable dans 5-6 ans.",2024-11-28 13:49:55,9752,False
not recommende,5,0.5437262654304504,"Depuis la mise a jours , eco 2.0 , le jeux ce lance plus après le menu , franchement Paradox devrait arrêter la vente du jeux et sortir un jeux final et pas une beta , comme rien ne marche depuis le début correctement  , et la c'est trop , je pense demander un remboursement t'en que le jeux n'est pas fini",2024-06-29 03:12:35,8514,False
not recommende,4,0.5378150939941406,"Jeux qui deviennent de plus en plus injouables au fil du temps, avec des DLC chers qui sont en plus vraiment à chier, il vaut à peine la moitié de son prix et honnêtement je regrette de l'avoir précommandé",2024-12-12 21:39:59,5723,False
recommende,9,0.6309569478034973,"Pour ceux qui connaissent Cities Skylines I , je dirais que Cities Skylines II est un jeu différent.  Bien qu'ils aient un socle en commun et des similitudes de construction, ils n'ont pas le même déroulement et la même résolution. Je pense que si on apprécie le 1, on peut apprécier le 2 qui est également, un excellent ""city- builder"". Il est injuste de dire que ce jeu n'est pas recommandable quand on voit les autres jeux qui ne lui arrivent pas à la cheville. Il me semble que les difficultés rencontrées par certain viennent de leur machine et que c'est pour eux l'occasion de s'en acheter une plus performante. C'est ce que j'ai fait quand je ne pouvais plus jouer sur Steam avec Windows 7. Pour illustrer leur différence je vais décrire quelques points faibles, puis quelques points forts de CS2: Accumulation des déchets beaucoup trop rapide, malgré un traitement de 70000 tonnes par mois, alors qu'il n'y a que moins de 11000 tonnes/mois de déchets produits? on dirait que les décharges peinent à évacuer. Malgré les extensions remplies, les écoles primaires ne sont pas assez grandes pour contenir le nombre extrêmement important d'élèves éligibles, il faut en construire beaucoup trop. Les goulots d'étranglement d'électricité sont une nouveauté dont on se serait bien passé. Mais cela donne du piment, et il faut jongler avec les lignes à haute tension. Un heureux point fort: On peut faire des villes énormes, sur des cartes plus grandes, avec un choix plus important de parcelles à acheter. On n'est plus bridé ou confiné à des villes de 100000/120000 habitants, mais on peut aller jusqu'à 400000/500000 habitants, peut-être plus, en gérant bien. La beauté des graphismes avec leurs détails est époustouflante. Il y a maintenant des centrales photovoltaIques. (dans l'air du temps) Les services médicaux et mortuaires sont bien équilibrés (mieux que dans CS1) On peut vendre de l'électricité ou de l'eau aux villes voisines, je n'ai pas encore trouvé comment on vend de l'eau, et je vous laisse découvrir vous-même les subtilités de ce jeu.",2025-01-03 11:24:17,4782,False
recommende,3,0.5271210074424744,"Le jeu a clairement fait du progrès depuis ça sortie, il est maintenant agréable a jouer. Malheureusement, il est dommage qu'il manque toujours certaines chose qui ce devais d'être dans le jeu de base: ( animation pour les secoures, services et les habitants dans les parcs en plus de la très convoiter option de bloqué l'évolution de bâtiments random. Sinon, il commence à devenir le successeur digne de Cities Skylines et reste le meilleur City Builder acctuellement.",2025-02-10 00:45:53,1336,False
not recommende,4,0.5199999809265137,"Après h de jeu, il sorte un mod commu qui est full bug.  Nul a chier cet opus de la licence. Honte à vous de sortir un jeu qui est encore buguer.   Pour revenir au mod région, après 3h d'installation, 12 crash du jeu et 3 redémarrage du PC, TOUJOURS RIEN.   De la Vraie MERDE ce mod !!!!",2024-10-28 21:56:29,14548,False
not recommende,5,0.5162270665168762,"Le lancement du jeu a été catastrophique mais j'avais vraiment espoir que ça s'améliorerait assez vite, mais une année plus tard, il y a encore pleins de bugs majeurs (comme des crashs) qui rendent le jeu injouable.",2024-11-04 15:34:37,5070,False
recommende,1,0.5131467580795288,"jeux assez dur au debut, je conseille de comprend les base en maintant l argent ilimiter et ensuite jouer en normale Certains prefere apprendre directement dans le dur mais moi pas trop donc mon conseile est a orendre ou a laisser Bref jeu hyper complet je recommende",2025-01-23 17:56:26,219,False
not recommende,7,0.5129944682121277,"Peu d'améilorations par rapport au premier, le jeu est tres peu optimisé et est plus couteux que red dead redemption deux en therme de performances. il y a des bugs assez nombreux, les maps sont moches puisqu'elles s'arretent sans transition et surtout il y a tres peu de variantes de batiment ce qui rend l'appercu global de la ville très moche. Le jeu en soi n'est pas si mauvais notamment grace à des fonctionalités intéréssantes telles que les tuyaux intégrés dans les routes, les ameilorations de batiment etc.. mais ses défauts un peu trop nombreux font qu'il est abusé de le vendre à ce prix. Pour faire un nouvel opus d'un jeu aussi emblématique que cities skylines 1, il faut pousser la chose beaucoup plus loin et apporter bien plus de contenu, les DLC ne suffiront pas...",2024-06-07 16:51:04,167,False
not recommende,2,0.5106761455535889,"le premier était beaucoup mieux,l'industrie est une vaste blague,cela ne rapporte presque rien comparé au  premier et ca plante svt malgrès une bonne config",2024-10-23 21:15:15,510,False
not recommende,4,0.5016180872917175,"En Dix ans comme client chez Steam le fonctionnement de ce jeu est une vraie abération, tes souvent en  probleme lors des mises a jours, S.v.p. Steam mettre Cities: Skyline II  au (pas), la période d'essaie as terminé depuis long temps. je ne suis pas Ingénier, créateur ou programmeur, j'ai toujours été un client honnete, c'est ma premiere plainte depuis les  dix derbieres année comme client ches Steam, s.v.p aidé moi a trouver une soloutiou a mont probleme je suis une personne agée Merci, Yves Richard",2024-08-13 18:00:39,8712,False
not recommende,0,0.5,"Jeu certainement bien, j’ai pu y jouer une seule fois. Après cela, impossible de le relancer, il plante avant même de lancer une partie. Dommage, je resterai sur le premier opus.",2025-05-04 13:39:43,297,False
