tag,helpful,weighted_vote_score,comment,date,minutes,early_access
recommende,0,0.5,"Chérie, j'ai rétrécie des gosses! Ils sont perdue dans mon jardins!  Plus sérieusement, ce jeux était-il bon? Après une dernière mise à jour majeur, terminant globalement le jeux en matière de contenue. Il y a un constat qui se dégage de l'expérience. Le jeux est fun, à l'ambiance 80's marqué, récompense notre curiosité,  et l'histoire est sympathique. L'aspect survie est simple est efficace, la partie craft est très accessible et sera de paire avec votre exploration du jardin. Nos ennemie sont originaux pour un jeux de ce type et il y a une volonté d'encré le joueurs dans un jardin vivant au grès de nos action. Les personnages reste attachant, et la dimension de jouer jusqu’à 4 n'enlève pas le challenge que vous réserve le jeux. Une partie du jeux, considérer comme du challenge existe par la présence de Boss additionnel et du NG+. NG+ qui vous fait reprendre votre partie dans une version altérer de la réalité, ajoutant des modification visuel, des créature boosté avec des effet, des recettes spécifique par NG+ et la version plus difficile des boss existant. Des ajout, qui ne vous font perdre en aucun cas vos construction et item dans le processus, seul l'histoire est réinitialisé. Une belle prouesse!  Mais, il y a toujours de mauvaise surprise dans un jeux, le premier qui risque de frapper le joueurs est les nombreux insecte qui glitch dans le décor, en particulier les plus gros insecte. Il est notamment particulièrement courant de perdre un cadavre sous le sol. Les commandes clavier-souris sont pas particulièrement agréable et jouer à la manette sera plus adapté. Les dents qui font office de point de caractéristique, sont particulièrement chiante à récupérer dans le jardin sous NG+, leurs emplacement étant aléatoire...  Pour finir, même si le jeux souffre de bug (glitch particulièrement), il est, à mon sens, un excellent jeux de survie pour ceux étant débutant dans ce genre là, ou qui souhaite une expérience  survie/craft simple, mais efficace.",2025-01-21 09:50:20,9548,False
recommende,0,0.5,"Excellent jeu de survie/construction de base ! L'histoire est prenante, la possibilité de construction est fort sympathique aussi, je recommande vivement",2025-01-19 11:53:16,1851,False
recommende,0,0.5,"Un jeu qui peut être chill et complètement stressant en fonction de la situation. Pour les amateur de jeu bac à sable / survie / exploration, je recommande ce jeu !    + les graphismes sont super beaux + les ynsectes sont diverses et variés et très bien réalisé + la difficulté est bien jaugée, on peut éviter les conflits trop haut niveau le temps d'avoir le bon niveau + les constructions sont satisfaisantes à faire + le système d'effet passif très complet - peut paraître déroutant au début, on se sent lâché sans explication (ce qui colle avec le lore cependant) - les personnages parlent peut être un peu trop et tout le temps pour n'importe quoi",2025-01-18 10:25:44,2475,False
recommende,0,0.5,"Ce jeu est incroyable, une longue durée de vie! J'ai littéralement tout fait sur ce jeu et j'en m'en lasse toujours pas!",2025-01-09 15:07:43,21055,False
recommende,0,0.5,"vraiment sympa, ça change comme jeux de survie, accessible même pour les plus jeunes, c'est fluide sur un PC à la ramasse, y'a du contenu, une histoire, du builds, de la découverte, à faire à plusieurs",2025-01-09 01:30:51,5337,False
recommende,0,0.5,un des meilleur jeux que je conseille j'ai joue de pluie la fin de la béta et je ferait en difficile je les fait a 100% avant les nouveauté son les meilleur,2025-01-08 12:31:58,17047,False
recommende,0,0.5,"Ce jeu est génial ! On se croit dans ""chéri j'ai rétrécie les gosses"". Couleurs chatoyantes, pas de bug, progression toujours attrayante et jeu bien complet.",2025-01-08 01:52:27,7888,False
recommende,0,0.5,cool a faire avec vos pote j ai bien sur se ce jeux l aventure  l histoire et la créativité attention insecte effreyant je ne vous dit aller regarder ce jeux est une marge (incroyable),2025-01-07 22:21:51,3043,False
recommende,0,0.5,"Meilleur jeux de survie joué à ce jour, système simple, efficace et fun !",2025-01-01 22:33:40,4160,False
recommende,0,0.5,"swag et fun,  on peut avoir des petites choses en animal de compagnie.",2024-12-30 17:41:53,1990,False
recommende,0,0.5,Partie normale terminée en 80h en coop. Très belle expérience de survie. C'est très qualitatif comme jeu de survie. Tout est assez bien pensé.,2024-12-28 22:52:56,4664,False
recommende,0,0.5,JEU au mode survie et exploration sans prise de tete ideal pour jouer avec ses enfants ou des amis,2024-12-15 18:16:12,691,False
recommende,0,0.5,"Grounded est génial ! Très bon jeu à faire à plusieurs, les graphismes sont très beaux, un peu stylisé cartoon ! On peut construire, évoluer en stuff, partir à l'aventure, bref, c'est très complet ! On se retrouve tout petit, dans un univers ou les insectes sont plus grands que nous ! (attention à ceux qui ont la phobie des araignées ou autres)  Bref, je recommande beaucoup de fun et d'aventure !",2024-11-03 18:34:42,6980,False
recommende,0,0.5,Incroyable le jeu est grave complet il a sa partit de difficulté. Je vous le recommande vivement,2024-10-30 01:56:04,1915,False
recommende,0,0.5,"Super jeu mais j'ai pas accroché ! J'aurais adoré quand j'étais au collège ! A mon époque, c'était avant la playstation 1(...) il y avait super mario world, Zelda3 etc... Je pensais pouvoir retomber en enfance car à cette époque il y avait aussi un film intitulé ""chéri j'ai rétréci les gosses"" que j'avais adoré. Il est probable que je ne trouverais plus cela aussi bien, l'âge fait qu'on devient grincheux j'imagine.... Je conseille néanmoins de regarder cette pépite du cinéma familiale des 90's. Salut les kids et GG",2024-10-25 20:45:29,125,False
recommende,0,0.5,"Un bon jeu de survie à l'échelle microscopique.  Je dois en être à ma cinquième ou sixième partie bien avancée et je le recommance encore (jeu fini entièrement une fois)",2024-09-25 20:10:45,26482,False
recommende,0,0.5,"That game is amazing, from it's ambient, to the combat and craft, everything is perfect, a good survival game, to play alone or with friends !",2024-08-15 11:05:08,4909,False
recommende,0,0.5,"Histoire et découverte chouette, la visite des labos, un kiff a chaque fois, mais gameplay un peu robotique et les mutations pas ouf",2024-07-24 22:40:31,3501,False
recommende,0,0.5,"On parle ici d'un jeu ou nous contrôlons des enfants rétrécis qui se trouvent obligés de survivre dans un jardin contre les nombreux dangers que constituent les insectes et autres invertébrés vivant aux alentours.  Le concept de rétrécissement est très bien réalisé, les environnement sont vertigineux lorsque l'on porte attention à leur grandeur. Certaines tailles sont tout de même parfois légèrement inappropriées par rapport à la réalité notamment chez certaines créatures ou certains objets disposés autour du jardin.  Le mode multijoueur, jouable jusqu'à 4 joueurs propose un type de sauvegarde activable inédit permettant à chaque joueur sélectionnés d'avoir un accès aux sauvegardes de ce monde pour ainsi permettre à n'importe quel joueur d'une aventure de pouvoir lancer la partie sans obligatoirement nécessiter la présence du créateur du monde. En mode multijoueur, un équilibrage sur la santé des créatures a lieu en fonction du nombre de personnes autour de cette dite créature, globalement, plus le nombre de personnes en combat contre une créature est élevé, plus cette créature aura de santé.  Les environnements au sein du jardin sont variés et on y trouve des créatures tout aussi variées apparaissant chacune dans un type d'environnement bien particulier. Chaque environnement propose des ressources exploitables spécifiques incitant ainsi le joueur à explorer pour débloquer de nouvelles possibilités de création.  De nombreuses créatures invertébrées inspirées ou reproduites de la vie réelle peuplent les moindres recoins du jardin. Ces créatures sont séparées en plusieurs catégories, les créature passives qui ne vous attaquent pas, les créature neutres qui ne vous attaquent que lorsqu'elles se sentent menacées et les créatures agressives qui vous attaqueront dès qu'elles en auront l'occasion. Comme dit plus haut, les créatures diffèrent en fonction du biome dans lequel on se situe mais pas seulement, certaines créatures ont plutôt une activité diurne tandis que d'autres ne sortirons que la nuit. Les créatures sont aussi séparées en plusieurs niveaux pour les créatures classiques et plusieurs boss peuvent être affrontés de différentes manières.  Il est bon de noter l'effort réalisé sur la retranscription des comportement réels des invertébrés, la plupart des créatures du jeu possèdent leur équivalent dans la vie réelle et leur comportement qu'il soit dans le jeu ou dans la vraie vie est souvent très similaire ce qui présente un point positif non négligeable pour ce genre d'immersion. Il reste toutefois quelques comportements exagérés (voir même inventés de toute pièce) ou absents en comparant avec la vie réelle mais ces comportement sont souvent modifiés pour garder un gameplay agréable et ne pas gâcher le potentielle d'une créature simplement pour coller à la réalité.  L'ambiance est parfaite, en tant qu'arachnophobe, la crainte procurée par les araignées notamment au début du jeu est réellement bluffante, je ne m'attendait pas à voir de telles images, donnant même des frissons par endroit de la carte. Les modèles et les animations des créatures sont travaillés et renforcent l'immersion.  Le joueur pourra également se construire une base sur mesure, utilisant différents matériaux que ce soit pour leur esthétisme ou la protection qu'ils apportent. Le système de confort apporté lors des récentes mises à jour donne également plus d'impact à la création de base, effectivement plus le personnage se sentira à son aise dans la base, plus il obtiendra de bonus pour faire la différence lors de ses combats ou son exploration.  En terme d'équipement, nous sommes servis, de nombreuses armures, armes et outils peuvent êtres fabriqués avec les ressources de la carte. Au début du jeu les équipements sont rudimentaires, au fur et çà mesure de l'avancée du jeu, les équipements deviennent de plus en plus puissants et impressionnants.  L'histoire du jeu quant à elle est plutôt décevante puisque très basique et assez peu mise en avant. Elle ne présente pas assez de personnages importants et leur développement est très limité.  Le jeu comporte aussi sa part de bugs qui, ici je dois le dire est parfois assez contraignant, surtout lorsqu'un sac à dos, une flèche ou une créature se retrouve coincé dans un élément de décor non destructible.  Il est également possible de lancer une partie en mode créatif pour façonner à notre guise le jardin mais je n'ai pas beaucoup expérimenté cette partie du jeu, ce que j'en ai vu c'est qu'elle a l'air très complète et complexe.  Récemment, le jeu s'est vu ajouter une fonctionnalité de New Game + pour recommencer le jeu en appliquant un bonus de points de vie et de dégâts aux ennemis.  L'obligation de lier un compte xBox peut être parfois un peu handicapante mais elle permet ainsi de jouer avec des joueurs de cette console.  Pour finir, ce jeu est et demeurera longtemps mon jeu de survie favori et un de mes jeux favoris tous styles confondus mais ça ne change rien au fait que son prix est abusif, 40€ pour ce jeu c'est trop (40€ pour un jeu tout court ce devrait être trop).",2024-07-22 03:43:01,12315,False
recommende,0,0.5,"Grounded est un jeu de survie incroyable. Il plonge les joueurs dans un monde où ils sont rétrécis à la taille d'insectes, ce qui rend chaque exploration passionnante. Les graphismes sont magnifiques et les détails sont impressionnants. Les mécanismes de survie et de construction sont faciles à comprendre et amusants. Jouer avec des amis rend l'aventure encore plus cool et remplie de moments amusants et mémorables.  En résumé, Grounded est un jeu fascinant et divertissant, parfait pour les amateurs de survie et de coopération. Une expérience à ne pas manquer !""",2024-06-21 12:13:07,6276,False
recommende,2,0.5394737124443054,"Le concept d'être réduit à la taille d'un insecte dans un jardin extra-ordinaire est à la fois original et amusant. On se sent vraiment immergé dans ce monde miniature, où un simple brin d'herbe peut devenir une véritable forêt à explorer. Une trés belle aventure !!!",2024-09-01 19:01:53,4719,False
not recommende,2,0.48175182938575745,"jeux extrêmement décevant  passer plus de temps a mourir et a courir que de jouer le monde et pas aléatoire ce qui est très ennuyant car la sauvegarde reste la même, même monde, même boss, même monstre, au même endroits. A ne pas acheter vraiment mon ma voler 27,99 je suis outrer de l'arnaque des photo et des vidéo j'ai du mal a m'en remettre. Le jeux vends du rêve mais tout cela n'est que illusion après cela reste mon avis !!!!!!!!!    garder votre propre opinion !  CORDIALEMENT",2024-06-16 02:50:00,325,False
not recommende,2,0.47999998927116394,"Pendant l'install de grounded il y a une case déja coché pour installer total security, un logiciel antivirus de je ne sais quoi, PAR DEFAUT. J'ai décoché la case, et ca l'a installé quand même. Ensuite grosse galère à désinstaller, ca continue à faire des popup et des alertes de merde, ca a pourri ma bécanne !!! un vrai spyware ce machin !!! Je déconseille vivement l'achat de ce jeu on se fou de notre gueule, c'est du cheval de troie à ce niveau.",2025-03-04 15:58:56,210,False
recommende,0,0.4761904776096344,its an awesome game really not terrifying not at all and the spider love having hug my friend is really not dying everytime he see a spider cause they do hug not beating it at all anyways its an awesome game to play with friend,2025-01-01 07:34:49,9851,False
recommende,0,0.4761904776096344,"Grounded est un jeu incroyable ! La longévité est impressionnante, avec un mode histoire captivant et une expérience coop ultra fun et bien pensée. Une pépite à découvrir entre amis ou en solo, on ne s'en lasse pas !",2024-12-02 00:09:59,5839,False
recommende,0,0.4761904776096344,Ce jeu de survie est une vraie pépite. La partie construction est vraiment sans limite. L'introduction des new game+ permet d'augmenter la durée de vie même après avoir terminé l'histoire. En solo ou en multi à jouer absolument.,2024-12-01 10:49:39,13391,False
recommende,0,0.4761904776096344,tres belle aventure a faire en coop. le craft et la construction de base est tres agréable. l'environnement du jardin a explorer est splendide et remplis de surprises. un jeu de survie pour neophytes qui ne peuvent pas passer 1000 heures a farmer des ressources.,2024-11-30 18:43:06,19143,False
not recommende,0,0.4761904776096344,"The game is fun but becomes too repetitive even with the bits of story. also too expensive for the quality of the story/graphics. I don't recommend, maybe if the game would be cheaper like $20-25",2024-08-09 01:06:10,210,False
not recommende,0,0.4761904776096344,"what a bad concept when a group of mosiquito destroy my base at 1000 cm because i hunt them in the swamp why mosquito just attack my for ant i can understand a form of coordination but for mosquito it's stupid and destroy me fun, add to this the hitbox in this game that are just random sometime you touch sometime you don't, the IA of insect is bad as well just chasing like retard since you go out there area and they just let you go even if you are next to them .... so bad there are really great idea ruined by a bad realisation and some weird idea",2024-08-04 20:31:14,1524,False
recommende,0,0.47413790225982666,tri tri bien pa dé problem. Li jeu fonksion tri bien avaic moultitid de bioms et de sinphonnie végétaules. Jé sui tri contain dé mon acha,2025-02-26 15:56:56,2510,False
recommende,1,0.523809552192688,"merveilleux jeux, malheureusement si vous le prenait depuis steam vous ne pouvais pas jouer avec des amis ou une fois sur deux",2025-03-26 17:14:13,169,False
recommende,1,0.523809552192688,"alors pour moi qui et jouer solo c'est super je pense que a plusieurs c'est encor meilleur bien-sur. je le recommande car il et vraiment simpa a jouer et avec un peux de patience ( en solo) ont peux faire vraiment plein de chose l'histoire et génial c'est limite sa m'embète de lavoir fini j'éspère que d'autre mise a jour comme la reine des guèpe sortiront. il et parmis mes jeux favorie car il mérite bien cette place entre toute les éspèces d'insecte, de création, de système de déplacement non vraiment pour se qui veulent jouer solo ou a plusieurs sa sera de bonne heure de jeux.",2025-02-14 15:31:26,11551,False
recommende,1,0.523809552192688,Un de mes jeux préférés ♥  Jeu de survie & exploration tout simplement excellent seul comme à plusieurs. Le gameplay est simple et intuitif à prendre en main.,2024-11-28 21:46:57,8603,False
recommende,1,0.523809552192688,"J'ai détesté le début en solo puis je l'ai adoré ... J'ai pas mal hésité à acheter le jeu à cause du prix mais il les vaut très largement.  L'exploration, la construction, l'optimisation, les combat, les loot rares ... Tout est maîtrisé dans ce jeu.  Je vous recommande de vous spoiler le moins possible et prendre le temps d'explorer par vous même ... Il y a de nombreuses choses secrètes à découvrir.  En solo, le jeu peu paraître difficile au début, lorsque l'on a pas d'arme, que l'on connait pas les attaques des monstres etc mais dès que vous surmontez cette courte phase du début, le jeu devient exceptionnel.",2024-08-16 01:24:58,3658,False
recommende,0,0.5,"Mon jeu de survie préféré, une bonne histoire, de beaux graphismes, et une très bonne bande son !    ATTENTION AUX ARAIGNEES LOUP",2025-01-25 16:20:37,4744,False
recommende,0,0.5,"Je ne joue pas (à ce moment T) à beaucoup de jeux de survie MAIS celui là est génial, j'adore le concept, la DA et le gameplay sont bons aussi. Je ne fais pas beaucoup de critiques MAIS c'est un achat que je ne regrette ABSOLUMENT pas !  (Pas pour rien que j'ai platiné le jeu sur PS5 ! ah oui j'ai acheté le jeu deux fois carrément)",2025-01-12 14:23:01,7126,False
recommende,0,0.5,"Inspiré de ""Maman, j'ai rétréci les gosses"", Grounded est super jeu à jouer entre ami. L'histoire est plutôt intéressante et l'univers beau. Mais gare au araignée qui je précise, se déplace beaucoup plus vite que vous.",2025-01-04 16:59:59,3911,False
recommende,0,0.5,"Juste génial ! De beaux graphismes, un rythme vraiment intéressant et des quêtes étonnantes. C'est une très belle surprise",2024-12-29 19:03:04,199,False
recommende,0,0.5,"Aaaah mon ami, j'te présente Bertrand le Moustique YZ 1.9tdi. Il t'a ruiné ton été ? Ne t'en fais pas, il va continuer à le faire ici.. Lui et tout ses frères d'la casse vont se régaler à pourrir tes petits moments de bonheur <3  (En vrai c'est une masterclass, faut juste pas être arachnophobe)",2024-12-25 11:50:45,6882,False
recommende,0,0.5,"Jeu de ""survie"" tout simplement excellent en solo comme multijoueur, très tourné exploration dans un monde riche en faune et flore avec quand même un peu de farm et des combats de boss.   Pour les plus assidus, chaque niveau de new game + apporte son lot de fonctionnalités afin de permettre une durée de vie très, très longue.  Grounded c'est l'excellence, tout ce qu'on attend d'un jeu de survie.",2024-11-28 13:41:53,7209,False
recommende,0,0.5,Ceci est un excellent jeu. Vous l'adorerez pour tous ses aspects.  ;),2024-11-27 19:12:03,10615,False
recommende,0,0.5,"Tellement d'aventures dans un univers bourrés de détails pour des parties immersives qui vous font vraiment vivre dans un univers à la ""Chérie, j'ai rétréci les gosses !"". Captivant, dangereux, parfois effrayant. On en redemande !",2024-10-23 23:46:14,11396,False
recommende,0,0.5,"bon jeu de survie qui change des autres, rempli de choses à découvrir, encore plus fun en multiplayer avec des amis !",2024-06-21 19:28:14,10224,False
recommende,0,0.5,"C'est un must-have pour tous ceux qui aiment l’aventure, la survie et les mondes immersifs. Ne réfléchis pas trop, prends-le et plonge dans cette univers unique !",2024-06-18 10:21:33,1878,False
recommende,1,0.523809552192688,Très bon jeu mais les services microsoft pour la connexion c'est grave de la merde,2024-10-05 18:57:16,2373,False
recommende,1,0.523809552192688,"un des jeux de survie les plus original auquel j'ai joué, aucun bug rencontré et une aventure coop immersive et amusante",2024-09-03 15:21:48,8093,False
not recommende,3,0.422839492559433,"The game is not bad overall, but lack a lot of depth in various ways. The multi-player experience is also not enjoyable at all.",2024-12-11 00:55:49,2043,False
recommende,1,0.5192307829856873,"Oui vraiment bien, un nouvel univers dans votre cour arrière!  Dans mes top 10.",2024-08-09 18:19:06,12793,False
not recommende,0,0.4166666567325592,"J'ai passé plus de 10 heures a construire une base dans le jeu pour me la faire détruire en 30 secondes par 3 mobs, je déconseille fortement ce genre de jeu",2024-07-13 19:59:02,2710,False
not recommende,0,0.4028435945510864,"ATH trop présent, des informations non nécessaire qui casse l'immersion. Personnage trop zoomé mauvaise visibilité. Les informations qui pop de partout. Menu de craft qui sort complétement du jeu qui casse encore plus l'immersion. Après avoir avoir joué à raft je n'ai pas pu jouer à ce jeu. Dommage l'idée était bonne.",2024-05-23 22:39:35,43,False
recommende,0,0.5,"Jeu captivant, Beaux graphiques, bonne mécanique.",2025-04-16 20:38:24,20407,False
recommende,0,0.5,Jeux Incroyable gros bisous la team flemme de parler plus jouez a ce jeux et découvrez ce banger,2025-02-01 10:46:57,10199,False
recommende,0,0.5,Très dur pour pas grand chose en difficulté normale. Environnement très sympa par contre. L'expérience est vraiment cool à faire en multijoueur (+ facile)  mais pas solo ou en normal.,2024-08-31 23:51:20,809,False
recommende,0,0.5,jeu tres complet et original de survie et d'exploration avec de nombreux craft et ameliorations l'un de mes jeux préféré.,2024-08-20 13:21:44,691,False
not recommende,0,0.5,"Des heures à configurer les comptes xbox live pour jouer en multi, ça a fonctionné une seule fois, puis par la suite pas moyen de se reconnecter avec le compte xboxlive, la connection fonctionne puis lorsqu'on clique sur multijoueur ça redemande en boucle de se connecter au live, très déçu... Alors que la version switch fonctionne sans problème.",2024-07-12 15:46:06,1682,False
recommende,0,0.5,"Alors là mais il est excellent vraiment ! Vous voyez Ark ? Ben pareil sauf que c'est avec toutes les bestioles de ton jardin ^^ Tu dois créer une base assez rapidement pour être safe rapidement, ramasser tout ce que tu trouves et le ramener a ta base",2024-07-07 14:20:29,457,False
recommende,0,0.5,tres bon jeu a jouer seul ou entre amis cela faisais longtemps que je n'avais pas eu cette sensation de plaisir en jouant,2024-06-18 22:14:42,4827,False
not recommende,1,0.37931033968925476,"nous sommes 2 et en mode normal, c'est impossible d'évoluer en tuant les animaux",2024-11-21 12:38:06,1504,False
recommende,2,0.523809552192688,"j'adore et merci au développeurs pour le mode arachnophobe XD, le jeux est top surtout avec des amis un pur plaisir",2024-06-09 12:40:59,4235,False
not recommende,0,0.37037035822868347,"ce jeu est sur le principe un bon jeu avec des mécaniques différentes, en soit un bon jeu. Par contre il va falloir se bouger le cul parce que putain sérieux y'a full up de bug dans le jeu ça pu la merde tu peux pas jouer sans que les créatures de tape a 15 km les animations sont buggé par moment et on travers des objet solides sans soucis vraiment faut faire un truc parce que c'est vrmt un jeu de merde avec du potentiel mais ca n'en reste pas moins un merde officiel",2024-06-24 17:51:21,788,False
recommende,0,0.5,"Grounded est excellent L'histoire est bonne, l'humour est bien , l'exploration est satisfaisante. Les devs ont bien réfléchi à leurs jeux et ça se sent :) Un 8.5/10",2025-02-05 00:24:19,7278,False
recommende,0,0.5,"Pas encore tester avec des copaings ! Mais juste chill solo dessus, C'est nickel :)",2025-01-03 23:45:42,194,False
recommende,0,0.5,"Troooop bien !!! Un gameplay solide , plus amusant a jouer avec des amis !!",2024-12-28 17:09:36,4637,False
recommende,0,0.5,"Super jeu, plutôt difficile mais cela rend le jeu plus intéressant (pour les tryhardeurs)  Très joli et fun",2024-08-08 00:20:04,2365,False
recommende,0,0.5,Manque les énormes merdes de chien dans le jardin mais sinon cool jeu,2024-08-03 14:09:31,3545,False
recommende,0,0.5,"Chéri j'ai rétréci les gosses si on les avaient balancé dans le jardin , je valide",2024-07-31 19:26:57,927,False
recommende,0,0.5,Peur des insectes ?? jouer au jeux pour combattre votre peur !!! Très bon jeu a faire en multi foncer !!,2025-04-02 14:03:02,8731,False
recommende,0,0.5,"Survival game Exploration oriented. Pretty funny to play with friends. Feeling small in that immense garden is very enjoyable",2024-11-04 17:26:41,4643,False
recommende,0,0.5,Très bon jeu ! expérience en solo très agréable,2024-08-11 01:31:32,10458,False
recommende,0,0.5,super original la map est super grande le jeu est tres complet,2024-12-27 13:21:47,1889,False
