tag,helpful,weighted_vote_score,comment,date,minutes,early_access
recommende,7,0.6153846383094788,"Un jeu de survie vraiment très sympa qui mélange narration, exploration, construction et combat. La map est superbe et très cohérente, et l’immersion en mode tout petit dans un jardin est géniale !  Les graphismes sont jolis, avec de belles animations, et les insectes, variés et super bien faits, ajoutent une vraie ambiance au jeu. Le système de combat est très réussi et la difficulté bien dosée, ce qui rend la progression agréable.  En plus, le jeu tourne très bien et est bien optimisé (dans mon cas). Gros point fort également pour la physique des objets et de l’environnement.",2025-02-04 17:48:48,2871,False
recommende,6,0.6000000238418579,"grounded c'est LE jeu. foncez, tout est parfait sur ce jeu. tout. jamais j'oublierais mes heures dessus, et j'y retournerais encore et encore. dans ces moments ou la vie vous met a rude épreuves, ce jeu as su calmer ma colère, m'évader. <3",2024-11-01 21:17:27,9692,False
recommende,4,0.5652173757553101,"Que dire sur ce jeu ? Oh une coccinelle ! aaaaaaaaaaaaaaaaaaaaaaaaaahhh une araignée loup. Aaaaaaahhhhhhh une punaise !!! Wouaw qu'elle vue d'en haut.  Si vous aimez l'exploration ce jeu est fait pour vous, tout nous pousse à chercher, observer, peser les problèmes qui arrivent ou vont arriver. Le système de jeu est plutôt bien pensé et assez simple à prendre en main.  Vous êtes miniaturisés dans un jardin et votre quête consistera à retrouver votre taille normale.  Bien évidemment ce n'est pas si simple et le tout sera enrichi par une histoire et des cinématiques très sympa. Un jeu faisable en coop jusqu'à 4 joueurs. Je le recommande fortement, une expérience unique en son genre.",2025-03-20 22:58:33,11064,False
recommende,4,0.5652173757553101,"Ce jeu c'est le film Chérie, j'ai rétréci les gosses, vous êtes un enfant en 1990 qui a été rétréci et votre but est d’accomplir une  série de quête pour redevenir grand. Vous pourrez apprivoiser une fourmi comme dans le film. Il y a un savant fou comme dans le film.  Vous pouvez jouer en coop jusqu'à quatre joueurs. La prise en main est intuitive. C'est un jeu de survie où vous récoltez des ressources pour fabriquer des armes, des armures et construire des bâtiments. Les bâtiments sont modulaires, il y a plusieurs matériaux de construction (herbe, tige, brique de champignon) et des meubles et décorations pour les personnaliser. Vous explorerez des environnements variés dans un très grand jardin qui mesure 10 mètres de long, oui 10 mètres c'est très grand quand on ne mesure que 5 cm. Vous affronterez des insectes et des araignées.   Le prix de 40€ est correct et en promo à 20€ c'est encore mieux.",2024-11-28 20:02:41,26390,False
recommende,2,0.5560253858566284,"Superbe jeu d'aventure pour jouer en solo ou à plusieurs : le monde ouvert est tout simplement magnifique, le jeu lie à la fois de la construction, de l'aventure, une histoire et du combat pour plaire à tous !",2025-01-02 12:37:55,9002,False
recommende,3,0.5546558499336243,"Enfin fini et putain quelle dings quand même ! Une vraie pépite de jeu de survie. J'ai pu le faire à trois et que ce que j'ai kiffé, on n'a pas vu le temps passé. La construction est géniale, les combats sont incroyables avec plein d'armes d'hivers avec des builds de fou furieux (le pvp est horrible, je jouais maj...). Et l'exploration du jardin est tellement bien faite, on n'est jamais perdu dans ce qu'on doit faire tout est agencé parfaitement pour aider le joueur à s'y promener et s'y retrouver. On a eu des rires, de la rage et des sacrées frayeurs fasse à ses insectes. Foncé, c'est un jeu à faire dans la survie coop.",2025-01-27 22:36:00,5598,False
recommende,2,0.5454545617103577,"Jeu très agréable mêlant aventure, construction et combat.",2025-04-26 12:51:40,48749,False
recommende,2,0.5454545617103577,"Super jeu à faire en couple !  Les devs se sont éclatés et ça se sent. Tout est bien pensé.  Je recommande à 100%",2025-03-16 21:19:20,1709,False
recommende,3,0.5416666865348816,"se jeux est dinamique amusant avec beaucoup de contenue et une touche d'originaliter un jeux de survie bassique vous me dirait non je vous recommende grounded au plus haut poin meme si le prix est élever l'expresion ""sa vaut le cout"" est vraiment respecter",2024-08-28 20:01:31,11452,False
not recommende,2,0.541284441947937,"le jeu est formidable, mais depuis 1 an on ne peut pas jouer en coop, car steam ne se connecte pas a xbox network et peu importe le moyen ça marche plus, c'est cassé. UPDATE !!",2024-07-03 10:23:43,2756,False
recommende,5,0.5769230723381042,"Je pense pouvoir donner mon avis sur le jeu étant donné que je l'ai pas mal poncé tout de même. Dans mon avis, je ne décrirai pas le gameplay du jeu, mais plutôt ses points positifs et négatifs.  Points positifs : Le jeu a un style graphique assez ""rond"" que j'aime particulièrement. Son style ne fait pas ""réaliste"", ce qui, pour moi, le rend assez beau. En parlant de beauté, je trouve que l'environnement du jeu est magnifique, avec la lumière du soleil bien rendue ou l'effet de flou sur les éléments éloignés qui est très réussi. Autre point positif, quand on commence le jeu, on s'émerveille de chaque découverte, de chaque nouveauté. On panique aussi quand on découvre un objet que l'on pense rare et qu'une araignée loup nous fait un jump scare et nous poursuit. J'ai eu pas mal de sursauts et de moments de panique au début de mon aventure dans ce monde qui nous paraît géant dû à notre petite taille. J'aime beaucoup aussi le style de tous les outils, armes et ateliers qui, on le voit, sont faits avec les éléments naturels du jeu, ce qui rend réaliste leur existence dans le jeu. De plus, certains éléments humains, qui nous paraissent plus gros étant donné notre taille, offrent plusieurs options de gameplay sympa. Les différents bruitages des insectes sont aussi assez bien faits et peuvent nous faire paniquer à certains moments. Dernier point positif : dans le jeu (sauf vers le haut jardin), on peut quasiment interagir avec presque tous les éléments du décor, ce qui plonge bien dans l'immersion du jeu.  Points négatifs : Tout d'abord, les musiques de fond, bien que sympas, sont assez peu nombreuses et on en fait vite le tour. Donc il arrive souvent qu'elles se répètent. Le jeu souffre aussi de nombreux bugs, soit dans les interfaces qui peuvent être un peu contraignantes, soit avec les mobs qui sont soit stupides à cause de ces bugs, soit totalement glitchés, ce qui nous retire de l'immersion. Bien que le bestiaire soit varié, je trouve qu'il ne l'est pas assez alors que le contexte offre une bonne possibilité. Je trouve que les reines des fourmis ont mis trop de temps à être implémentées, que c'est dommage qu'il y ait une reine des guêpes mais pas des abeilles, qu'il n'y ait pas de crapaud (qui pourrait être un bon mob hostile des marais) malgré le fait qu'il y ait des têtards, ce qui rendrait l'apparition de ce mob logique. Ou un escargot ou une limace (comme on voit une coquille qui ne sert à rien d'ailleurs). Et dernier point négatif, je trouve que la dernière mise à jour apporte certes pas mal de fonctionnalités et d'armes, mais le fait que, à chaque nouvelle dimension du monde, on doive tout refaire sans pouvoir revenir en arrière est une plutôt mauvaise idée. C'est vraiment la phrase ""on prend les mêmes et on recommence"" et c'est en partie ça qui m'a fait arrêter de jouer au jeu pour le moment. Certes, ça augmente énormément la durée de vie du jeu, mais c'est fait de manière trop artificielle et ça devient trop redondant. Dernier point négatif : au début du jeu, comme dans tout jeu de survie, on galère à trouver les ressources pour se maintenir en vie et, comme dans tout jeu de survie encore une fois, à la fin ceci n'est absolument plus un problème. Mais dans ce jeu, le moment où ce n'est plus un problème arrive trop tôt à mon goût, ce qui rend l'aspect survie du jeu avec la nourriture et tout beaucoup trop oubliable et simple trop tôt dans l'aventure.  Il y a plein d'autres points que je n'ai pas évoqués ici car soit je les ai oubliés (oups), soit ils ne sont pas assez pertinents. Mais malgré les points négatifs, le jeu reste assez original et vaut le coup.",2024-08-01 12:43:56,6645,False
recommende,1,0.523809552192688,"Jeu très sympa ! Expérience en coop uniquement pour ma part, et c'est top !",2025-05-04 11:15:55,253,False
recommende,1,0.523809552192688,"jeux complet et très immersif , jeux  vraiment complet , je recommande !",2025-04-26 15:00:11,208,False
recommende,1,0.523809552192688,L'un de mes jeux pref dommage que le jeu touche a sa fin via les majs. Je ne suis pas fan de endgame NG+ mais bon Le jeu reste un très bon jeu a faire une fois dans sa vie est super cute,2025-04-18 18:11:12,16419,False
recommende,1,0.523809552192688,"If you like survival games this one is a must! From all the survival games i own this one is the only one that I give 10 out of 10. Gameplay mechanic, story, ambiance, building, bosses and even music, Everything is amazing. After more than 600 hours I still love this game as much as day 1. Best survival game of all time for me.  I just have one question Obsidian : WHERE IS GROUNDED 2!!!!! I WANT MORE!",2025-04-17 19:20:02,38335,False
recommende,1,0.523809552192688,"Le jeu est très fun, avec une bonne courbe de difficulté, univers très cool, bonne histoire. toujours moyen de passé des heures dessus même après l'histoire principale finie",2024-11-02 02:05:11,9449,False
recommende,1,0.523809552192688,"Jeu très intéressant, change un peut la vision d'un jeux de survie basique, car on fait la taille d'une fourmis comme dans les films ""chérie j'ai rétréci les gosses"", certaines choses sont compliqué à comprendre comme, comment on débloque la zone demander pour avancer dans l'histoire ?  Si non il est très joli graphiquement, certains truc sont un peut bizarre comme la nourriture, qui ne monte pas forcément la vie quand c'est des champignon.",2024-09-23 20:28:52,413,False
recommende,1,0.523809552192688,"J'ai adoré. J'aime rarement les jeux de survie, mais pour une fois j'ai pus jouer du début à la fin. Graphismes, art style, crafter sa propre base, c'est du bon. Un problème existant est coté combat où je ne comprend pas pourquoi les devs on nerf le fun à de multiples reprises. Le NG+ par contre...  à éviter complètement. Pour commencer c'est une augmentation forcé de la difficulté qui empire a chaque ng+, certain insectes devienne ""infusé""ce qui les rend complètement debalancé au niveau difficulté et encore pire pour les boss, du contenu bloqué uniquement derrière plusieurs ng+. je le  considère comme le nb1 de mon top trois des pire ng+.",2024-07-12 15:40:10,6035,False
recommende,2,0.523809552192688,"Que dire a part que ce jeu est incroyable. Je suis grand fan de jeu de survie et Grounded se démarque. L'histoire est prenante et personnellement m'a pris +-50h a finir, de quoi bien s'amuser. Même après ça il y a de quoi faire, avec les maj complète qui donne plein de chose a faire. La construction n'est pas parfaite mais si on y met du temps il est possible de faire des chose incroyable. La difficulté est variable ce qui peut donner un vrais challenge ou juste une expérience chill. Je tiens également a préciser que le service client est superbe, ils répondent rapidement et avec courtoisie. Je ne sais pas si il y aura un 2ème, mais si c'est le cas je l'attends avec impatience !!",2024-06-22 22:08:53,11399,False
recommende,2,0.5147058963775635,"Une dinguerie ce jeu, le contenu est génial, le gameplay est fluide et simple a prendre en main, l'univers est riche et magnifique, le bestiaire est bien garni, les constructions sont faciles et l'on peut du coup se construire vraiment des choses folles si on prend le temps. Un grand plaisir que d'explorer ce monde que l'on connait mais pas sous cette taille la vraiment 130 heures de jeu et je m'en lasse pas !",2025-03-01 02:49:15,7885,False
recommende,0,0.5,Un jeu de survie au contenu et à la richesse impressionnantes. Comptez 40-45 heures pour finir l'histoire à 2-3 personnes. Le fun et la découverte sont présents tout au long de l'aventure. Restez curieux car la map (très réussie) regorge de mystères et de bêtes pas sympas. Belle surprise !,2025-04-16 01:04:24,3181,False
recommende,0,0.5,"Je ne connaissais pas les jeux de survie à la base mais c'est sans aucun doute un des meilleurs jeux auquel j'ai joué depuis une dizaine d'années.  Nous avons commencé à 4 sur la beta, 2 sur PC et 2 sur Xbox. C'était incroyable de voir le jeu s’améliorer et s'enrichir. Nous avons adoré recommencer les quêtes d'histoire quand certaines grosses MAJ ce faisait, c'est pour dire comme le jeu est bon :). Tout a été excellent pour moi, le gameplay, les graphismes, le scénario, ... Rien que d'y penser j'ai envie de rejouer. Merci pour les 400h passées, c'était un régal !",2025-04-12 14:14:06,17932,False
recommende,0,0.5,Très bon jeu ultra complet et c'est rafraîchissant d'être minuscule et d'avoir un jardin comme niveau. Bref j'ai beaucoup aimé,2025-04-05 01:32:02,4901,False
recommende,0,0.5,"Excellent jeu de survie, bien trop sous-estimé !    L’open world est immense, les boss sont plutôt bien conçus, et honnêtement, si je devais énumérer tous les points positifs du jeu, j’en aurais pour des heures ! L’expérience est tout simplement géniale, surtout en multijoueur. Jouez-y avec des amis, car en solo, le jeu peut devenir un peu lassant sur le long terme.    Bien sûr, il y a quelques petits défauts, mais le seul qui m’a vraiment dérangé, c’est le lore. Je l’ai trouvé assez moyen et surtout mal exploité dans le jeu, ce qui est dommage. Mais à part ça, c’est une excellente expérience, ultra fun entre amis !    Et pour ceux qui aiment l’horreur, sachez que ce jeu saura vous faire peur plus d’une fois !",2025-04-03 20:01:21,2058,False
recommende,0,0.5,"Nice lore, base building is both useful and interesting AND it cured my arachnophobie",2025-03-29 03:04:14,1055,False
recommende,0,0.5,"Un jeu magnifique, vraiment génial. Les lucioles et les coccinelles ne sont plus vos amies ! Prenez le, vous allez vous éclater. Et après 250 heures, j'y retourne encore de temps à autre !",2025-03-27 22:44:49,15222,False
recommende,0,0.5,"Super chouette à faire entre amis, la construction, le gameplay, les combats sont vraiment tops ! Très très bon jeu !",2025-03-25 21:25:30,6650,False
recommende,0,0.5,"Pas le jeu de survie le plus poussé mais une très bonne immersion. c'est beau , c'est créatif et ça détend ... sauf si on a peur des araignées !",2025-03-11 08:59:13,1980,False
recommende,0,0.5,"Un jeu super complet dans le style survie et construction. La map est sublime et très cohérente, l'immersion est totale.  Grounded va clairement vous apprendre à fuir au début mais plus vous vivrez dans ce monde et mieux vous aller vous adapter. C'est que du bonheur après.  C'est une valeur sûr 👌",2025-01-26 13:19:30,7670,False
recommende,0,0.5,"Chérie, j'ai rétrécie des gosses! Ils sont perdue dans mon jardins!  Plus sérieusement, ce jeux était-il bon? Après une dernière mise à jour majeur, terminant globalement le jeux en matière de contenue. Il y a un constat qui se dégage de l'expérience. Le jeux est fun, à l'ambiance 80's marqué, récompense notre curiosité,  et l'histoire est sympathique. L'aspect survie est simple est efficace, la partie craft est très accessible et sera de paire avec votre exploration du jardin. Nos ennemie sont originaux pour un jeux de ce type et il y a une volonté d'encré le joueurs dans un jardin vivant au grès de nos action. Les personnages reste attachant, et la dimension de jouer jusqu’à 4 n'enlève pas le challenge que vous réserve le jeux. Une partie du jeux, considérer comme du challenge existe par la présence de Boss additionnel et du NG+. NG+ qui vous fait reprendre votre partie dans une version altérer de la réalité, ajoutant des modification visuel, des créature boosté avec des effet, des recettes spécifique par NG+ et la version plus difficile des boss existant. Des ajout, qui ne vous font perdre en aucun cas vos construction et item dans le processus, seul l'histoire est réinitialisé. Une belle prouesse!  Mais, il y a toujours de mauvaise surprise dans un jeux, le premier qui risque de frapper le joueurs est les nombreux insecte qui glitch dans le décor, en particulier les plus gros insecte. Il est notamment particulièrement courant de perdre un cadavre sous le sol. Les commandes clavier-souris sont pas particulièrement agréable et jouer à la manette sera plus adapté. Les dents qui font office de point de caractéristique, sont particulièrement chiante à récupérer dans le jardin sous NG+, leurs emplacement étant aléatoire...  Pour finir, même si le jeux souffre de bug (glitch particulièrement), il est, à mon sens, un excellent jeux de survie pour ceux étant débutant dans ce genre là, ou qui souhaite une expérience  survie/craft simple, mais efficace.",2025-01-21 09:50:20,9548,False
recommende,0,0.5,"Excellent jeu de survie/construction de base ! L'histoire est prenante, la possibilité de construction est fort sympathique aussi, je recommande vivement",2025-01-19 11:53:16,1851,False
recommende,0,0.5,"Un jeu qui peut être chill et complètement stressant en fonction de la situation. Pour les amateur de jeu bac à sable / survie / exploration, je recommande ce jeu !    + les graphismes sont super beaux + les ynsectes sont diverses et variés et très bien réalisé + la difficulté est bien jaugée, on peut éviter les conflits trop haut niveau le temps d'avoir le bon niveau + les constructions sont satisfaisantes à faire + le système d'effet passif très complet - peut paraître déroutant au début, on se sent lâché sans explication (ce qui colle avec le lore cependant) - les personnages parlent peut être un peu trop et tout le temps pour n'importe quoi",2025-01-18 10:25:44,2475,False
recommende,0,0.5,"Ce jeu est incroyable, une longue durée de vie! J'ai littéralement tout fait sur ce jeu et j'en m'en lasse toujours pas!",2025-01-09 15:07:43,21055,False
recommende,0,0.5,"vraiment sympa, ça change comme jeux de survie, accessible même pour les plus jeunes, c'est fluide sur un PC à la ramasse, y'a du contenu, une histoire, du builds, de la découverte, à faire à plusieurs",2025-01-09 01:30:51,5337,False
recommende,0,0.5,un des meilleur jeux que je conseille j'ai joue de pluie la fin de la béta et je ferait en difficile je les fait a 100% avant les nouveauté son les meilleur,2025-01-08 12:31:58,17047,False
recommende,0,0.5,"Ce jeu est génial ! On se croit dans ""chéri j'ai rétrécie les gosses"". Couleurs chatoyantes, pas de bug, progression toujours attrayante et jeu bien complet.",2025-01-08 01:52:27,7888,False
recommende,0,0.5,cool a faire avec vos pote j ai bien sur se ce jeux l aventure  l histoire et la créativité attention insecte effreyant je ne vous dit aller regarder ce jeux est une marge (incroyable),2025-01-07 22:21:51,3043,False
recommende,0,0.5,"Meilleur jeux de survie joué à ce jour, système simple, efficace et fun !",2025-01-01 22:33:40,4160,False
recommende,0,0.5,"swag et fun,  on peut avoir des petites choses en animal de compagnie.",2024-12-30 17:41:53,1990,False
recommende,0,0.5,Partie normale terminée en 80h en coop. Très belle expérience de survie. C'est très qualitatif comme jeu de survie. Tout est assez bien pensé.,2024-12-28 22:52:56,4664,False
recommende,0,0.5,JEU au mode survie et exploration sans prise de tete ideal pour jouer avec ses enfants ou des amis,2024-12-15 18:16:12,691,False
recommende,0,0.5,"Grounded est génial ! Très bon jeu à faire à plusieurs, les graphismes sont très beaux, un peu stylisé cartoon ! On peut construire, évoluer en stuff, partir à l'aventure, bref, c'est très complet ! On se retrouve tout petit, dans un univers ou les insectes sont plus grands que nous ! (attention à ceux qui ont la phobie des araignées ou autres)  Bref, je recommande beaucoup de fun et d'aventure !",2024-11-03 18:34:42,6980,False
recommende,0,0.5,Incroyable le jeu est grave complet il a sa partit de difficulté. Je vous le recommande vivement,2024-10-30 01:56:04,1915,False
recommende,0,0.5,"Super jeu mais j'ai pas accroché ! J'aurais adoré quand j'étais au collège ! A mon époque, c'était avant la playstation 1(...) il y avait super mario world, Zelda3 etc... Je pensais pouvoir retomber en enfance car à cette époque il y avait aussi un film intitulé ""chéri j'ai rétréci les gosses"" que j'avais adoré. Il est probable que je ne trouverais plus cela aussi bien, l'âge fait qu'on devient grincheux j'imagine.... Je conseille néanmoins de regarder cette pépite du cinéma familiale des 90's. Salut les kids et GG",2024-10-25 20:45:29,125,False
recommende,0,0.5,"Un bon jeu de survie à l'échelle microscopique.  Je dois en être à ma cinquième ou sixième partie bien avancée et je le recommance encore (jeu fini entièrement une fois)",2024-09-25 20:10:45,26482,False
recommende,0,0.5,"That game is amazing, from it's ambient, to the combat and craft, everything is perfect, a good survival game, to play alone or with friends !",2024-08-15 11:05:08,4909,False
recommende,0,0.5,"Histoire et découverte chouette, la visite des labos, un kiff a chaque fois, mais gameplay un peu robotique et les mutations pas ouf",2024-07-24 22:40:31,3501,False
