tag,helpful,weighted_vote_score,comment,date,minutes,early_access
recommende,6,0.5769230723381042,"Ce jeu est hors du communs, vous êtes miniaturisé dans un jardin, et vous devez survivre en craftant toutes sorte de trucs et en améliorant votre base , la quête  de base pour le moment est courte mais si vous aimez les jeux de crafts, sautez sur l'occaz le jeux est juste magnifique, on a vraiment l'impression d'être tout petit !!, la map est pas mal grande de quoi faire pour le moment et explorer les grottes également, ouvrez vos yeux la dedans car y'a des truc a récupéré, il y a plein de crafts et d'améliorations de base a découvrir déjà de quoi faire dans l'accès anticipé, les concepteurs du jeu ne sont pas n'importe qui c'est Obsidian mec !! promesse de mise a jours de contenu chaque fin de mois, que du bons à prévoir, le jeux est chaud en medium en solo mais une fois l'armure genre de coccinelle et un arc minimum, ou le club Ant le jeu deviens plus simple, ne restez pas sur place et profité des environnement en hauteur pour survivre. je vous recommande ce jeu je ne met pas souvent des évaluation mais la si c'est pour vous convaincre de vous amusé en solo ou entre amis je vous en fait part directement !!!",2020-08-07 09:14:30,1558,True
recommende,10,0.5752487778663635,"[u][h1]Mon Évaluation sur Grounded[/h1][/u]  [b]Bon... On va faire une évaluation rapide de ce jeu de genre Survie, Action, Aventure, Bac à sable. [/b] [i]J'ai réalisé cette évaluation une fois que le jeu à fini d'être développé à 100%, au niveau de l'histoire principale.[/i]  [b]Les Bonnes Choses :[/b] [list] [*] Un jeu bien pensé au niveau de l'histoire. [*] Du farm pur et dure !  [*] Les Laboratoires sont très bien caché. [*] Des crafts à la en veux-tu en voila ! [*] La construction de votre base prend du temps selon vos ressources récoltés. ( de plus c'est évolutif en fonction de votre progression) [*] Un choix de difficulté modifiable en jeu. ( Indulgent, Moyen,  Impitoyable) [*] Mise à jour régulière et ce depuis Septembre 2022. [*] Le choix de faire les boss ou non. (Vous pouvez finir le jeu sans affronter les 5 Boss sur 7) [*] Le mode multijoueur vous fera exploser de rire !  [*] Quand tu penses avoir fini le jeu, ta toujours quelques choses à faire en plus. [/list]  [b]Les Mauvaises Choses :[/b] [list] [*] Une histoire Anachronique... (Qui pratique une forme de confusion des époques et qui le fait consciemment.) [*] Un multijoueur avec encore quelques bugs (Vos alliés ne vois pas vos construction de temps à autres, ils ne reçoivent pas vos bonus...) [*] Si on ne fais pas une sauvegarde avant la fin du jeu, bha ... on à fini... [*] Personnellement je vois pas la différence entre une difficulté indulgente et Impitoyable... (SAUF POUR LES BOSS) [*] Parfois on est mal guider par le jeu, donc Oui faudra chercher parfois par vous même. [/list]  [b]Comme vous pouvez le voir, plus d'avantage que d’inconvénient pour ma part, après chaque avis est différent. Pour être bref, si vous aimez les histoires farfelue, le farming (Monster Hunter Like), le fun avec vos amis et des boss impitoyables.  Ce jeu est pour vous ! [/b]",2023-05-21 13:11:51,3986,False
recommende,4,0.5242847800254822,"Jeu très fun en solo et l'est encore plus à plusieurs !   En gros : Nous sommes dans un monde qui nous paraît immense alors qu'en réalité c'est nous qui sommes minuscule. Nous devons explorer pour survivre et découvrir ce qui nous est arrivés. Nos principaux amis et ennemis : les insectes. Alors OUI nous pouvons nous retrouver nez à nez avec des araignées MAIS pas de panique pour les arachnophobes ! Il y a un mode pour vous.   Jeu facile à prendre en mains, du craft et du farm, a plusieurs difficultés, a un mode créatif, est jouable jusqu'à 4. Je trouve la DA très jolie ainsi que le lore qui est tout aussi intéressant que le monde dans lequel nous évoluons.  Si vous aimez les jeux chill, de survie, explo, crafting/farming et Les Minimoys... Achetez. Il vaut vrrrrraiment le coup.  CONSEILS : Afin d'en profiter un max ; NE VOUS SPOILEZ RIEN ! La découverte est (selon moi) la meilleure partie du jeu !  EDIT : TRÈS TRÈS HYPE pour la sortie de la 1.0 ♥ Je vais repartir de zéro en mode difficile, pour toujours plus de fun.",2021-12-24 00:23:54,6149,False
recommende,1,0.523809552192688,"Jeu très sympa ! Expérience en coop uniquement pour ma part, et c'est top !",2025-05-04 11:15:55,253,False
recommende,1,0.523809552192688,"jeux complet et très immersif , jeux  vraiment complet , je recommande !",2025-04-26 15:00:11,208,False
recommende,1,0.523809552192688,L'un de mes jeux pref dommage que le jeu touche a sa fin via les majs. Je ne suis pas fan de endgame NG+ mais bon Le jeu reste un très bon jeu a faire une fois dans sa vie est super cute,2025-04-18 18:11:12,16419,False
recommende,1,0.523809552192688,"If you like survival games this one is a must! From all the survival games i own this one is the only one that I give 10 out of 10. Gameplay mechanic, story, ambiance, building, bosses and even music, Everything is amazing. After more than 600 hours I still love this game as much as day 1. Best survival game of all time for me.  I just have one question Obsidian : WHERE IS GROUNDED 2!!!!! I WANT MORE!",2025-04-17 19:20:02,38335,False
recommende,1,0.523809552192688,"Le jeu est très fun, avec une bonne courbe de difficulté, univers très cool, bonne histoire. toujours moyen de passé des heures dessus même après l'histoire principale finie",2024-11-02 02:05:11,9449,False
recommende,1,0.523809552192688,"Jeu très intéressant, change un peut la vision d'un jeux de survie basique, car on fait la taille d'une fourmis comme dans les films ""chérie j'ai rétréci les gosses"", certaines choses sont compliqué à comprendre comme, comment on débloque la zone demander pour avancer dans l'histoire ?  Si non il est très joli graphiquement, certains truc sont un peut bizarre comme la nourriture, qui ne monte pas forcément la vie quand c'est des champignon.",2024-09-23 20:28:52,413,False
recommende,1,0.523809552192688,"J'ai adoré. J'aime rarement les jeux de survie, mais pour une fois j'ai pus jouer du début à la fin. Graphismes, art style, crafter sa propre base, c'est du bon. Un problème existant est coté combat où je ne comprend pas pourquoi les devs on nerf le fun à de multiples reprises. Le NG+ par contre...  à éviter complètement. Pour commencer c'est une augmentation forcé de la difficulté qui empire a chaque ng+, certain insectes devienne ""infusé""ce qui les rend complètement debalancé au niveau difficulté et encore pire pour les boss, du contenu bloqué uniquement derrière plusieurs ng+. je le  considère comme le nb1 de mon top trois des pire ng+.",2024-07-12 15:40:10,6035,False
recommende,2,0.523809552192688,"Que dire a part que ce jeu est incroyable. Je suis grand fan de jeu de survie et Grounded se démarque. L'histoire est prenante et personnellement m'a pris +-50h a finir, de quoi bien s'amuser. Même après ça il y a de quoi faire, avec les maj complète qui donne plein de chose a faire. La construction n'est pas parfaite mais si on y met du temps il est possible de faire des chose incroyable. La difficulté est variable ce qui peut donner un vrais challenge ou juste une expérience chill. Je tiens également a préciser que le service client est superbe, ils répondent rapidement et avec courtoisie. Je ne sais pas si il y aura un 2ème, mais si c'est le cas je l'attends avec impatience !!",2024-06-22 22:08:53,11399,False
recommende,2,0.523809552192688,"Un grand OUI ! Tout simplement le meilleur jeu de craft/sandbox/survie/[insérer autres termes]. Grounded reprend les idées de tous ses prédécesseurs et les améliore ou les rend plus accessible. L'univers miniature est passionnant à découvrir, le gameplay est varié et gratifiant. La construction est flexible sans les lourdeurs des autres titres (Ark, The Forest ...). Le suivi du jeu est exemplaire.  A jouer de préférence en multijoueurs.",2023-12-21 11:24:54,3347,False
recommende,1,0.523809552192688,"C'est un jeu vraiment sympa à jouer entre amis, l'ambiance est cool et parfois on peut mettre se faire des frayeurs. C'est très amusant et l'évolution que propose le jeu au fil des heures est cool. Y'a vraiment une bonne histoire et aventure derrière !",2023-10-13 01:04:19,1513,False
recommende,1,0.523809552192688,"J'A-DO-RE  J'ai deux parties : une en solo ou j'ai beaucoup avancé, très sympa, mais le jeu à ses limites parce que seul, la fête est moins folle. Je l'ai relancé à deux avec mon frère récemment, et que dire : tout l'intérêt du jeu prends sens. La coopération, les bagarres à devoir gérer des adversaires ou des boss à plusieurs... incroyable.  La DA du jeu en plus est absolument incroyable, merci pour tout, et un immense GG.   Si vous aimez les jeux de survies en PVE, achetez le, vous n'aurez pas de regrets !",2023-08-17 05:55:16,4588,False
recommende,1,0.523809552192688,"Super jeu de survie, on avance tranquillement dans l'histoire plutôt bien pensée. le système de craft est pas mal, ainsi que les améliorations et les réparations. le jeu possède des mécaniques qui arrange la vie au max dans les jeux de survie comme la détection des coffres par l'établi et le rangement automatique dans les coffres. un bon rpg de survie en soit. immersion est également géniale, on se retrouve plongé dans le monde d’Arthur et les minimoys en soit x) Certes Il manque encore quelques options tel que des papillons pour avoir des ailes pour voler et ce plutôt en fin de jeu, ou la possibilité de monter des milles pattes ou des fourmies pour aller plus vite  ect . En bref ce jeux vaux particulièrement le coup.",2023-06-15 13:14:43,1940,False
recommende,1,0.523809552192688,"De loin l'un des meilleurs jeux de survie auquel j'ai pu jouer. (Pour ceux qui trouve le jeu trop dur en solo diminué la difficulté et c'est réglé. ;))  Petit bémol sur le Tier III en terme de quantité d'armes/armures qui pour moi arrive beaucoup trop tard dans le jeu, ce qui ne laisse pas assez le temps d'en profiter comparer au Tier II.  ( [i] ≃ 70h Solo / ≃ 70h Duo - Fini à 98% [/i] )",2023-01-20 19:18:09,8132,False
recommende,1,0.523809552192688,"Bon jeu dans la même veine que The Forest dans le style de construction, après bien sûr, rien à voir pour l'ambiance. L'histoire est sympa. Sympa à plusieurs",2023-01-04 16:03:44,5337,False
recommende,1,0.523809552192688,"Que dire de Grounded, une perle à découvrir..., le 1er jeu où tu es de la taille d'un insecte, les coccinelles se baladent, les cafards, les araignées (mieux les éviter surtout au début), pleins de petites bestioles, bref un vrai petit monde à explorer et vivant. De beaux graphismes (cartoon) et d'effets lumières. Des missions à faire, beaucoup de craft pour améliorer tes capacités, construire sa base. nouvelles armes.. bref Il est super et fait aussi du bien de jouer à ce style de jeu. Tu te rends plus compte de l'importance de ne pas laisser des déchets au sol.",2022-12-26 18:49:17,929,False
recommende,1,0.523809552192688,"Chéri, j'ai rétréci les gosses, version sandbox. Histoire très sympa à suvire, les talents vocaux font un superbe travail, et les options de personnalisation sont très bienvenues.",2022-12-14 23:37:44,2192,False
recommende,1,0.523809552192688,"Super jeu en coop avec des potes, bonne histoire, très bon gameplay. Un must have du genre.",2022-10-25 00:07:54,9513,False
recommende,1,0.523809552192688,"Meilleur jeu de survie auquel j'ai joué ! Graphisme Incroyable, Gameplay / Plot Originaux alors que le jeu n'étais encore qu'en BETA !! Je recommande fortement ce jeu aux adeptes du Base Building / Survie / Farming comme moi :D !! ( Les Fans de Subnautica, venez !! C'est la même chose mais sur terre :D )",2022-09-27 18:12:11,6116,True
recommende,1,0.523809552192688,"Bon, le jeu est pas fini donc bug un peu mais le reste est je trouve génial les graphismes, l'histoire, la map, les monstres, et bien d'autre encore !",2022-08-21 15:27:16,616,True
recommende,1,0.523809552192688,"ENORME !!!! on a adoré avec un pote, pleins de petits detail realiste super sympa et cool a vivre en jeu et une trés belle aventure pleines de risques. ON VEUT PLEIN DE CONTENUES !!!!!",2022-02-11 19:00:22,3187,True
recommende,1,0.523809552192688,cest un gros gg pour ce jeux les mécanique combat construction survie arme armure tout est trés bien pensée l'exploration est excellente et vaste juste petit bemol c est le seul jeux survie que je connais ou on ne peut pas pécher lol sinon ce jeux est tout bonnement un Bengers ! ;),2021-08-08 04:34:20,1574,True
recommende,1,0.523809552192688,"Le jeu est super mais le manque de contenu est flagrant surtout pour le prix on s'attend à plus. Selon moi, le jeu vaudra la peine lorsqu'il sera terminé, car il y a peu d'objectifs à réaliser pour le moment surtout si vous jouez en équipe !",2021-04-30 23:37:41,1746,True
recommende,1,0.523809552192688,jeux vraiment sympathique beau graphique. je trouve que l'univers pour un jeux de survie est bien penser c'est agréable d'y jouer :) il y a meme un mode arachnophobe au cas ou .  je trouve que le seul petit problème c'est que les 1 er jours c'est compliquer de trouver de l'eau,2021-02-26 13:34:06,302,True
recommende,1,0.523809552192688,"Superbe jeu ! J'en suis à plus de 300 jours de survie et le jeu est toujours aussi passionnant (133.6 heures de jeu en tout) Pas mal de bug au début (accès anticipé) mais les développeurs ont rapidement redressés la barre, mise à jour régulière et des développeurs qui prennent réellement en compte les demandes des joueurs. Je recommande vraiment ce jeu ! Il en vaut vraiment le coup ! Aussi bien en solo qu'en multi. Communauté GROUNDED FRANCE super cool et qui aide les novice, n'hésitez pas à les rejoindre !",2020-12-03 16:01:24,8014,True
recommende,1,0.523809552192688,"J'adore ce genre de jeu, de construction/survie à plusieurs, j'y ai donc naturellement joué à sa sortie avec 2 personnes, et on a fait le tour de l'histoire à l'époque, après environ 15h de jeu (en mourant, et en explorant beaucoup), j'attends que le jeu soit à un stade plus avancé pour y jouer de nouveau, et j'ai vraiment hâte de voir les nouveautés qui sont en développement actuellement, car je compte bien dépasser les 100h de jeu dessus à terme.  EDIT 124H: J'ai repris le jeu récemment avec un ami, et c'est toujours un pur bonheur, le nouveau système de tyrolienne (avec la possibilité de les remonter) est juste BEAUCOUP TROP stylé, on a aussi accès au nouveau ""jardin supérieur"" et l'histoire est enfin complétée. J'ai passé presque 70h sur le jeu en à peine 1 semaine tellement j'étais plongé dedans et je ne suis pas prêt de m'arrêter et j'ai vraiment hâte de voir les nouveautés qui vont être apportées au fil des futures updates.",2020-11-28 14:06:15,1092,True
recommende,1,0.523809552192688,Une excellente surprise de l'année 2020. Un jeu qui peut sembler un nième jeu du genre bac à sable qui mais arrive à se démarquer grâce à une ambiance unique et des références saisissante.  Et le meilleur reste à venir semble-t-il.,2020-11-26 20:51:33,2722,True
recommende,5,0.5726495981216431,"[h1] Chérie j'ai rétréci les gosses...  [/h1]  Un film de 1989 pour ceux qui s'en souviennent, franchement une très bonne découverte, une très belle ambiance et le tout dans un environnement sonore fort agréable. Vis ma vie de fourmis, ou les échelles de tailles sont respectées, quel bonheur de rencontrer des ladys bugs et de fuir les araignées ""tueuse"". Une histoire qui ne devrait pas sortir de derrière les fagots et un système de crafts qui soit dit en passant à foison, de la conception d'une arme à main (gourdin couteau) ou à corde (arc arbalète) en passant par le housing de sa cahute personnalisée , tout ou presque est très primitif mais un effort a été fait vraiment sur un visuel riche, en espérant que ça reste ainsi. Un bon portage sur PC, plusieurs choix et surtout un grand espace de liberté, pas forcément obligé de suivre l'histoire et c'est déjà énorme pour le moment comme découverte.Multi qui plus est, alors pourquoi ne pas essayer et passer à côté d'une pépite qui se rapproche très fortement d'un subnautica premier du nom, d'un astroneer pour l'ambiance plaisante et enfantine",2022-11-29 13:02:22,601,False
recommende,6,0.5719339847564697,"Super jeu de survie, tourne plutôt bien sur un pc moyen, donc très bien optimisé.",2022-09-29 22:15:04,112,False
recommende,1,0.52173912525177,"De la survie, du craft et une story line. Tout cela dans un rêve d'enfance, participer à ""Chérie, j'ai rétrécie les gosses"", avec une ambiance Stranger Things. Je recommande pour les amateurs du genre.",2022-08-26 09:14:19,1734,True
recommende,2,0.52173912525177,"Super jeu, mais la connexion à Xbox ne devrait pas être obligatoire pour jouer en ligne, si on a pas de compte on arrive pas à se connecter...Se créer un compte nous oblige à avoir un nouveau courriel etc...etc... C'est du niaisage selon moi, mais le jeu est très intéressant.",2021-08-14 22:27:18,654,True
recommende,8,0.571301281452179,Les Pucerons ils sont trop mignon !  Le meilleur jeu du genre pour moi. Le dernier BON jeu d'Obsidian.,2023-05-04 06:41:51,6618,False
recommende,4,0.5683453679084778,super incroyable je peux pas m’arrêter je m'amuse trop sur se jeux qui est trop bien fait je le recommande a toute le monde,2023-10-11 21:01:19,6637,False
recommende,6,0.5670995712280273,"Encore un peu jeune (l'histoire se fait en 5 minutes) mais tellement prometteur. Plein de bonne idée sur les crafts, l'univers est beau, logique et étonnamment terrifiant. Hâte de voir la suite !  Edit :  après 2 vraies mise à jour, Grounded vaut son prix. Encore plus de craft, un lore qui se construit de mieux en mieux, plus de zones, plus de monstres, de nouveaux biomes, des nouvelles ressources... On est loin du temps où l'histoire se finissait en 5 minutes!",2020-08-18 13:29:59,2411,True
recommende,5,0.5658072829246521,"Nous avons découvert ce jeu par pur hasard, regardé la bande annonce, et on s'est dit, ça a l'air vraiment cool ! Alors on a acheté le jeu, et commencé à jouer... c'est juste tellement adictif ! j'adore le jeu, tout jeune et pourtant si complet ! Tu peux jouer jusqu'à 4, construire ta base à la ''ark'', tu analyse des objets pour en créer des nouveaux, tu combats des insectes plus ou moins puissant (attention à l'araignée wolfe), et il y a à travers ça, une histoire sur comment et pourquoi vous êtes à la grandeur d'une fourmi. c'est clair aussi qu'ils vont rajouter des mises a jour ! Je vous conseille fortement ce jeu pour des heures et des heures de plaisir !",2020-08-28 17:20:08,356,True
recommende,3,0.5652173757553101,"Tout est top, un des meilleurs survival games du marché. La courbe de progression donne un sentiment d'accomplissement tout au long du jeu, le Level Design est très soigné, on prend plaisir à explorer le jardin et découvrir de nouvelles zones/ ressources et ennemis.  Le système de combat nécessite un peu d'apprentissage des timings mais est très agréable une fois pris en main. La narration est fluide et les personnages attachants. Un jeu aux mécaniques classiques qui se démarque par l'originalité de son univers et son utilisation, mais aussi par la qualité de son Game Design.  On peut cependant noter quelques longueurs vers la fin du jeu lorsque l'on joue safe (la première fois en général), et un fight final assez compliqué. Le 100% est un vrai challenge et on peut se laisser surprendre par la difficulté de certains objectifs secondaires. De même, le fait de devoir acheter toutes les améliorations demande beaucoup de science brute et prend pas mal de temps, et collecter toutes les molaires/ mutations/ documents et montres dispatchés sur la map demande beaucoup de temps et d'efforts. Mais, mis à part le 100%, le jeu se termine sans trop de problèmes.  Cependant le jeu reste très plaisant à explorer, je recommande de jouer à plusieurs car, bien que la difficulté scale en fonction du nombre de joueurs, les phases de boss sont bien plus amusantes en groupe.  Si vous aimez les survivals, à tester absolument seul ou entre amis.",2023-07-22 21:09:48,6330,False
recommende,4,0.5652173757553101,"Certes, je suis qu'au début du jeu (16h en tout) mais je peux vous affirmer que mes 30€ sont largement rentabilisé. Le jeu nous propose une immersion totale avec des graphismes à mon goût exceptionnel ! Si vous aimez les jeux types farming et survie vous ne serez absolument pas déçu. Le jeu nous propose tellement fonctionnalité par exemple pour les constructions c'est incroyable ! Pour les personnes qui ont peur des araignées il y a même la possibilité qu'elle fasse moins peur, ils vous le propose des que vous lancer le jeu.",2022-08-01 16:38:21,966,True
recommende,3,0.5652173757553101,"Ecrit le 28 Août 2021 ^^ Tu as aimé ""Chérie j'ai rétrécie les gosses"" ou ""Chérie nous avons rétrécie"" ?  ..... Alors ce jeu est fait pour toi !  Retrouvé à la même taille qu'une fourmi, tu te verras devoir survivre dans un monde bien grand et pourtant à nos yeux bien petit ^^ Survie et Exploration sont au rendez-vous, accompagnée de ses Crafts bien en raccord avec l'univers du jeu. Farming, Construction, Culture sont tout aussi accessible pour permettre au joueur de survivre du mieux que possible face aux dangers de ce si grand petit monde ^^ je pourrais en écrire et en détailler tellement plus mais je vous laisse le plaisir de le découvrir ^^  Toujours en hésitation ? Oui il est encore en Early Acces et pourtant tellement complet pour son coté Bac à Sable ^^ (une partie de l'histoire, qui s'annonce bien délirante est déjà présente)  Les Maj sont plus que régulières et on sent très bien l'engouement des créateurs envers leur petit bébé qui est voué à bien grandir ^^ Non vraiment si tu as aimé le film et que comme moi tu as rêvé de pouvoir y jouer, tu peux l'acheter les yeux fermé ^^ PS : j'en suis à 347h lors de sa sortie définitive et toujours autant envie d'en découvrir plus ^^ Et un an après sa sortie Def on voit une 3ème G.Maj sortir excellent merci Obsidian ^^",2020-08-25 18:35:05,288,True
recommende,2,0.5147058963775635,"Une dinguerie ce jeu, le contenu est génial, le gameplay est fluide et simple a prendre en main, l'univers est riche et magnifique, le bestiaire est bien garni, les constructions sont faciles et l'on peut du coup se construire vraiment des choses folles si on prend le temps. Un grand plaisir que d'explorer ce monde que l'on connait mais pas sous cette taille la vraiment 130 heures de jeu et je m'en lasse pas !",2025-03-01 02:49:15,7885,False
not recommende,32,0.5104889273643494,"OBLIGATION d'avoir un compte Xbox ou Microsoft pour jouer en Multijoueur, ça serait bien de le préciser AVANT que l'on achète le jeu. Vous n'avez pas encore été rachetés par EAGames pourtant il me semble, alors pour faire simple, LAISSEZ MOI JOUER SUR STEAM AVEC UNIQUEMENT UN COMPTE STEAM !!! Je demande un remboursement.",2020-10-14 10:24:05,34,True
