tag,helpful,weighted_vote_score,comment,date,minutes,early_access
recommende,48,0.8171908855438232,"[h1] STOP ! Ce jeu est BIEN !! [/h1]  J'ai fini plusieurs fois les 3 Dark Souls, Elden Ring, BloodBorne, Sekiro.  Je peux vous dire que Lords of the Fallen n'a absolument pas à rougir face à ces mastodontes ! Bien sur qu'il n'est pas parfait mais sérieusement je ne comprend pas comment ce jeu peut avoir des évaluations moyennes, je trouve ça injuste. Voici ce que le jeu vous propose : - [b] Une expérience SoulsLike Classique [/b]. Le fait qu'il n'y ait pas de monde ouvert n'est pas un problème en soi, il s'agit de parcourir des donjons, des zones labyrinthiques, de débloquer des passages, déverrouiller des portes, etc... (pour moi c'est même carrément mieux qu'un monde ouvert : c'est dense et riche) - [b] Une direction artistique de FOU !  [/b] ! C'est beau et c'est dark. Ce que l'on attend d'un tel jeu. Le jeu est très proche de BloodBorne au niveau de son ambiance (ce qui est évidement un compliment) -[b] La double mort [/b] comme dans Sekiro, à ceci près que cela nous fait basculer dans une version alternative du monde encore plus dark.  - [b] Un gameplay tout à fait respectable [/b] : personnage fluide, styles de jeu nombreux - [b] Un level design exemplaire [/b] : on frise le dark Souls 1, mieux que dark souls 3. Des zones qui se rejoignent, un monde cohérent, des chemins variés, on se perd, on se retrouve avec joie, il y a des raccourcis, de la verticalité, et les deux mondes alternatifs proposent chacun leur petites différences (passages secrets, trésors cachés, ect...)  Ceci dit, voici ce qu'on peut noter :   -Les boss sont biens mais ne sont pas le point fort du jeu. Le point fort du jeu est le plaisir de l'exploration des zones. Beaucoup de boss sont en réalité des ""mini-boss"" que l'on passe en un essai, et qui reviennent souvent sous la forme d'ennemis classiques par la suite. Cette répétition des ennemis peut être vu comme un défaut du jeu. Cependant calmons nous, il y a de belles pépites dans les boss de ce jeu tout de même. Et puis qui a dit que les boss devaient forcément être des murs sur lesquels on doit se casser les dent 100 fois avant d'y arriver ? Souvenons nous du recyclage dans Sekiro, dans Elden Ring. Souvenons nous de certains boss des Souls loin d'être mémorables.... Ici vous aurez des boss de légende, et des boss qui sont juste des gros combats. Et franchement ça va.  -Le tuto n'est pas très bien fait et je pense en a rebuté plus d'un. En effet beaucoup d'informations sont délivrées d'un coup, notamment les nouvelles mécaniques de la lampe spécifiques à ce jeu. Encore une fois calmons-nous : ces mouvements mettent peu de temps à s'apprendre, et ce sera bien moins pire que lorsque vous avez du apprendre à jouer à un Souls pour la première fois. Un petit effort d'adaptation comme aux premiers temps, et vous voila partis !  -Le monde alternatif (Umbral) présente une mécanique différente du monde normal dans le sens où des ennemis vont apparaître à intervale réguliers, et de plus en plus avec le temps qui passe jusqu’à ce que vous arriviez à repasser dans le monde normal. Oui, vous risquez d’être entouré d'ennemis mais c'est à vous de les gérer et de prendre ça en compte pour réussir. L'umbral est conçu pour que vous ne vous sentiez pas tranquille, même l'ambiance sonore est de plus en plus oppressante pour vous le signaler. L'idée est de vous faire ressentir l'angoisse et le stress, le sentiment d’être une sorte d'explorateur sur une planète très hostile, avec peu d'oxygène pour tenir. Trouvez le moyen d'en sortir et vous pourrez ""respirer"". C'est le challenge original que vous propose le jeu. C'est un peu aussi sa marque de fabrique. Et l'ambiance dans l'umbral est géniale je trouve, bien oppressant.  [b] CONCLUSION [/b] : ce n'est pas parce que les Fromsoft sont exceptionnels que vous devez vous priver de jouer à ce jeu qui les talonne de près. Souvenons-nous de nos premiers moments sur les Souls, l'adaptation est la clé. Chaleureusement recommandé",2024-05-31 01:03:46,2289,False
recommende,64,0.81498122215271,"[h1]Lords of the fallen, le génie incompris.[/h1]  [h2]Contexte:[/h2] Je suis assez friand des jeux de type Souls Like tel dans le sens ""large"" du terme (J'y inclus des titres tels que NioH ou Wo Long, qui sont pourtant d'avantage proches des Gaiden, mais soit).  [h2]Condition:[/h2] Le PC est plutôt solide, je n'ai de ce fait pas rencontré de problème majeur technique, je n'ai pas eut la [u]malchance[/u] de pouvoir juger le jeu sur ce point. Cela dit, il est important de noter que même avec une configuration correcte, le CPU chauffe comme rarement [i](13700k)[/i], il est sollicité de manière inconsidérée, bien que cela n'ait altéré mon expérience.  [i][u]PS:[/u][/i]  Je comprend que d'autres joueurs puissent expérimenter des conditions de jeu défavorables dû à des soucis divers, et leurs griefs sont plus qu'ouissible.  [h2]Ressenti point par point:[/h2] [list]     [*] J'ai débuté le jeu en comptant les minutes. Le tutoriel me semblait interminable, confus, exécrable. Je me suis arrêté à 115 minutes de jeux à me demander, après le premier véritable boss, si je n'allais pas juste demander remboursement. Premier boss qui, sans discipline, peut rebuter par ailleurs, bien que perspectivement, il n'est que là pour donner les clefs du gameplay et du savoir faire à acquérir.      [*] La curiosité l'emporte, le tuto, très omniprésent, pour ne pas dire oppressant, avait quasi disparu en fin de première zone. Il n'était plus que de bon augure que d'avancer.     [*] Résultat: L'univers s'étoffe, les protagonistes de dessinent, l'univers aussi. Le tout semble riche et bien orchestré.     [*] J'occis à tour de rôle des ennemis de plus en plus importants et coriaces. Un dessein se dessine, j'entrevois mon véritable rôle.     [*] Je me perd, je fouille, je me retrouve sur des chemins, de toute part confondu, je me sens perdu. Puis... Je me rend compte que des cartes plutôt explicites aident, en somme, je suis bête, j'exploite pas assez le jeu et ses informations.     [*] J'exécute bêtement ce qu'on me demande, mais toujours avec cette question ""est-ce vraiment ce que je *dois* faire ?     [*] Je finis le jeu... Et je relance une nouvelle run, je veux vérifier des éléments.     [*] Le jeu se veut en fait encore plus riche et abondant que sa prime proposition, je suis juste béat ! [/list]  [h2]Explication:[/h2] Ce jeu est une oeuvre qui demande à s'investir en son univers, ses protagonistes et leurs desseins. Sans quoi, il n'a pas de sens, au pire, c'est un défouloir dont n'importe quelle solutions, vide de sens, débloque sur le chemin à suivre, mais cela n'apportera rien d'autre.  Je recommande ce jeu aux individus souhaitant démêler un puzzle, qui bien que simpliste, propose des alternatives plus poussées. il propose une exploration sur deux plans qui poussent la curiosité, la vérification et l'expérimentation des intrications potentielles. Certaines mises en abîmes sont intéressantes et bien orchestrées.   De par sa qualité narrative, il pousse également à comprendre les enjeux de ses compagnons pour leurs permettre d'atteindre leurs objectifs. Bref, il reprend la formule du Souls Like et la boost avec d'avantage d'accessibilité sans pour autant être trivial.  Au final, [b]LES[/b] fins ont toute sens, qui nécessitent de comprendre notre place, notre monde et les protagonistes. Échanger est donc important.   [h2]Défauts:[/h2] [list]     [*]Un des pires tutoriel existant sur un jeu de ce calibre.     [*]Un premier VRAI boss qui peut décourager alors qu'il n'est pas compliqué, juste mal mené.     [*]Un système de ciblage odieux.     [*]Un Umbral sous exploité, j'aurai aimé d'avantage de dichotomie entre les deux univers. L'Umbral n'étant généralement qu'une surcouche torturée du réel avec quelques passages supplémentaires. Le réel n'ayant que rarement de distinctions propres.     [*] Une possibilité trop aisé de se perdre sur nos objectifs. [/list]  [h2]Conclusion:[/h2] Selon moi, Lords of the Fallen propose une alternative solide, si ce n'est plus complète que certains opus, du genre Souls Like.  Il a une identité propre, des mécanismes innovants et intéressants, le tout, couplé à une capacité à se démarquer grâce à un story telling moins cryptique, plus accessible, bien que manquable pour qui s'en moque.  Bien qu'il ait pu me faire douter durant quelques heurse, il en résulte que désormais, je recherche chaque parcelle de lore et toutes les fins alternatives en suivant les compréhensions que j'ai de l'univers. Une réussite qui, j'espère, portera une suite ou, à minima, des jeux similaires de la part du studio !",2023-11-02 02:06:53,6887,False
recommende,38,0.6901212930679321,"Je ne prend jamais le temps de mettre des avis sur des jeux mais la quand j'ai vu les commentaires du jeu qui peut être refroidiront certain je me dis que la il faut quand meme rééquilibré la balance - Pour l'optimisation: Le jeu tourne TRÈS bien j'ai un bon pc mais pas non plus une machine de guerre comme je peux lire chez certain qui se vantent d'avoir une 4090 et qui n'arrive pas a le faire tourné correctement il va falloir m'expliquer. Mon jeu tourne en ultra depuis le premier jour. Et pour ceux qui se demanderai j'ai donc un processeur Intel(R) Core(TM) i7-10700K, 16 Go de ram et une RTX 3070. Aucun souci, de léger ralentissement quand je suis arrivé dans certaine zone mais rien de dramatique et qui n'ont jamais durée et qui sont assez rare - Pour le contenu: je suis assez bluffé, je ne connais pas la licence même si je suis habitué au souls-like et j'ai été surpris c'est fluide, le gameplay est bien réalisé, des moveset assez varié en utilisant une ou deux armes et un panel d'arme pour l'instant ou j'en suis plutôt bien garnie et pour tout les gameplay que ça sois pour les joueur only cac plus polyvalent dans les stats ou même les joueurs qui utilise only magie ou mix entre les deux. La mécanique de la lanterne était un peu bizarre au début j’étais retissant mais au final très très agréable et qui demande une certaine minutie en fouillant chaque zone - Pour le multi: J'ai donc un peu moins de 30h sur le jeu dont 25 bonne heure à 2 sans aucun crash juste une perte de du multi une seul fois mais sinon RAS. Un seamless coop classique , très agréable une fois invoqué votre partenaire peut être res en cas de mort part vous (mais pas l'inverse ) il n'y a pas besoin de le réinvoquer en permanence comme dans un darsoul et il peut loot a peu prés tout, les loot des mob comme des boss, seul les loot unique qui sont sur la map ou les coffres sont accessible uniquement par l'hôte ( logique sinon rien que pour l'augmentation des fioles de vie ça serait n'importe quoi) il faudra donc si vous faite le jeux a plusieurs passé d'un monde a un autre si vous voulez etre sur un pied d’égalité pour les amélioration mais une tres bonne expérience coop pour l'instant. En revanche le PVP n'est pas encore au point, les combats sont pas mauvais meme plutôt agréable mais envahir des gens et atterrir dans des zones que vous n'avez pas fait ou alors être bloqué a cause de mécanique du jeu utilisable uniquement par l’hôte est problématique ou encore tombé sur des gens bien plus haut niveau, même sans le savoir cela se vois au stuff de la personne en face mais je suppose que l'équilibrage ce fera avec le temps et la quantité de joueur sur le jeu   Voila bon courage et merci a ceux qui vont lire ce commentaire. Bonne Games !",2023-10-16 17:26:45,1734,False
recommende,15,0.6860290765762329,"---{ Graphismes }--- ☐ Qu'est-ce que la réalité ? ☑ Magnifique ☐ Beau ☐ Décent ☐ Mauvais ☐ Faut pas trop s'y attarder ☐ MS-DOS  ---{ Gameplay }--- ☑ Très bien ☐ Bien ☐ C'est juste du gameplay ☐ Mehh ☐ Je préfère regarder un troom troom ☐ Non  ---{ Audio }--- ☐ Eargasm ☐ Très bien ☑  Bien ☐ Pas trop mal ? ☐ Je préfère entendre un corbeau chanter ☐ Je suis sourd mtn  ---{ Public ciblé }--- ☐ Enfants ☑ Ados ☑ Adultes ☐ Tout public  ---{ Pc requis }--- ☐ Tranquille si Paint se lance ☐ Patate ☐ Décent ☑ PC gamer ☐ PC très cher ☐ Demande à la NASA de t'en prêter un  ---{ Difficulté }--- ☐ Appuyer sur ""Z"" ☐ Facile ☐ Faut un peu réfléchir ☐ Prise en main facile / Difficile à maîtriser ☑ Difficile ☐ Dark Souls  ---{ Histoire }--- ☐ Pas d'histoire ☐ Un peu de lore ☐ Moyen ☑  Bon ☐ Adorable ☐ Meilleur scénario  ---{ Temps de jeu }--- ☐ Le temps de te faire un café ☐ Court ☐ Moyen ☑ Long ☐ Vers l'infini et l'au-delà  ---{ Prix }--- ☐ Gratos ☐ Vaut largement son prix ☑ Si c'est en soldes... ☐ Si t'as un peu d'économies ☐ N'achète pas ça. ☐ Brûle ton argent, au moins ça réchauffe  ---{ Bug(s) }--- ☐ Qu'est-ce ? ☐ Très légers et non dérangeants ☑ Petits bugs ☑ Peut être ennuyant ☐ ARK: Survival Evolved ☐ Cyberpunk 2077  ---{ Note/10 }--- ☐ 1 ☐ 2 ☐ 3 ☐ 4 ☐ 5 ☐ 6 ☐ 7 ☑ 8 ☐ 9 ☐ 10",2024-12-01 12:55:01,4699,False
recommende,44,0.6807767152786255,"Je vous en supplie n'écouter pas les bougs qui ont 2H de jeu et qui n'ont pas passé le premier boss et qui ose dire que le jeu est nul…  Pareille pour les crashes, oui, il y en a eu, mais quand on regarde les fréquences des patchs, on s'aperçoit que derrière, c'est réellement une équipe de développeurs et développeuses de passion,  jouer au jeu ou soufrer en l'essayant, mais si vous êtes un minimum fan de la formule souls like, assurément LORDS OF THE FALLEN est une destination de rêve  EDIT : Je suis bien content d'avoir eu confiance en ce projet, a peine les premiers joueurs et joueuses a avoir fini le jeu pour passer en NG+ et faire remonter au studio leurs mécontentement du système de vestiges, que voici 2 semaines après un nouveau système de NG+ 0 /NG+ 1,2,3 et on apprend qu'ils travaillent sur un mode NG+ réglable pour modifier la difficulté comme on le souhaite.... (il font le taff des moddeur bhahaha)   JOUER A LORDS OF THE FALLEN",2023-10-19 06:55:54,2467,False
recommende,15,0.6573296189308167,"Avant de commencer, j’espère que le studio lis les retours, sachant que des français travaillent chez HEXWORKS, ce serait vraiment intéressant si nos avis sont lus. La licence ayant un fort potentiel, la suite pourrait vraiment être proche de la perfection sans les défauts que je vais énumérer dans cette note.  Pour placer un peu de contexte, je suis un admirateur de la saga des Souls du talentueux studio From Software. Et nul doute que beaucoup de joueurs de Lords of the Fallen 2023 sont comme moi. Loin de moi l’idée de cracher gratuitement sur le titre et là n’est pas l’objet de mon texte. Je vais certes insister sur ce qui m’a, à juste titre, gâché mon expérience de jeu sans oublier néanmoins les Ô grandes qualités que Lords of the Fallen possède. Finalement, et c’est là tout le paradoxe, ses plus grandes qualités sont effacées par son plus grand défaut qui prend vite le dessus, notamment sur les 15-20 dernières heures. J’y reviens un peu plus tard.  Commençons tout d’abord par ce que j’ai apprécié si vous le voulez bien.   Son world design et son level design n’a rien, mais alors rien à envier à la saga Dark Souls. Son world design où toutes les zones sont interconnectées et surtout, cohérentes, m’ont rappelé ma fabuleuse découverte de Dark Souls premier du nom. Et que dire du level design tortueux qui nous donne le tournis que l’on aime tant. Le boulot de ce côté là est exceptionnel. Il faut à tout prix garder cette force et ne pas partir sur un monde plus dirigiste comme Dark Souls 3 a pu le faire.  Autre grande qualité, sa direction artistique. Je souhaite exprimer toutes mes félicitations à l’équipe artistique qui nous livre ici un monde dantesque. Le plaisir que j’ai eu à découvrir chaque zone est indescriptible tant la beauté m’a fait briller les yeux. Splendide. Le monde des morts, Umbral, n’est pas en reste pour autant. Là encore, les artistes ont su trouver une inspiration qui force le respect. Tout est cohérent avec la zone que l’on traverse. Terrifiant à chaque instant, Umbral ne cesse d’étonner.  La bande son est globalement de très grande qualité. Il manque tout de même des thèmes marquants pour qu’elle se hisse à la hauteur de la bande son de Motoi Sakuraba et Yuka Kitamura.  La variété des builds est excellente. Rien à dire là-dessus, tous les styles de jeu sont représentés, la rejouabilité est infinie.   Un arsenal d’armes et d’armures stupéfiants. Mention spéciale au design des armures qui sont superbes. Encore un fabuleux boulot de l’équipe artistique. Ces gens méritent un Oscar.  Gameplay qui fait ce qu’on lui demande dans un Souls Like. J’ai apprécié pouvoir enchaîner des combos une main/deux mains sans coupure.  Les boss sont pour la majorité intéressants selon moi. Des bons chara design, des bons patterns. J’ai pris plaisir à les affronter. Le boss [spoiler] la Juge Clerc [/spoiler] est mon boss favori !  Venons-en maintenant au gros point noir du titre qui m’a réellement gâcher le plaisir de jeu. J’ai même pensé à abandonner tellement j’étais frustré. Ce défaut est le nombre abusif des ennemis sur la carte.  Aux alentours du milieu de jeu, le placement des mobs devient totalement imbuvable. Nous avons des mobs élites par pack de 2 ou 3 + des chiens par pack de 3 ou 4 + des chiens de feu par pack de 2 ou 3 + des sorcières qui balancent des sorts à plusieurs kilomètres à la ronde sous nos pieds + des snipers à tous les coins de la zone qui ne nous ratent jamais et qui nous aggro à 500 mètres et plus ! Et tout ça en même temps. Et je ne parle même pas du monde Umbral où l’on a tout ça combiné à la vingtaine de mobs de l’Umbral qui nous pourchasse également ! Je rajoute également le lock des cocons dans l’Umbral qui ne sert à rien et qui nous empêche de grab un trésor en vitesse quand on est submergé d’ennemis.  C’est infâme, infâme. Et c’est en ça que je disais précédemment que ce défaut efface les qualités. Avec ce surplus de mobs, on ne profite plus de la DA, on ne profite plus du level design. On passe son temps à courir au hasard en espérant trouver le chemin avant de se faire tuer par le sort d’une sorcière qui se situe à 10km au-dessus ou en dessous de nous ou se faire bloquer par une vingtaine de mobs dans un coin de mur ou une porte en voulant faire marche arrière.  Pour être franc, le jeu n’est pas passé loin d’être une perfection dans son genre. Lords of the Fallen est à deux doigts d’avoir compris la formule d’un Dark Souls. Il a presque tout, presque. La difficulté des Souls ne vient en aucun cas des packs de mobs abusifs, qui n’existent pas dans la licence précédemment citée. Si une suite existe, par pitié, ne faites plus cette erreur. Jouez encore aux Souls (le 1er et le 3ème, le 2 en version SOTFS est un peu abusif niveau placement de mobs également) et analysez les placements des mobs.  En conclusion, Lords of the Fallen est un excellent Souls like, c’est même le meilleur Souls like à ce jour. Il loupe le coche uniquement sur le placement des ennemis. Un point qui me semble facilement réversible sur une potentielle suite.",2023-10-20 16:52:21,2235,False
not recommende,54,0.7391567826271057,"Honnêtement ce jeu a un potentiel mais a malheureusement trop de défauts qui ternissent ses qualités.  Il y'a d'excellentes idées, la principale mécanique du jeu et son système de lanterne qui nous donne la possibilité de passer dans un autre monde est original pour un souls like, en plus d'être en temps réel et sans chargement. Le level design est je trouve assez bon, on s'approche de celui d'un DS1, c'est une bonne chose quand on connais la qualité de celui-ci. Un jeu assez beau, même avec un configuration vieillissante et le jeu en moyen on a quelque chose de correct.  En revanche, des mauvais points il y'en a des tas... Et souvent de très mauvais.  Les problèmes de collision, je me suis énormément de fois retrouvé à mourir en ne pouvant pas esquiver une attaque car j'étais coincé dans un mur ou une pierre au sol... frustrant.  La hitbox de certain boss est une abomination. (le congrégateur de chair... au secours, une infamie) Bon, le jeu est récent et c'est malheureusement le standard des jeux d'aujourd'hui mais... Des bugs, des bugs et encore des bugs. J'ai eu droit à des monstres qui flottes en l'air, d'autres coincés dans des rochers (même sur un boss c'est arrivé...)   Les movesets des armes, ils y'a pas mal de sortes d'armes, en passant de la dague à l'espadon ou encore la lance. C'est bien.  Le souci c'est que quant on connais la multitude de movesets d'un jeu comme Dark souls, celui-ci est très en retrait. Chaque type d'arme a le même moveset:  Un grand marteau aura le même qu'un autre.  Un espadon aura le même qu'un autre espadon...  Une épée longue qu'une autre etc etc.   Dommage, car il y'a pas mal d'armes différentes, mais hélas elles ont pour seules différences leurs aspect et parfois des altération d'état. (saignement, radiance, embrasement etc)  L'umbral (Le monde dans lequel on passe grâce à la lanterne) est une très bonne idée dans son concept. Mais par pitié... les monstres qui réapparaissent en boucle dedans, c'est une plaie.  Ok ils ont peu de vie, mais c'est pénible, je veux bien souffrir hein, y'a pas de souci la dessus, c'est la mécanique d'un souls la ""difficulté"". Mais la c'est juste... Chiant.  Heureusement on y passe pas sa vie non plus. de toute façon on a pas le choix car les moments dans l'Umbral sont timés... Mais je n'en dis pas plus.  Voilà,  c'est le ""gros"" de mon ressenti sur ce jeu. Je ne pense pas pouvoir le recommander pour le moment, trop de soucis pour son prix.  Mais c'est un titre à surveiller, car même si je me suis souvent dis ""B*rdel mais c'est une purge !"" au final j'ai quand même pris du plaisir à le faire.   J'y retournerais après plusieurs patch dans quelque mois.  Et si c'est bien mieux optimisé et que la majorité des problèmes que j'ai rencontré sont corrigés, je modifierais cet avis.",2023-10-30 09:58:00,3035,False
recommende,13,0.6165643930435181,"Ce jeu est génial, je ne comprends pas que les avis soient si médiocres sur steam. Le gameplay reprend tous les codes des souls like, dans les moindre détails. Du côté des animations, je ne trouve pas qu'elles soient particulièrement lentes par rapport aux autres jeux du genre (critique pas mal observée). Sur le plan visuel c'est tout simplement magnifique, encore faut il aimer ce genre d'univers, mais ça doit être un des meilleurs souls like actuels graphiquement. La dimension ""Umbral"" est une fonctionnalité intéressante, outre l'aspect ""stylé"" ça a aussi l'avantage d'offrir une seconde chance lorsqu'on meurt (ce qui est plutôt cheaté sur un jeu de ce type), et ça évite aussi de frapper chaque mur autour de soi pour trouver un passage secret.  Quelques relatives déceptions mais qui pour moi ne suffisent absolument pas à baisser significativement la qualité de l'expérience de jeu :  - J'aurais aimé qu'on puisse se restat de manière simplifiée (Je n'ai eu que deux items permettant de faire ça au long de ma 1ère run, 1 looté et un achetable 1 fois, que j'ai dépensés bêtement sans me douter que ça allait être difficile de s'en procurer à nouveau). Je trouve la fonctionnalité de restat vitale sur ce genre de jeu, parce qu'être verrouillé sur un gameplay donné, c'est passer à côté de tous les autres et au final on ne fait qu'effleurer la richesse et la diversité des builds que le jeu a à offrir. Combien de joueurs ne relanceront jamais de NG+ et n'auront exploité que 1% des armes et spells que les développeurs ont pourtant pris le temps d' implémenter juste parce que les améliorer ou réarranger ses points de stats aura été trop difficile. Oui on peut acheter ces items à l'autel de la mère putride en quantité illimitée, mais, ça m'amène à mon deuxième point : - Les items achetables  sur les autels coûtent ULTRA cher, sincèrement j'ai même pas envie d'essayer - Sans spoil, le combat de fin est anticlimatic. L'atmosphère est pas mal, mais les deux derniers fights sont trop faciles à mon goût, et pourtant j'ai pas farm (j'étais lvl 75-80).  Je suis quand même mort 4x sur chaque boss mais j'ai réussi sans trop forcer malgré tout.",2024-08-07 12:48:05,3282,False
