tag,helpful,weighted_vote_score,comment,date,minutes,early_access
recommende,0,0.5,"[h1]Un excellent Souls-Like avec plein de bonnes idées ![/h1]  [u][b]J'ai aimé :[/b][/u] - La direction artistique, que ce soit les décors, l'équipement, les boss ou les mobs/PNJ. C'est une vraie pépite pour tout fan de dark fantasy. - Les graphismes, on enchaîne les panoramas spectaculaires. Je ne suis pas fan de l'UE5 mais globalement ça passe bien (et c'est bien optimisé par rapport au lancement du jeu). - Les combats, nerveux et exigeants. Il y a plein de styles de jeux différents (tank, magie, force, agilité, etc.). Chacun y trouvera son compte. - Le level design. Sans être au niveau d'un Dark Souls 1, le jeu propose quelques embranchements et chemins alternatifs qui donnent du relief à l'univers. - L'Umbral, cette dimension parallèle dans laquelle on évolue régulièrement. Quelques beaux panoramas et affrontements mémorables. - Le lore, qui sans réinventer la formule reste convainquant et se retrouve dans tout le jeux (description des objets, dialogues avec les PNJs, décors...). - La rejouabilité, avec plusieurs fins/choix et de nombreux builds à tester, il y a de quoi faire. De plus le jeu propose des mutateurs pour agrémenter le jeu d'une difficulté supplémentaire selon nos envies. Sans compter le NG+.  [u][b]Je n'ai pas aimé :[/b][/u] - Quelques faiblesses lors des combats hélas inhérentes à tous les jeux du genre (caméra handicapante, difficultés pour cibler les ennemis, etc.). - Sans trop en dire, le jeu a sa définition propre de ce qu'est une ""mimique"" (un coffre ou objet piégé). C'est horripilant car indétectable, ça n'apporte rien au jeu et donne lieu à quelques morts inutiles. - Certains boss qu'on nous tease tout le long du jeu pour au final être décevants (90% des boss restent intéressants à combattre). - Un certain nombre de boss recyclés en mobs. Un poil plus de diversité pour les mobs aurait été bienvenue (ça reste tout à fait acceptable). - La difficulté de base. Globalement c'est assez facile pour un joueur habitué du genre, mais ça reste un beau challenge, surtout pour un débutant. Heureusement, il est possible de corser les choses (mutateurs, NG+, etc.).  [b]Compter une trentaine d'heures pour un premier run. C'était une super expérience ![/b]",2025-04-27 03:29:05,1854,False
recommende,0,0.5,pas mal je le mettrais plus dans le style RPG dark fantaisie que dans le style Soulslike mais je passe un bon moment dessus pour l'instant sa manque un peu de difficulté sur certain boss mais  pour quelqu'un de novice dans le genre c'est un super jeu pour commencer,2025-04-26 10:23:34,563,False
recommende,0,0.5,"Loving the game so far, respect for the devs for keeping polishing their game so deep",2025-04-23 18:56:36,193,False
not recommende,2,0.5,"La coop partagé est juste injouable, de-sync de plus de 15sec quasi constant, résultant à de gros moments ou plus personnes ne bougent. Extremement deçu.",2025-04-23 18:20:57,668,False
not recommende,0,0.5,"I bought this game to play with a friends in shared coop, cause it was the promise they made for the 2.0 version : to keep the promise they told us at the 1.0 version.   beside the game being mid overall (but looking good), the only things that made me bought the game is the shared coop things.   and its completly unplayable at this state of the game, do the game developper have even played the game ?    - full of packet loss , de-sync - why only host can get memories stuff? - why teleporting the mate when you move a bit too far? - why only the host can trigger boss? - why the guest when dying it dosent loose any soul ?  - why do we get our potion back when ressurecting our friends in fight? (maybe bug) ...  we are in 2025 its beyond comprehension to have a game, in 2.0 version , in this state of play.   ill change my review if it get better but you had 2 years to make it better.",2025-04-21 00:15:34,574,False
recommende,0,0.5,"La mise à jour 2.0 a transformé le jeu en un très bon souls-like, la coop fonctionne bien et la DA est magnifique. Tout est bien, foncez.",2025-04-21 00:14:34,842,False
recommende,0,0.5,"Très bon soulslike, fun à faire en duo, l'univers est excellent",2025-04-20 20:18:46,506,False
recommende,0,0.5,"J'ai commencé ce jeu en version 2.0 et j'ai été agréablement surpris la courbe de progression est vraiment bien géré, un casu peut clairement faire l'acte 1, et ensuite et bien c'est pas compliqué, et tu meurs, et tu meurs et tu meurs encore et encore. un souls-like quoi XD. Côté exploration on est sur un jeu couloir avec pas mal d'énigme et de passage dérobé, la mécanique du monde à l'envers est très bien géré. Une bonne surprise, n'hésitez pas à le prendre avec la promo jusqu'à début mai",2025-04-20 16:19:20,457,False
not recommende,0,0.4368230998516083,je crois que tester un jeu pour les devs c'est trop demandé ils sont au courant que c'est un souls like et que tu meurs rapidement bon ok vu qu'ils ont pas testé leur jeu non il ne sont pas au courant mourrir à cause que j'au voulu trop bourriner dans le tas je veux bien mais mourir 10 fois à cause des ennemis planqués à des endroits ou tu les vois pas eux ils t'attendent bien sagement que tu passes devant eux pour te pousser dans le vide et mourir instante sa veut dire que tu es censé connaître tous les emplacements des ennemis sans avoir fini au moins 1 fois le jeu  c'est juste débile d'avoir fait sa et quand tui es dans l'umbrella ou le monde des morts si vous préférez pourquoi mettre autant d'ennemis j'ai déjà eu un dizaine d'ennemis en même temps sur ma gueule j'étais censé survivre comment face à sa dans jeu non souls je veux bien mais dans un jeu ou tu dois géré l'endurance de ton personnage et tu meurs en seulement quelques coups la c'est juste impossible je n'ai aucune honte à le dire il était bien mieux le lord og the fallen de 2014 que celui-ci oui ce lord of the fallen il est pas trop mal mais il ne vaut pas celui de 2014 les graphismes sont correctes pour un jeu de 2023 l'histoire est bien mais un peu trop d'ennemis par zonnes qu'il y en a c'est normal mais d'en avoir presque 10 qui te frappent sa je dis non c'est juste impossible de survivre et sa c'est souvent que tu te retrouve avec beaucoup d'ennemis sur ta gueule surtout dans le monde des morts donc oui c'est un bon jeu après il ne rivalise pas avec celui de 2014 mais il vaut la peine d'être fini au moins 1 fois mais attendez un réduction il ne vaut pas son prix  Edit: bon ben je peux pas le terminer à cause de bogues j'ai été voir sur internet pour voir si j'ai oublié de faire un truc mais non j'ai bien tout fait ce qu'il fallait faire mais arriver à haut calhdrat ben il y à 2  boss qui spawn pas donc impossible de continuer pour avancer dans la campagne à cause de sa et pourtant j'ai pu purifier le faisceau rouge qu'on voit dans le ciel qui se trouve en haut de la grande place ou normalement tu as le boss qui veut absolument te voler ta lampe ou il peut aussi avoir de l'aide d'un dragon je ne sais plus son nom ou tu le croise 2 fois au début et tu peux jamais le tuer jusqu'à là parce qu'il faisait trop de dégâts et il avait beaucoup trop de vie ben la troisième fois qu'on le rencontre à haut cldhrat vers l'immense place ben chez moi il ne spawn pas logique j'ai même recommencer une nouvelle partie ben sa n'as pas déboguer logique donc pas moyen de le finir pour moi je trouve que c'est quand même abuser que 2 ans qprès sa sortie qu'il y ait des bogues qui t'empêche de finir le jeu encore je trouve sa complètement débile de la part des devs,2024-10-31 13:09:03,4963,False
recommende,0,0.5,Très bon jeux qui reprend tout les codes d'un bon souls ambiance sombre combat + boss don vous vous souviendrez en revanche la cam et très chiante en jeux mais bon cela n'enlève pas que le jeux est TOP !,2024-07-05 00:34:06,482,False
not recommende,0,0.5,"Lord of the fallen est un jeu frustrant qui peine à copier les jeux de Fromsoftware dans leurs challenge bien mieux équilibré   les +  la DA la variété de build   les - optimisation  bestiaire faible  trop de mob en meme temps lors de l'exploration  fin baclé   uniquement pour fan absolue des soul-like",2024-05-21 00:10:47,1655,False
recommende,0,0.5,"Tres bon jeu, bonne ambiance. Assez difficile, mais les nouveauté suite au dernier patch rendent le jeu un peu plus facile en option (armes auto-upgradées).  Quand même bien moins complet qu'un dark soul ou qu'un Elden ring (moins de sorts, moins de build...). Par contre il est complet et sans gros défaut.",2024-05-19 19:50:18,1809,False
recommende,0,0.5,"Trés bon jeu dans son style, univers et game design trés reussi, difficultée presente et on aime ça ! Fin secretes alambiquées pour nous faire jouer au NG+ mais on commence a voir l'habitude (flemme je ferai pas meme si a priori on loupe un boss)  Sautez sur l'occasion si vous êtes friant des souls-like.",2024-05-18 21:54:32,1722,False
recommende,0,0.5,"Gros amateur de Souls, j'ai aimé malgré ma méfiance au vu des notes moyennes.  Les + :  - DA excellente, sûrement l'une de mes favorites  - Graphismes, Sound Design vraiment top et bien travaillés  - Gameplay, système de combat dynamique et vraiment bien exécuté    - Level Design très bon  - Durée de vie plus que bonne (40h pour finir ma première partie en ayant forcément manqué des choses) rejouabilité qui semble très généreuse  - On ressent que les développeurs aiment leur jeu et sa communauté   Les - :  - Optimisation certes pas parfaite, cependant, paramètres très variés permettant de vraiment choisir des réglages adaptés à sa machine ( Je trouve quand même que vu ce qui est sorti dernièrement dans le monde du jeu vidéo le jeu est loin d'être mauvais sur ce point là et le jeu a reçu énormément de patchs )  - Boss peut-être un peu trop accessibles, pas de réelle difficulté, à voir avec le NG+  - En 40h de jeu un crash, ce qui reste une mauvaise chose  - Boss final assez... spécial ? A voir avec les autres fins",2024-05-14 23:18:32,2454,False
recommende,0,0.5,"Très belle DA, du challenge, de la rage, des bugs (rare), être bloqué dans des ennemis ou des barricades et mourir...  Mourir à cause d'embuscades d'ennemis bien vicieuses, après presque une heure de plateforme galère pleine d'ennemis par ce qu'un taré avec une gueule de pyramide head vous fonce dessus tel le bâtard de bélier qu'il est et va vous tuer par une chute sur ladite plateforme, on rage... on recommence, on fait attention...  Pas de bol, un clodo en loque vous attendait derrière des caisses et va vous pousser, on recommence...  Bref, je recommande hein! Et je ne vous ai pas parlé du demi-boss avec sa cloche sur la tête qui fait des ondes en tintant ""ding dong"" pour vous fumer avec sa bande de psychopathes ! Moi j'adore, l'ost tout ça, grimdark/gothique, vraiment cool, juste dommage que le glas qui sonnait, c'était pour ma pomme quoi... Ouaip.",2024-05-12 21:15:23,1904,False
not recommende,0,0.5,"L'univers es très gothique; ça j'aime bcp. Mais le gameplay c'est autre chose car on a 2 univers; le monde des mort et le monde réel. Ce qui es très chiant quand on joue et que on doit chercher , oui on doit utiliser la lanterne pour ouvrir les passage mais soyez indulgent, il es des cinematique que on trouve dans le monde des mort pour connaitre l'histoire mais quand ta des monstres du monde des morts qui vient t'attaquer ou pire on cherche une plateforme avec la lanterne mais que ta un monstre du monde des mort qui te frappe dans le dos PRES DU VIDE ! je préfère largement ELDEN RING",2024-05-08 18:28:37,380,False
recommende,0,0.5,"j'ai adoré ! Alors oui un bestiaire un peu faiblard et des boss qui deviennent des élites, mais a pars ça visuellement c'est beau mais que c'est beau !!!!!!! Un gameplay dynamique, une difficulté qui est au rendez vous avec quelques passage qui mettront vos nerfs a l'épreuve. j'ai fini le jeu avec la fin la plus simple a obtenir et je recommence en ng+1 pour avoir une second fin. Forcé de constater que la difficulté ng+1 rajoute de la difficulté mais que la suite des événement que je choisi eux aussi augmente la difficulté de mon jeu, vos choix auront des conséquences. La MAJ 1.5 aussi ajoute sont petit lots de fraîcheur au jeu (nouvelles armes, sort, armure etc etc). Le jeu est également suivis de près par les développeurs qui sont a l’écoute des joueurs et ça fait plaisir ! A quand un dlc ?",2024-05-06 20:03:22,5268,False
not recommende,3,0.5479452013969421,"Ne fonctionne pas, après multiples essais, multiples techniques (j'ai rasé tout ce que j'ai vu sur Reddit, Steam ou Youtube), le jeu refuse de se lancer. Et même, imaginons que je sois juste idiot, ce n'est pas à l'acheteur de devoir régler un jeu qui est sensé ne pas avoir de problèmes. Donc je suis désolé, mais je vais bientôt devoir le rembourser si ça continue, et ça m'embête vraiment car j'y ait crû. Oui effectivement, c'est un commentaire de rageux. Mais bon sang, JE VEUX JOUER, JE VEUX JOUER PTN.",2025-04-23 17:54:08,46,False
not recommende,1,0.49794235825538635,"Beau, rien de plus.  Système de coop éclaté au sol, aucune sauvegarde progression voir pire perte de progression, items non lootable par le cooéquipier etc..  Aucune difficulté sur les boss mais a côté de ça des faux loot qui oneshot, dégueulasse.  Système de quête horrible, même avec un guide on tourne en rond pendant des heures  Des bug obligeant de relancer la partie, des bout de map manquant, bug de collision, on passe a travers des ascenceurs, des boss qui réapparaissent pas ...  La fin du jeu... pire fin que j'ai jamais vu, même la finir une partie de solitaire est plus divertissant et gratifiant, poubelle!",2025-04-29 22:20:36,1658,False
not recommende,1,0.48510637879371643,"C'est dommage le jeux est magnifique dans son ensemble, mais il y a quelque défaut ""majeur"" je trouve.  -Le drop d'objet des boss secondaire est aléatoire il lâcheras une arme et une pièce d'armure sur 4 ce qu'il fait que vous n'aurez pas son stuff au complet. -Le drop d'objet des ennemi lambda est TRÈS bas même avec des objet et consommable pour augment le taux de drop vous allez passé des heure juste pour avoir un set complet (arme, armure et sort). -Il y a trop d'ennemi en général sans un amie pour vous aidée durant toute l'aventure vous allez très vite run en essayant de les éviter. -La camera et le targetting surtout quand il y a plusieurs ennemi ou contre de boss avec plusieurs ""point faible"" peut vite vous faire rager. -Vous vous faite souvent envaire pas des joueur vétéran en ng plus -Quand vous aidée un joueur a battre un boss ou tuée un joueur vous gagner des pièce pour acheter des armure tenture et consommable mais le prix est très élevé ce qu'il fait que vous allez devoir y donné énormément de temps si vous voulez pouvoir les acheté.  Il y aurait d'autre chose à dire mais je vais m’arrêter la ;D",2024-05-15 14:51:38,83,False
not recommende,0,0.4761904776096344,"Ce jeu est Dark Souls 3 de Wish.  Les zones du jeux sont ultra labyrinthiques, chiantes et assez répétitives, les mobs sont ultra répétitifs (la grande majorité des mobs sont juste d'ancien boss), les graphismes sont sympas mais tous les endroits finissent par se ressembler. Les combats de boss sont assez faciles (j'ai jamais mis plus de 7-8 try sur un seul boss, j'ai meme first try des boss avec cinématiques alors que je suis pas spécialement un grand joueur de souls), cependant la majorité des boss sont super frustants à combattre ou juste pas fun, aucun combat ne m'a plu à part 2-3 du début.",2025-05-01 03:13:57,830,False
not recommende,1,0.4761904776096344,"For every thing this game does right, it does something EXTREMELY wrong, for example : - Visuals are absolutely stunning... - ...But the levels lacks distinctive marks, so you get lost half the time... - ...And also some of the ways to progress are really unintuitive (WHAT DO YOU MEAN THE LAST ZONE IS ACCESSED BY GOING BACK TO THE FIRST BOSS ARENA ?) - The combat is really nice... - But there are few actually good bosses, most being either regular mobs with a health bar or a gimmick boss... - The umbra realm is a really cool idea... - ...But it ends upe being more of an annoyance, as it adds more mobs around...  I could go on, but i'll just end by saying i'm kinda sad about that game, as it has a lot of good, but just as much straight up awful elements to cancel it out, which can be summed up as ""This is exactly for this type of games that a neutral eval should be added.""",2025-02-19 00:35:08,1525,False
recommende,0,0.4761904776096344,super cool et gameplay VRAIMENT BEAUCOUP MIEUX NIVEAU ESQUIVE SORT ECT que elden ring,2024-07-07 18:14:42,3100,False
not recommende,2,0.5101853013038635,"Ce patch est une honte, en tout cas la partie multijoueurs !  Le multijoueur est une vaste blague je m'explique :  - Les serveurs sont en carton ça ne fait que lagger. - Le joueur 2, ne peut pas faire les dialogues. - Le joueur 2, ne peut pas acheter les mêmes objets que le joueur 1. - Le joueur 2, ne peut pas acheter les armes / spells / stuff / etc etc, des souvenirs des boss. - La vie des Boss n'est pas doublée ni la difficulté adaptée pour 2 joueurs, ce qui fait qu'on roule sur le contenu sans AUCUNE difficulté. - Le joueur 2, se retrouve constamment téléporté auprès du joueur 1 quand ce dernier s'éloigne trop (et c'est vraiment proche). - Le joueur 2, ne peut pas ACTIVER LES RACCOURCIS ?!!!!! Impossible d'activer les shorts cuts, ni abaisser les échelles, ni ouvrir beaucoup de portes - Le joueur 2, ne peut pas COURIR sans faire des manips de dingue, j'ai bien dit de dingue afin qu'on puisse y arriver - Le joueur 2, ne peut pas attaquer en avançant au corps au corps alors que le joueur 1 le peut. - Le joueur 2, ne peut pas MONTER LES ECHELLES normalement, il peut se retrouver bloquer, ou alors il faut faire des roulades dans l'échelle afin de pouvoir y monter.  BREEEEEF, c'est vraiment minable",2025-04-21 18:37:57,548,False
not recommende,1,0.4545454680919647,"Le jeu ne se lance plus, je tombe sur un écran noir à cause du cheat engine La sanction est sans appel : c'est un carton rouge pour Lords of the fallen 2.",2025-04-04 17:23:16,699,False
not recommende,0,0.4545454680919647,"Depuis ses début sur PS5 a aujourd'hui c'est toujours approximatif, normalement les patch servent a amélioré l'expérience mais bon grand nombre de soucis été là avant et sont encore là aujourd'hui comme les bug d'affichages avec les capes.  j'ai réussit a le finir sur PS5 mais c'est un exploit que je ne referais pas.",2025-02-02 21:35:41,257,False
recommende,0,0.5,"Cela ne vaut pas Elden ring mais il en reste pas moins un bon soul like. Si vous aimez les jeux à la darksoul et l'ambiance dark fantasy ce jeu vous plaira. En revanche attention il faut un PC solide pour le faire tourner sans quoi vous aurez des risques de chute de framerate ou de freeze.",2024-05-16 14:46:55,1577,False
not recommende,0,0.5,Jeu de marde ne boot pas car il dit que j'ai une carte graphique avec peu de VRAM quand j'ai 12Go (4070) Et se depuis l'update 1.5.61 pour fixé des crash maintenant j'en ai...,2024-05-11 19:54:02,322,False
recommende,4,0.5370636582374573,"Encore quelque petits bugs par ci par la, mais ca reste un super jeu! Je ne peux que le recommandé. Un vrai Souls like comme on les aimes!",2025-04-17 08:45:37,3505,False
not recommende,0,0.43478259444236755,"j'ai acheter se jeu hier, impossible d'y jouer le jeu se lance pas, j'ai tout essayer désactiver mon antivirus, vérifier si les fichier sont bien installé et leur intégrité, le lancer en tant qu'administrateur, le désinstaller le réinstaller, mettre a jour les pilote, rien a faire le jeu ne démarre pas comme si j'avais juste acheter le logo de démarrage, c'est n'importe quoi je suis très déçu je comptais y jouer avec un proche qui lui aussi la acheter, quel gachi, je vais devoir demander un remboursement pour un problème inexplicable, d’ailleurs sa indique que j'y ai jouer 30 min alors que c'est juste le temps de chargement du lancement du jeu a plusieurs reprise qui n'aboutit pas, et le problème ne vient clairement pas de mon pc, j'ai des jeux qui demande plus de puissance et il fonctionne très très bien.",2025-04-21 12:56:23,33,False
not recommende,0,0.4269081652164459,"Points positifs:  On a un souls like vraiment magnifique, des graphisme époustouflants et un level design à la hauteur de ce qu'on pourrait attendre d'un tel jeu. L'utilisation de la lampe pour accéder à des endroits inaccessibles et la dimension parallèle est très bien exploité aussi. De multiples variantes de gameplay sont proposés grâce aux multiples armes et compétences disponibles. Points négatifs:  Le lore pu la flemme, c'est incroyable, aucuns efforts sur les explications, on a un système qui nous permet de voir des souvenirs du passé mais qui ne nous raconte rien, de la même manière aucune note n'est laissée dans la map. Un monde semis ouvert et donc dirigé qui ne fait pas plus d'efforts sur ses boss. Ils sont certes magnifiques, mais manquent de difficultés et encore une fois de lore, pas de cinématique d'entrée, et une cinématique de fin pittoresque à la hauteur de l'histoire du jeu.   Bref vaut pas plus de 20 balles pour la flemme de lore, c'est pas parce qu'un jeu est beau qu'il est bon.",2025-04-20 12:45:53,77,False
not recommende,0,0.5,"La ""seamless coop"" n'est pas du tout seamless, l'invité de la session ne pas intéragir avec aucun décor, ne peut pas débloquer certaines fonctions des PNJ.  Le level design est aussi très mauvais, beaucoup de labyrinthes pour aucune raison, impossible de se retrouver.",2025-05-01 11:53:04,625,False
recommende,0,0.5,"exelent soul like.  23h of play. difficulty at 7/10. very bice",2025-04-26 19:02:05,1520,False
recommende,0,0.5,"Excellent, un très, très bon souls like, la DA est magnifique, le suivi du jeu avec les ""mods"" intégrés vraiment sympa.",2024-08-26 10:17:08,4147,False
recommende,0,0.5,"Avec la sortie de la nouvelle mise à joue 1.5, le jeu est bien comparativement à sa sortie initial. Les bugs sont moins présent et le gameplay est plus fluide. Un très bon jeu pour les fans de Souls like !",2024-08-26 03:49:14,1186,False
not recommende,1,0.38327524065971375,J'ai voulu tester la version 1.7 malgré les évaluations négatives... Ce fut vite fait vu que le jeu n'a jamais voulu démarrer autre qu'un écran noir... Apres plus de 100 jeux achetés sur Steam ce fut une première...et dernière. Remboursement direct !,2025-01-26 21:15:53,12,False
not recommende,0,0.47495681047439575,"Jeux copié sur elden ring... Je parle pas de quelque ressemblances, c'est un soul-like mais les animations sont les mêmes, boss mal fait.. Le jeux est plus facile mais le online est cassé. En PVP on tombe H24 sur des team de 2, Les nombreux bug qui te font passer sous la map et tomber dans le vide ... Les crash et le fais que tu obtiens 150 yeux énucléés en Australie mais seulement 3 en France par lanterne rouge ce qui rend le farm impossible a moins d'avoir un VPN ....",2024-06-26 20:27:11,3686,False
recommende,0,0.5,Can't compare to 1.0 but 2.0 is pretty good to me.,2025-05-01 10:56:51,2775,False
recommende,0,0.5,J'ai joue a ce jeu des le premier jour et je l'ai trouve magnifique dans tous les sens du terme . il ne faut surtout pas passe a cote sa serais du gâchis .,2025-04-25 22:04:34,8138,False
not recommende,1,0.3748798668384552,Nul nul nul dans l'ensemble aurai pu etre bien mais ? faut aller ou ?? je tournes en rond on cd mdr pire souls like de l'histoire et je le jure,2025-02-19 20:21:47,552,False
