tag,helpful,weighted_vote_score,comment,date,minutes,early_access
recommende,53,0.8326869010925293,"Et voila, encore une équipe de développeurs qui croit dans leur jeu. Plutôt mal accueillit à sa sortie, ils ont fournit un gros travail, sans jamais laissé tomber, en écoutant les joueurs pour arrivée à la 2.0.  Le jeu a été corrigé, amélioré, peaufiné pour devenir ce qu'il est aujourd'hui, un des meilleurs Souls like (avis perso bien sur). Je salut l'acharnement des devs pour leur travail. Il reste encore des créateurs de jeux qui aime leur métiers, qui pense aux joueurs et qui les écoutent. Bravo! Sur ce je retourne me faire un nouveau run :)",2025-04-18 00:09:27,11771,False
recommende,48,0.8171908855438232,"[h1] STOP ! Ce jeu est BIEN !! [/h1]  J'ai fini plusieurs fois les 3 Dark Souls, Elden Ring, BloodBorne, Sekiro.  Je peux vous dire que Lords of the Fallen n'a absolument pas à rougir face à ces mastodontes ! Bien sur qu'il n'est pas parfait mais sérieusement je ne comprend pas comment ce jeu peut avoir des évaluations moyennes, je trouve ça injuste. Voici ce que le jeu vous propose : - [b] Une expérience SoulsLike Classique [/b]. Le fait qu'il n'y ait pas de monde ouvert n'est pas un problème en soi, il s'agit de parcourir des donjons, des zones labyrinthiques, de débloquer des passages, déverrouiller des portes, etc... (pour moi c'est même carrément mieux qu'un monde ouvert : c'est dense et riche) - [b] Une direction artistique de FOU !  [/b] ! C'est beau et c'est dark. Ce que l'on attend d'un tel jeu. Le jeu est très proche de BloodBorne au niveau de son ambiance (ce qui est évidement un compliment) -[b] La double mort [/b] comme dans Sekiro, à ceci près que cela nous fait basculer dans une version alternative du monde encore plus dark.  - [b] Un gameplay tout à fait respectable [/b] : personnage fluide, styles de jeu nombreux - [b] Un level design exemplaire [/b] : on frise le dark Souls 1, mieux que dark souls 3. Des zones qui se rejoignent, un monde cohérent, des chemins variés, on se perd, on se retrouve avec joie, il y a des raccourcis, de la verticalité, et les deux mondes alternatifs proposent chacun leur petites différences (passages secrets, trésors cachés, ect...)  Ceci dit, voici ce qu'on peut noter :   -Les boss sont biens mais ne sont pas le point fort du jeu. Le point fort du jeu est le plaisir de l'exploration des zones. Beaucoup de boss sont en réalité des ""mini-boss"" que l'on passe en un essai, et qui reviennent souvent sous la forme d'ennemis classiques par la suite. Cette répétition des ennemis peut être vu comme un défaut du jeu. Cependant calmons nous, il y a de belles pépites dans les boss de ce jeu tout de même. Et puis qui a dit que les boss devaient forcément être des murs sur lesquels on doit se casser les dent 100 fois avant d'y arriver ? Souvenons nous du recyclage dans Sekiro, dans Elden Ring. Souvenons nous de certains boss des Souls loin d'être mémorables.... Ici vous aurez des boss de légende, et des boss qui sont juste des gros combats. Et franchement ça va.  -Le tuto n'est pas très bien fait et je pense en a rebuté plus d'un. En effet beaucoup d'informations sont délivrées d'un coup, notamment les nouvelles mécaniques de la lampe spécifiques à ce jeu. Encore une fois calmons-nous : ces mouvements mettent peu de temps à s'apprendre, et ce sera bien moins pire que lorsque vous avez du apprendre à jouer à un Souls pour la première fois. Un petit effort d'adaptation comme aux premiers temps, et vous voila partis !  -Le monde alternatif (Umbral) présente une mécanique différente du monde normal dans le sens où des ennemis vont apparaître à intervale réguliers, et de plus en plus avec le temps qui passe jusqu’à ce que vous arriviez à repasser dans le monde normal. Oui, vous risquez d’être entouré d'ennemis mais c'est à vous de les gérer et de prendre ça en compte pour réussir. L'umbral est conçu pour que vous ne vous sentiez pas tranquille, même l'ambiance sonore est de plus en plus oppressante pour vous le signaler. L'idée est de vous faire ressentir l'angoisse et le stress, le sentiment d’être une sorte d'explorateur sur une planète très hostile, avec peu d'oxygène pour tenir. Trouvez le moyen d'en sortir et vous pourrez ""respirer"". C'est le challenge original que vous propose le jeu. C'est un peu aussi sa marque de fabrique. Et l'ambiance dans l'umbral est géniale je trouve, bien oppressant.  [b] CONCLUSION [/b] : ce n'est pas parce que les Fromsoft sont exceptionnels que vous devez vous priver de jouer à ce jeu qui les talonne de près. Souvenons-nous de nos premiers moments sur les Souls, l'adaptation est la clé. Chaleureusement recommandé",2024-05-31 01:03:46,2289,False
recommende,15,0.6860290765762329,"---{ Graphismes }--- ☐ Qu'est-ce que la réalité ? ☑ Magnifique ☐ Beau ☐ Décent ☐ Mauvais ☐ Faut pas trop s'y attarder ☐ MS-DOS  ---{ Gameplay }--- ☑ Très bien ☐ Bien ☐ C'est juste du gameplay ☐ Mehh ☐ Je préfère regarder un troom troom ☐ Non  ---{ Audio }--- ☐ Eargasm ☐ Très bien ☑  Bien ☐ Pas trop mal ? ☐ Je préfère entendre un corbeau chanter ☐ Je suis sourd mtn  ---{ Public ciblé }--- ☐ Enfants ☑ Ados ☑ Adultes ☐ Tout public  ---{ Pc requis }--- ☐ Tranquille si Paint se lance ☐ Patate ☐ Décent ☑ PC gamer ☐ PC très cher ☐ Demande à la NASA de t'en prêter un  ---{ Difficulté }--- ☐ Appuyer sur ""Z"" ☐ Facile ☐ Faut un peu réfléchir ☐ Prise en main facile / Difficile à maîtriser ☑ Difficile ☐ Dark Souls  ---{ Histoire }--- ☐ Pas d'histoire ☐ Un peu de lore ☐ Moyen ☑  Bon ☐ Adorable ☐ Meilleur scénario  ---{ Temps de jeu }--- ☐ Le temps de te faire un café ☐ Court ☐ Moyen ☑ Long ☐ Vers l'infini et l'au-delà  ---{ Prix }--- ☐ Gratos ☐ Vaut largement son prix ☑ Si c'est en soldes... ☐ Si t'as un peu d'économies ☐ N'achète pas ça. ☐ Brûle ton argent, au moins ça réchauffe  ---{ Bug(s) }--- ☐ Qu'est-ce ? ☐ Très légers et non dérangeants ☑ Petits bugs ☑ Peut être ennuyant ☐ ARK: Survival Evolved ☐ Cyberpunk 2077  ---{ Note/10 }--- ☐ 1 ☐ 2 ☐ 3 ☐ 4 ☐ 5 ☐ 6 ☐ 7 ☑ 8 ☐ 9 ☐ 10",2024-12-01 12:55:01,4699,False
recommende,13,0.6165643930435181,"Ce jeu est génial, je ne comprends pas que les avis soient si médiocres sur steam. Le gameplay reprend tous les codes des souls like, dans les moindre détails. Du côté des animations, je ne trouve pas qu'elles soient particulièrement lentes par rapport aux autres jeux du genre (critique pas mal observée). Sur le plan visuel c'est tout simplement magnifique, encore faut il aimer ce genre d'univers, mais ça doit être un des meilleurs souls like actuels graphiquement. La dimension ""Umbral"" est une fonctionnalité intéressante, outre l'aspect ""stylé"" ça a aussi l'avantage d'offrir une seconde chance lorsqu'on meurt (ce qui est plutôt cheaté sur un jeu de ce type), et ça évite aussi de frapper chaque mur autour de soi pour trouver un passage secret.  Quelques relatives déceptions mais qui pour moi ne suffisent absolument pas à baisser significativement la qualité de l'expérience de jeu :  - J'aurais aimé qu'on puisse se restat de manière simplifiée (Je n'ai eu que deux items permettant de faire ça au long de ma 1ère run, 1 looté et un achetable 1 fois, que j'ai dépensés bêtement sans me douter que ça allait être difficile de s'en procurer à nouveau). Je trouve la fonctionnalité de restat vitale sur ce genre de jeu, parce qu'être verrouillé sur un gameplay donné, c'est passer à côté de tous les autres et au final on ne fait qu'effleurer la richesse et la diversité des builds que le jeu a à offrir. Combien de joueurs ne relanceront jamais de NG+ et n'auront exploité que 1% des armes et spells que les développeurs ont pourtant pris le temps d' implémenter juste parce que les améliorer ou réarranger ses points de stats aura été trop difficile. Oui on peut acheter ces items à l'autel de la mère putride en quantité illimitée, mais, ça m'amène à mon deuxième point : - Les items achetables  sur les autels coûtent ULTRA cher, sincèrement j'ai même pas envie d'essayer - Sans spoil, le combat de fin est anticlimatic. L'atmosphère est pas mal, mais les deux derniers fights sont trop faciles à mon goût, et pourtant j'ai pas farm (j'étais lvl 75-80).  Je suis quand même mort 4x sur chaque boss mais j'ai réussi sans trop forcer malgré tout.",2024-08-07 12:48:05,3282,False
recommende,4,0.5833333134651184,"J'ai passé un très bon moment sur ce jeu. Le monde est sombrement beau, les armes et armures sont bien détaillées et il y a un petit lot de boss mémorables dont on peut apprécier la mise en scène. L'OST est également de qualité. Le level design est maîtrisé, et la mécanique du jeu de passer de l'Axiom à l'Umbral grâce à la lanterne le sublime encore plus. Les animations de combat au corps à corps peuvent dérouter au départ quand on a été habitué à d'autres souls like mais je m'y suis vite habitué. Le panel d'armes, d'armures, de sorts et autres équipements est suffisamment conséquent pour avoir beaucoup de builds à expérimenter. J'imagine que sa note moyenne est en partie un reflet des soucis d'optimisation qu'il avait à sa sortie, mais en tout cas en version 1.5 tout a été très fluide pour moi et je n'ai eu aucun crash.  Edit : de retour pour essayer la 1.7. Un plaisir de redécouvrir le jeu et l'excellent level design.",2024-05-21 23:56:56,7995,False
recommende,7,0.5787037014961243,"Je suis extrêmement  impressionné par ce Lord of the Fallen. Après avoir terminé (et adoré) Black Myth : Wu kong, j'ai acheté le jeu en promo, légèrement méfiant à la vue de la note générale qui lui a été attribuée. ...mais QUELLE CLAQUE.  Graphiquement et artistiquement, c'est très très supérieur à tout ce à quoi j'ai pu jouer depuis longtemps (Wukong inclus). L'univers m'évoque un mélange sublime entre Berserk, l'attaque des Titans, Bloodborne, Demon's Souls et Alien (de l'aveu même des concepteurs, la DA est très inspirée de H.G. Giger et le rendu est grandiose). C'est sale, c'est sombre, c'est poisseux. C'est de la vraie Dark Fantasy - et j'insiste sur ce point car de nos jours, on nous vend régulièrement les univers comme étant ""Dark"" mais c'est juste de la surenchère spectaculaire devant laquelle on finit blasé. Ici, on en prend plein la gueule. C'est sobre mais qu'est-ce que c'est violent comme approche visuelle ! Superbe.  En termes d'exploration, je n'ai pas pris mon pied comme ça depuis le tout premier jeu du genre : Demon's Souls lui-même (oui je suis un vieux singe). Depuis, je les ai tous faits en espérant retrouver ce frisson originel, que je n'ai que très rarement approché avec Bloodborne, Nioh ou Sekiro... mais jamais comme avec Lord of the Fallen. Ce n'est pas tant une question de difficulté que de level design, lequel est mortel. La superposition des dimensions rend l'univers incroyablement vivant et immersif, organique et crédible. La menace est constante, réelle, l'ennui né de la répétitivité dans les mécanique ne s'installe JAMAIS. C'est un veritable renouveau, le jeu ose proposer de nouvelles choses. Je n'ai jamais vu un jeu de ce genre aussi intelligent, ni une approche aussi fine, sans pour autant être prise de tête. Car Lord of the Fallen n'oublie jamais ce qu'il est : UN JEU. Vous êtes là pour souffrir, certes - c'est un Souls après tout - mais aussi et surtout pour aimer ça.  On se sent puissant, les mécaniques sont jouissives et l'impact des coups, la magie, tout est significatif et plein de possibilités.  L'histoire est accessible, compréhensible, les personnages intéressants et l'univers aussi solide que passionnant. Les trailers qui vendent du rêve, pour une fois, ne mentent pas sur la marchandise délivrée.   CE JEU EST UNE TUERIE !  Il n'y a plus à hésiter.  Et n'oubliez pas : In light, we walk.  J'y retourne, je sens les limbes qui m'appellent et m'attirent à elles.    /edit après avoir fini le jeu (fin radiance)  Je confirme le verdict. Aucun passage ne s'est avéré pénible, un délice de bout en bout. J'ajouterai même que j'ai été frappé par le renouvellement du bestiaire, des environnements, la diversité des armes et des sorts. Un jeu vraiment incroyable, que je recommencerai volontiers en ng+ !",2024-11-23 17:06:46,3363,False
recommende,4,0.5652173757553101,"Oui Software fait clairement mieux avec ses jeux que Lords of the Fallen. Est-ce un mauvais jeu ou un mauvais soul like pour autant ? Bien sûr que non. Très agréable à explorer et proposant des mécaniques originales, il saura tout autant faire plaisir aux fans du genre qu'à ceux qui découvrent ce type de gameplay.",2024-10-14 21:00:38,370,False
recommende,3,0.5558375716209412,"Legacy of Kain: Soul Reaver version Souls like ? Carrément ! Au début le jeu était bugué, fouillis etc mais maintenant, clairement il vaut le coup. En manque de souls ? Et tu veux faire le jeu avec un pote ? Go !",2025-04-18 03:59:18,2866,False
recommende,8,0.5539772510528564,"Le jeu nous rappelle Bloodborne dans pas mal d'aspects (regagner des HP en attaquant, les esquives, certaines musiques...) il y a même une classe de base qui ressemble énormément à un chasseur, et ça, ça fait monter le kiki   Au delà de ça le jeu est vraiment cool, le système de lanterne pour voir un autre monde est original, ingénieux et bien utilisé, il y a certaines mécaniques très intéressantes comme le fait de rejouer les combats de boss comme dans sekiro (le jeu où t'as des ennemis nippons énervés avec une calvitie rocambolesque)  Étant fan des jeux Fromsoft' je suis très exigeant avec les souls likes et c'est le 1er qui arrive à retranscrire comme il faut leur art selon moi, même lies of P j'avais pas aimé...  Le seul point noir que je pourrais donner c'est que les boss sont vraiment trop faciles, certaines zones sont très sympas à parcourir mais c'est gâché par un boss de fin de zone que tu first try, ou à la limite que tu bats en 3 essais...Tu perds un peu la saveur de la zone.  En résumé : je pleure sur le poulet mon khey",2025-04-20 17:13:17,1815,False
recommende,2,0.5454545617103577,"good game, i love souls like, this game bring numerous of new features that improve the level deseign, and the combat mechanics gives a lot of options about how to beat a boss, the combo are interesting and there is a lot of way to play each weapons. Boss can be, by time, not very challenging. the dev are very present and gives a lot af new feature each update.   for me it s a souls like that tryed to be different from other souls and it succeded.",2024-08-27 21:23:44,2082,False
recommende,7,0.5401594042778015,"Un excellent jeu.  Tout le monde le compare à DS3 ou à Elden Ring, or il a sa propre personnalité et ses propres idées.  Bien sûr tout n'est pas parfait non plus, mais le premier DS ne l'était pas non plus.  Mais le double monde, la lampe, le lore (bien plus fourni et abouti que sur les souls, au moins on comprend quelque chose...), tout ça est très agréable et en fait à mon sens un grand jeu.  Les devs sont très présents et certains boss offrent des combats vraiment épique.",2024-08-04 23:02:11,2197,False
recommende,12,0.5374087691307068,"Quand je lis les critiques négatives de personnes ayant joué quelques heures, ou ceux parlant de la fin ""radiance sans avoir fait les autres...disons que je rigole....Certains n'ont pas su apprécier le jeu à sa juste valeur.bref. Beaucoup de bonnes idées et l'ombral qui fait du bien . Perso je passe pas mal de temps en ligne,dans l'ombral...,avec la faucheuse rouge, des invasions d'autres joueurs qqls fois, tout cela accompagné d'un porte-lampe ""ramdom""et c'est plutot intense... .(sans oublié le creuset et ses défis .(tous les boss sans mourir,sinon case départ...et la coop ou l'invasion ""sauvage ""trés trés sympa.Bref j'aime ce jeu.Pour ma part aucun bug en fin 2024 et 2025.C'est un jeu ou l'on peut passer du bon temps, un peu comme les DS etc.tout ça pour dire que les rageux sont fatigants.Qu'ils retournent dans leur monde et ne descendent pas certains jeux injustement.",2025-01-25 12:54:34,15895,False
recommende,4,0.5320374369621277,"Amazing game. Great ambiance and atmosphere, great visuals and stuffed with beautiful scenes. The gamefeel is really good and the Axiom/Umbral really add a good twist on the menu. One of the best Soulslike I've played.",2024-09-25 00:20:56,2533,False
recommende,1,0.5258620381355286,"Jeu sympa si on oublie le faite que des joueurs lvl 300 campe les zone debutant pour one shoot et ne prendre zero degas, si on oublie ce pvp completement stupide le jeu et sympa et la courbe de dificulté a l'aire sympa !!!",2025-04-27 00:54:03,158,False
recommende,6,0.5240916609764099,"C'est un excellent Soul-Like et voici mes points forts et faibles :  Points forts :  - très beaux graphiques, ils sont dignes des plus grands Souls - Un gameplay intéressant - Un vaste choix d'armes et armures - Une ATH complète et des menus tout aussi complets et faciles à utiliser - Une construction de personne qui peut etre très élaboré - Une bonne histoire avec une bonne exploitation du monde réel et celui des ombres. C'est un travail remarquable que pouvoir basculer de l'un à L'autre - Le fait de pouvoir débloquer des nouvelles classes c'est cool - J'aime bien pouvoir rejouer en nouvelle partie 0 - NG +0 - La difficulté est bien jaugée et permet au joueur débutant de demander de l'aide soit par l'intermédiaire de PNJ ou de joeur en coop si vous jouez avec d'autre  Points faibles :  - Quelques fois des petits soucis de ciblage mais rien de grave c'est mineur - Quelques petits bug de texture mais encore la rien de dramatique c'est peu fréquent - Le fait d'accumuler des résidus d'ombral demande Énorrmément de farming pour obtenir les items de Boss et je demande lorsqu'il y aura moins de joueurs comment ils vont gérer cela - L'affichage des points de dégats est un peu défaillant - J'aurais aimé avoir un mode de prévisualisation pour les teintures étant donné le cout de ces dernières  En Conclusion  Je vous recommande vivement ce jeu car c'est un excellent jeu pour le prix",2025-04-16 14:59:48,15439,False
recommende,1,0.523809552192688,"Je ne suis qu'a 19h de jeu et il a détrôné dark soul 3 dans mon coeur. Il est incroyable, de par son histoire, son ambiance, ses mécaniques. Il permet de nombreux build intéressant, permettant d'insérer juste ce qu'il faut de magie sans etre obligé de jouer un mage (gros point positif pour moi qui aime jouer mêlé dans les soul) il y a des armes/armures mais juste woaw  Prenez le temps de vous arretez et d'observer les décors, autant dans le monde vivant que le mort. Les décors racontent une histoire également et quels décors! il a dépassé de loin les dark soul à ce niveau là. Il n'est pas plus difficile qu'un dark soul 3 si l'on doit comparer la difficulté. j'ai roulé sur un autant que sur l'autre sans etre une pro des soul mais alors vraiment pas, il suffit de lire et de construire de façon intelligente son build, bien sur on va mourir, mais c'est comme cela qu'on apprend sinon faut aller jouer aux sims lol Chaque zone est très bien construite, il suffit de prendre son temps, d'observer. Les gens qui critiquent ce point, n'ont rien compris au jeu, on ne rush pas ici, on explore. un autre point fort de ce soul et trop rare, on pousse réellement le joueur à explorer. Ce jeu ne vous marquera pas obligatoirement par ses boss mais il va vous laisser des traces de part son histoire et les émotions qu'il vous procurera. Il sera vain de le comparer à lies of p ou dark soul ou tout autre soul, il a sa propre histoire. Commencez le l'esprit libre et ouvert et laissez le vous amenez dans son univers. pour ma part j'y retourne, car je compte bien le finir :)",2025-05-04 04:58:40,1138,False
recommende,5,0.523809552192688,"En global : vraiment bien. Graphismes : très beau, fluide (rx6800xt/1440p/90 fps environ/ultra et qql optis) Map design : je le trouve ouf malgré que de nombreuses personnes ne l'apprécient pas. Les chemins sont reliés et je trouve ça fascinant. Je pense qu'un gros travail à été réalisé dans la map design. Le léger hic est que l'on peut vite ne plus comprendre vers ou nous devons nous diriger. Ambiance : très gore, très sombre, je la trouve vraiment réussie.  Ennemis : Les boss ne sont pas les plus mémorables (je n'ai pas fini le jeux) mais pour autant ils ne sont pas horribles. Les ennemis eux ne sont pas variés et c'est assez dommage, le jeux reste très qualitatif selon moi.  En gros : le jeux est très bien et ne mérite pas autant de haine, il n'est pas parfait mais à le mérite de faire des efforts ! Achetez le en solde et sans avoir d'énormes attentes et vous ne serez pas déçus.",2025-02-27 22:15:04,1334,False
recommende,6,0.523809552192688,LOTF est un très bon jeu. Malgré bcp de critiques négative.  - graphisme de fous - level design correct - bons boss - bonnes musiques  - bonne da et maps - bestiaire pas asse grand - bon movesets - histoire cools - concept monde des morts monde des vivant trop cool   voila je conseille bcp,2024-10-27 17:56:39,2728,False
not recommende,3,0.5199999809265137,"Bon encore un jeu qui intègre un mode multiplayer, mais malheureusement les développers ne savent clairement pas comment bien le gérer... En coop, des zones sont complètement bloqués, la course n'est pas possible, monter des échelles c'est l'enfer. à quoi bon mettre un mode coop si c'est autant bugger. J'ai acheté ce jeu en 2025 en me disant que le jeu serait stable et que la plupart des bugs seraient corrigés. Il faut croire que ce n'est pas le cas. Ce jeu est probablement bien en solo. Cependant, si vous l'achetez pour jouer en coop, je ne recommande vraiment pas.",2025-04-19 02:23:01,216,False
recommende,1,0.5029239654541016,"Pas mal du tout, le jeu me semble plus accessible qu Eldenring niveau difficulté et navigation dans les menu, mais n en a pas la profondeur. Cela reste une tres belle alternative et la possibilité de le faire en coop avec une seule licence est un vrais plus !. A noter, le jeu passe en intermédiaire/élevé sur steamdeck lcd, mais ca reste forcément moins beau que sur un portable/pc fixe, ca permet d y jouer en coop 😜",2025-04-22 16:32:48,365,False
recommende,0,0.5,"Really good and fun game. I have the vibe of dark souls in a game way easier, which makes it casual! Visuals and cinematics are more fast paced (I sometime find it weird but idc), and the game is really good. The free multiplayer (friend pass) makes my friends able to play with me, and 3 of them eventually bought the game themselves lol. This game is peak, not Elden Ring's of peak, but it is still peak. Having a blast.",2025-05-07 18:03:26,1435,False
not recommende,0,0.5,"je pense que les devs ont pas testé leur jeu, oui c'est très beau, oui le gameplay est sympa, oui bonne ambiance mystérieuse, sonore et tout... mais qui s'amuse réellement en jouant ? aucun ennemi n'oppose de résistance, on se contente de courir et de tout défoncer en cherchant par où il faut aller parce que question labyrinthe inutilement complexe, le jeu se pose là",2025-05-06 22:38:46,205,False
not recommende,0,0.5,"Honnêtement, j'ai essayer ... je pense que les développeurs on raté le cours de level design ... impossible de s'y retrouver, plus de souffrance qu'autre chose. La difficultés des boss à part le premier ... 0.",2025-05-06 22:36:53,207,False
recommende,0,0.5,"Pas de temps de palabrer on va faire court, y'a un an il n'était pas fini. c'est désormais finalisé, et pour 20 balles ça vaut le coup.",2025-05-06 20:05:32,2150,False
recommende,0,0.5,"I haven't played this game much to give a full review, but so far I'm loving it! The combat system and the dark atmosphere... I think it's a good game to start in the Souls like genre. The only thing I wish they would add is a map system. The lack of a map makes fast travel harder. The travel system is really bad, I always have to look up which vestige goes where.",2025-05-04 18:50:47,635,False
not recommende,0,0.5,"La découverte est vraiment cool. Le combat est plutôt fun, prise en main assez facile, zones très jolies... et puis au bout d'un tiers du jeu, les zones se transforment en salades d'ennemis déjà vus 46 fois. Ah et ceci inclut les boss. Dès la minute où ces derniers sont vaincus pour la première fois (hors boss majeur), vous les retrouverez recyclés partout, tout le temps, comme ennemi classique. A foison. Du coup ça transforme le plaisir et le fun initial que l'on avait pour le jeu en véritable ennui, et transforme la progression en corvée. Dommage!",2025-05-03 19:54:32,916,False
recommende,0,0.5,"Acheté en édition Deluxe à 23€ en promo, pour la sortie de la V2.0 du jeu.  Environnements incroyables de beauté, musiques épiques, Gameplay accessible, satisfaisant et divertissant, pour un novice comme moué en Souls-like.   Si vous aimez l'Exploration, la Dark Fantasy et des combats non frustrants, ce jeu est fait pour vous.   De plus, il a une personnalité bien à lui, en dehors de ses références évidentes...  En promo, c'est inratable ! Sinon dommage pour vous ;-)",2025-05-01 14:45:59,1579,False
