tag,helpful,weighted_vote_score,comment,date,minutes,early_access
not recommende,307,0.8470109105110168,"Tout d'abord.. C'est un très très bon jeu... J4y ai passé des soirées entières a me régaler... Mais la ça va plus..  Je suis très déçu de la tournure que prend le jeu...  Du coup je pousse un coup de gueule et j'arr^te d'y jouer  Les maj ne sont pas folle, elles n'opportent pas beaucoup dans le gameplay ET NE CORRIGE PAS LES BUG.  J'ai presque 600h dessus, j'ai été top 3000 EU et le jeu commence à me fatiguer vu qu'il n'avance pas.. Il régresse.  Donc je résume les bugs rencontrés récemment, 1 an après la sortie :   - Ne pas prendre les véhicule.Surtout moto et side car. Bah oui un gravier invisible vous envoie dans les air --> mort.  - Ne pas aller dans l'eau. Bah oui, on traverse la map et on reste bloqué... --> mort.  - Ne pas essayer de tirer les énemis lointains sur Miramar. Bah oui, bug de texture, tu le vois et enfaite il ne faudrait pas, il est derrière une colline. (distance d'affichage au max). - Ne SURTOUT pas déposer quelque chose (un atachment ou un arme) dans une pente. Bah oui, c'est bien connu, que si tu lache quelquechose dans une pente/ escalier, l'objet disparait..  - Ne surtout pas regarder les killcam et les replay, bah oui, si jamais tu veux t'améliorer et savoir pk tu es mort, faut pas compter sur la deathcam qui est totalement buguée et ne suit même pas les mouvements réels du joueur.  - Le P**** DE CHARGEUR de ton arme qui est bugué devant ton viseur de temps à autre.. pratique... (et ce depuis l'alpha, donc 1 an de développement..)  Je ne parle pas des serveurs en 30hz, ni des lag que j'ai pu avoir malgre la fibre à 45mB /s..  Je continue ? Allé pour la route :  - Depuis la dernière maj, GROS drop de FPS dans les batiments d'Erangel... (alors que j'avais toujours eu 60 fps constant)..   Autre chose :   i7 7700 HQ, 16 go ddr4, gtx 1060 6g et le jeu n'est pas foutu de tourner à 60 fps en moyen ???  Just cause 3 ; GTA 5; BF1 tourne en ultra à 60 fps CONSTANT sur cette config et vous n'êtes pas foutu d'optimiser le jeu pour qu'il tourne en moyen ?? Pour rappel...  CRYSIS 1 est sorti il y a 10 ans... GTA 5 il y a 5 ans... Je vous laisse faire la comparaison...   Ca serait un petit jeu indé, j'aurais rien dit, mais là, avec plus de 25 millions de copies vendues, c'est pas normal DU TOUT. Les bugs ne dérangeant pas le gameplay sont présents aussi, mais ça c'est autre chose et beaucoup moins grave. ""Oui mais Blue hole est une petite companie, ils faut leur laisser le temps"" NON, ça ne l'est plus, faut arrêter.   Bien cordialement,    - Un joueur qui est frustré de voir un si bon jeu pourir...   Ps: Faites quelquechose... Sérieusement...",2018-05-05 20:14:51,33672,False
recommende,250,0.8926078677177429,"[h1]Avant tout ! [/h1]  J'ai lu assez bien d'évaluations positives comme négatif et effectivement le jeu a des défauts et des qualités mais je ne peux pas laisser passer certains points:  [b]- Les cheaters:[/b] Je vois dans beaucoup d'évaluations des gens se plaignant des cheaters. J'ai 182 heures de jeu, et je n'ai rencontré aucun cheater. Certes, il y en a surement mais voir des personnes se plaignant de ça alors qu'ils ont que quelques heures de jeu, je ne comprends vraiment pas ou alors  pas de chance mais dans ce cas mettre une évaluation négative sans arguments, est complètement ridicule en sachant que Bluehole, Inc. n'hésite pas à ban, et font des gros efforts à ce niveau-là   [b]- Les bugs:[/b] Pas grand-chose à dire"" Jeu en accès anticipé ""  ce jeu en accès anticipé peut changer ou ne pas changer de façon significative. Si celui-ci ne vous intéresse pas dans son état actuel, vous devriez peut-être attendre qu'il se développe davantage.   [b] Points positifs[/b]  [table]     [tr]         [th]Points positifs[/th]         [th]Explications[/th]     [/tr]     [tr]         [td]Gameplay[/td]         [td]Un gameplay fort plaisant et pour tout le monde, tant pour les camper que pour les rushers et même pour ceux qui aime looter. Il y'a beaucoup d'armes et de manières de jouer, soit à la première personne ou a la troisième et bientôt une mise à jour nous permettra d'escalader des obstacles  ![/td]     [/tr]     [tr]         [td]Graphisme[/td]         [td]Le jeu a un rendu photoréaliste assez impressionnant, le jeu est beau, très détaillé, fluide et pour moi c'est important car le début de PUBG était compliqué, le jeu n'était absolument pas fluide et optimisé, maintenant plus aucun problème. Le jeu est agréable à jouer[/td]     [/tr]     [tr]         [td]Le suivi du jeu[/td]         [td]Quelqu'un a compté le nombre de jeux en accès anticipé pas finis . Ici ce n'est pas le cas, les mises à jour sont régulières et Bluehole écoute sa communauté ![/td]     [/tr] [/table]  [b] Points négatifs[/b]  [table]     [tr]         [th]Points négatifs[/th]         [th]Explications[/th]     [/tr]     [tr]         [td]Graphisme[/td]         [td]Non ce n'est pas une erreur, le jeu est beau et fluide mais trop sombre et ce n'est absolument pas normal d'utiliser un programme tier(reshade) pour avoir des graphismes colorés. En plus de ça les gens avec reshade ont un avantage certain par rapport à ceux qui ne sont pas au courant du programme[/td]     [/tr]     [tr]         [td]Sons[/td]         [td]Certains effets sonores sont jolis, mais il y a de gros problèmes. Exemple bête, vous entendez les pas de vos amis qui sont à quelques mètres de vous, mais souvent, quand un ennemi est devant vous, vous ne l'entendez pas ou trop tard, et les bruits horribles de l'avion ou des véhicules, j'en parle même pas. Avec la prochaine grosse mise à jour, ça sera réglé mais en attendant, c'est le gros point noir du jeu[/td]     [/tr]  [/table]  [h1] Corrections Server test 20/12/2017 [/h1]  [b] Corrections 1.0[/b]  [table]     [tr]         [th]Corrections 1.0[/th]         [th]Explications[/th]     [/tr]     [tr]         [td]Graphisme[/td]         [td]Amélioration de la luminosité ! Plus besoin d'utiliser Reshade, comme je l'expliquais au-dessus ! Le jeu est joli maintenant sans reshade et beaucoup plus fluide et agréable a l'oeil ![/td]     [/tr]     [tr]         [td]Sons[/td]         [td]Fixed the issue where player's footstep sound was silenced when player moved diagonally or wore particular shoes. Donc ils ont corrigé le fameux bug que j'expliquais au-dessus avec les sons des pas! Et les sons des véhicules sont nettement plus agréable ![/td]     [/tr]  [tr]         [td]Replays/killcam[/td]         [td]Ajout de la fonction replays et killcam. La killcam est très pratique pour voir comment nous sommes mort et la fonction replay nous permet de voir en détail comment ses passés la partie, ou même pour faire des vidéos, c'est assez cool car on peut changer les angles de caméra, etc. [/td]     [/tr]  [/table]   [h1][b]Les commentaires non argumentés et non constructifs sont directement supprimés, le but des évaluations est d'aider les gens avec un avis objectif car dire: oui maintenant qu'il y a la killcam tu vas pouvoir voir les cheaters. Et que cette phrase a été dit par une personne avec un Ban vac...(je parle pas de toi Chean) j'ai beaucoup rigolé, merci a toi ! [/b] [/h1]",2017-11-21 13:57:33,12244,True
not recommende,138,0.8419417142868042,"Salutations, c'est avec un grand regret que j'évalue Flakdepu, après tous plus de 2000h de jeux... Le 1er point est, une fois de plus, pas un souci avec le jeu en lui même. Mais plutôt de son administration et la communautée de tricheurs qui sévit depuis le debut de ce jeu.  Merci pour les rare moment de beau jeu, j'entends par la les rare instant ou l'on croise pas de tricheurs et/ou un vieux bug lié à l'architecture du jeu (pas super obtimisé).  Les tricheurs ont toujours été présent. Ce soir j'ai subi le dernier.  q+",2021-12-25 21:56:10,141152,False
not recommende,238,0.8762163519859314,"300 heures de temps de jeu, que dire ...   Au départ, l'optimisation était à chier, il ne faut pas se mentir. Les développeurs ont alors travaillé dessus afin de rendre celui-ci plus stable et plus plaisant.  Le fun était alors au rendez vous.  Cependant, depuis maintenant 3/4 mois, PUBG est rempli, mais alors, rempli de cheaters ! Bien entendu, certains puristes me diront que je ne sais pas jouer etc etc ... C'est vrai, je ne suis pas un foudre de guerre mais il y'a des situations quelques peu bizarres. Quand tu es Full T3 et que tu te prends 3 Headshot d'affilés par la même personne qui n'a tiré que 3 balles, bien evidemment, alors que tu es en mouvement, c'est suspicieux non ? Lorsque tu es derrière un mur, et que tu entends des impacts de balles sur celui-ci alors que tu n'as pas bougé et que des qu'il y'a un pixel de ta tête qui dépasse tu meurs, c'est suspicieux non ? Quand tu ne fais pas de bruit, que tu avances doucement et qu'on te préshot, que tu regardes la killcam et que tu vois que le mec te suis au travers du mur, c'est suspicieux non ?  Bref ... Ce jeu était bien mais la, il donne juste envie de vomir. Je suis décu de mettre un avis négatif mais c'est tout ce qu'il mérite pour le moment !",2018-01-13 18:07:52,18871,False
recommende,108,0.8234702944755554,"Je viens d'H1Z1, fan du genre. Objectivement, je préfere largement PUBG. Beaucoup plus beau, plus d'armes, et d'accessoires. Les viseurs et lunettes font du bien au gameplay. Le mode visée FPS est très appréciable, surtout en switchant depuis la vue exterieure. Les maps sont un poil plus variée que H1Z1. Le mode spectateur évite de se faire chier quand on est à plusieurs et qu'on est mort rapidement, on est vraiment avec sa team, avec le stress qui va avec ^^. Les devs sont pour le moment à l'écoute de la communauté, et prévoit de belles choses. (Notamment un ""analyseur de partie"") Pour le moment, du plaisir ;) Chaque partie est une nouvelle aventure !!",2017-06-29 08:13:43,36953,False
recommende,74,0.8212854266166687,"Un jeu que j'attendais sans trop le savoir depuis longtemps. Il y a tout ce qu'il faut dedans :   - Un côté ""action"" bien réalisé. Les combats avec les armes à feu sont crédibles, les sons des armes réussis. On se sent souvent démunis faces à des joueurs qui ont plus d'expérience, mais tout repose sur l'entraînement, et une fois maîtrisés, certains fusils savent se montrer redoutables.   - Un côté ""stratégique"". On est totalement libres dans notre approche de la partie : On peut jouer très offensif ou bien rester cachés dans un coin en attendant un affrontement inévitable, mais dans les deux cas il faut bien anticiper toutes ses actions pour ne pas se retrouver à découvert canardé par un sniper plus futé. On est limités tout de même par la zone de jeu qui rétrécit au fur et à mesure de la partie et dont il faut bien surveiller l'évolution sous peine de se prendre des dégâts (et donc de mourir le plus souvent). Il faut au début de chaque partie choisir son point de spawn sur la map : aller dans une ville avec beaucoup de monde, et risquer de mourir dans un affrontement prématuré, ou bien choisir de démarrer dans un endroit moins peuplé mais avec un loot potentiellement moins intéressant ? Car on commence ""tout nu"" chaque partie et la victoire déprendra bien sûr de l'équipement qu'on récoltera.   -De la gestion aussi, donc : Choisir son arme en fonction de ses besoins, récolter des munitions et des upgrades, ramasser des gilets pare-balles, des casques, des sacs, les améliorer...    PUBG est un jeu qui maintient en éveil tout le long de la partie. On est toujours à l'affut du moindre petit bruit de pas qui nous indiquerait la présence d'un ennemi/victime. On se demande toujours si la traversé d'un champ à découvert marquera notre arrêt de mort. On ouvre les portes avec précaution, on ne se presse que dans les moments critiques. Le stress est présent du début à la fin, et finir dans le top 10 est une récompense qu'on savoure avec fierté.  PUBG est un bon jeu selon moi, un jeu qui sait plonger le joueur dans un monde dangereux et sans pitié, mais où on retourne volontiers après s'être fait écraser par un 4x4 qui passait par là.   Update : Je reviens après quasi 200 heures de jeu, et mon expérience ne correspond pas du tout aux commentaires que je vois dans les recommandations. Parfois oui, le jeu crash, parfois il y a des cheateurs mais VRAIMENT TRES PEU, parfois les serveurs laguent et le jeu est pas hyper bien optimisé, mais je m'y amuse vraiment, et pour peu que vous y jouiez avec un/des ami(s), le jeu est vraiment excellent, comme je l'avais dit lors de ma première évaluation.   Alors de deux chose l'une : soit j'ai un pc qui est une machine de guerre (et c'est un peu le cas), et j'ai une chance fabuleuse de pas avoir trop de problèmes, soit la commu et en particulier les gens qui commentent sont hyper salés, et s'offusquent pour un rien, comme, je crois, une bonne partie de la commu gaming de nos jours.  Alors détenteurs du jeu, revoyez vos priorités si c'est la deuxième option qui vous semble juste : vous préfèrez vous plaindre comme tout le monde, et déverser votre haine cancer dans les coms, ou alors relancer une game avec des amis et vous amuser ?  Oui les devs sont un peu moyens en ce moment, mais vous avez acheté un jeu en accès anticipé, connaissant les risques et les aléas de la chose. Vous avez signé pour un jeu non terminé, avec une durée de développement indeterminée. Soyez patients, et demandez vous simplement pourquoi le jeu est si populaire en ce moment, et se classe presque tout le temps dans le top 5 des jeux Twitch. Amusez vous, c'est le plus important, les updates viendront, c'est sûr.",2017-07-28 12:05:32,11654,True
recommende,77,0.8186487555503845,"[h1]PLAYERUNKNOWN'S BATTLEGROUNDS[/h1] est un jeu ""BattleRoyale"" par le créateur du mod sur Arma 2/3 et H1Z1. Je conseille ce jeu pour tous les fans du mod, le jeu reprend le réalisme d'un Arma en y ajoutant un peu de fluidité comme on peut trouver dans H1Z1.  [b]⚠ Le jeu souffre actuellement de problèmes d'optimisations et si vous n'avez pas une très bonne config vous risquez de rencontrer des fortes chutes d'fps. ⚠[/b]  ---------------  [u]❤ Public conseillé :[/u] ☐ Je ne conseille ce jeu à personne ☐ Les enfants ☐ Les fans du genre ou de la franchise  [b]☑ Les casuals gamers[/b] ◀ [b]☑ Les hardcores gamers[/b] ◀   (Nécessite un minimum d'expérience dans le genre.) [b]☑ Les pros-players[/b] ◀  [u]☼ Graphismes :[/u] ☐ À vomir par terre ☐ Très mauvais ☐ Mauvais  [b]☑ Corrects[/b] ◀   (Problèmes d'optimisations, les développeurs devraient les résoudre assez rapidement.) ☐ Bons ☐ Très bons  ☐ Beaux à en chialer  [u]€ Qualité/prix :[/u] ☐ Il faudrait me payer pour y jouer ☐ Attendez une promo  [b]☑ Abordable[/b] ◀   (Un peu élevé par rapport à son concurrent H1Z1 mais si vous aimez le genre n'hésitez pas.) ☐ Pas cher  ☐ À ce prix-là c'est cadeau   [u]€ Configuration PC recommandée :[/u] ☐ L'ordi à ma grand-mère  ☐ Entrée de gamme  ☐ Milieu de gamme  [b]☑ Haut de gamme[/b] ◀   (Nécessaire d'une bonne config dû aux problèmes d'optimisations actuelles.) ☐ Un PC de la NASA  [u]⇧ Les plus :[/u] [b]+ Le réalisme des armes[/b] (reculs, bulletsdrops...) [b]+ Diversités des armes[/b] (+20 armes différentes pour le moment.) [b]+ La diversité des environnements[/b]   [u]⇩ Les moins :[/u] [b]- Les problèmes d'optimisations[/b] [b]- Des serveurs parfois capricieux[/b] [b]- Quelques bugs[/b]  [u]⌛ Durée de vie :[/u][b] Illimitée [/b](Si vous aimez le concept de la BattleRoyale.)",2017-03-25 18:14:50,2227,True
recommende,27,0.7612178325653076,"PUBG est l'un de ces jeux que j'adore détester. Cela fait pas loin de 7 ans que j'alterne périodes de jeu intenses et longues pauses, et je pense qu'il est temps de donner un verdict.   Côté technique, le jeu répond présent : c'est stable, ça tourne, le gameplay répond bien et le sound design permet de bien gérer ses approches et d'identifier à l'oreille l'origine et la distances des tireurs. Assez simple à prendre en main mais très complet, il offre aussi une bonne marge de progression via un arsenal pléthorique et quelques maps qui ont toutes un thème et une construction propre.   Il est aussi à noter que le jeu est gratuit et que mettre la main au portefeuille ne changera rien à votre expérience de jeu ou presque (j'ai acheté le jeu du temps ou il était payant, visiblement j'ai quelques trucs en plus mais je ne suis pas certain de quoi et je suis certain que ça n'a aucune influence sur le déroulé des parties)  Niveau durée de vie, le jeu a 7 ans et revient de loin, mais est correctement suivi et étoffé par les développeurs. Il y a eu des passages à vide, mais je suis très satisfait de ce qu'il y a à faire actuellement. En bref, la durée de vie dépendra surtout de votre investissement personnel et des personnes qui partageront l'aventure avec vous.  Bref, j'encourage tous ceux qui seraient tentés par un battle royale à lui donner sa chance. Moins cartoon que Fortnite, offrant un meilleur comportement d'armes que Apex, le jeu a sa propre place dans l'univers vidéoludique.   J'ai longtemps hésité à le recommander ou non, mais après y avoir joué presque 2300h, je n'aurais pas été très cohérent si je lui avais attribué un ""non recommandé"".",2024-05-16 22:46:11,137307,False
recommende,161,0.8477610349655151,"[h1]LE jeu de Battle Royale[/h1]  PUBG (PlayerUnknow's BattleGround) est sûrement l'un des meilleurs jeux de Battle Royale auquel j'ai pu joué. Biensûr, comme tous les jeux de ce type, jouer en équipe vous apportera plus de plaisir.  Les graphismes sont beaux, le gameplay est plaisant même si, pour les joueurs H1Z1 KoTK le gameplay peut-être plus lent de leur point de vue. Le réalisme, le fait qu'on peut trouver une arme et y ajouter des accessoires apportent un plus. De plus, il n'y a pas d'arme ""au dessus"" des autres, sauf les snipers ou batteuse que l'on peut trouver dans un ""drop""  Les modes de jeu solo, duo et quatuor ainsi que des serveurs plus ""fun"" comme ""only pistol"" ""fist""  Comparé à H1Z1 KoTK ou encore DayZ, les développeurs répondent à la communauté, font les mises à jours suivant le goût et l'avis des joueurs, et surtout, il y a régulièrement des mises à jour de 2GB. Malgré le nombre de bugs encore présent sur le jeu, il est largement jouable et plaisant.  /!\LE JEU EST ENCORE MAL OPTIMISÉ POUR LE MOMENT, NE PAS RÂLER POUR LES DROP D'FPS/!\",2017-06-20 02:50:31,3606,True
not recommende,43,0.7442829608917236,Après 2000 heures je pense être légitime pour donner un avis constructif .  Cela fait maintenant 2 ans que Bluehole (Developpeur) n'a rien fait évoluer sur son jeux toujours rempli de bugs je vais en citer quelques un :  -Bruit de l'ennemi impossible à détecter -véhicule qui bug dans des décors  -quand on lance à 4 un de nos joueurs n'a pas son nom en bas obligé de restart le jeu -texture qui se charge pas -avoir 500 de ping et vivre dans les favelas vous avantagent niveau connexion -les branches d'arbres peuvent vous tuer en véhicules (expérience d'un tocard s'appellant DarkanCSTV)  -si je lance en replay une game je dois restart le jeu sous peine d'avoir une baisse de qualité graphique ... Un ami répondant au nom de Marty72 à le jeu qui crashe très souvent sans raison (c'est un tocard aussi) énormément de personnes trichent sur ce jeu au point que vous ne saurez plus dissocier les joueurs légit des tricheurs  Parlons maintenant des cheateurs .  Wallhack aimbot et j'en passe ...les asiatiques pullulent tel des cafards .  Je tiens à préciser que le point positif est le fait que les mouches dans Pai'nan (petit village sur la map Sanhok) soit très bien représenté .  J'ai souvent l'impression que les dev's étaient sous l'emprise de la drogue lors de la création .  Bref ce jeu aurait pu être une pépite si les dev's s'occupaient des tricheurs et fixait les bugs au lieu d'en rajouter des nouveaux !  Je retourne sur ROE ! Adieu,2019-12-13 15:40:34,155290,False
not recommende,54,0.7411287426948547,"Ça fait 3 années que le jeu est sortie et 3 années que je le possède. Il est devenu à vomir.  Le studio n'a aucun respect pour les joueurs.  Le jeu était bien plus chouette lorsqu'il est sortie, simple, un peu bugué mais au moins, amusant.  Aujourd'hui, vous vous ferez tué par un cheater ou vous tuerez un bot, entre deux lag/bug de la mort qui tue.  Le jeu n'est même plus optimisé.  Au lieu de sortir des nouvelles map/nouvelles armes ou je ne sais quoi, merci de juste tenter de rendre un jeu stable et de lutter contre les cheats.   Lancer une partie, sauter de l'avion, atterrir, trouver une arme, tuer des ennemis, buguer, lagger, galérer à cause de la non-optimisation du jeu, tuer des ennemis, tuer pleins d'ennemis, gagner la partie, apprécier son moment, regarder le replay et constater qu'on a joué contre des bots.  Des bots. Le jeu vous fait jouer contre des bots en vous faisant croire que vous jouez contre de vrais joueurs.  J'ai juste une seule envie, c'est de me faire rembourser, c'est devenu un jeu lamentable.  Update : Le jeu est devenu gratuit, et c'est ce qu'il vaut.  Update 2 : Bon allez, finalement, pour un jeu gratuit et beaucoup moins de bot, c'est ok.",2020-12-12 23:54:05,27815,False
not recommende,46,0.7399459481239319,"Trop c'est trop,jais pas les mot un dégout total pare le nombre de p.... de cheater qui on littéralement détruit le jeux,pas une parti sens tomber sur des cheater de level 500 avec leur aimbot et wallhack,le jeux a plu de sens,on parle de warzon lol,416.5 heurs de jeux et je l'adore mais la houuuuffff sa fais mal,moi qui fais pari d'une team de 15 joueur on na pris la décision de laisser un excellent jeux comme sa a une communauté de cheater bref j’adise un bon jeux.a oui jais oublier notifier les signalement attention un moment on peux plus signaler du a un abus,désoler trop de cheater.",2021-07-18 21:37:38,25008,False
not recommende,39,0.7822757959365845,"Membre de la communauté PUBG depuis presque le tout début (quand il n'était encore qu'une Alpha), je lui ai tout pardonné :  _ Les bugs de textures _ Les plantages à outrance _ Le netcode du serveur _ La balistique qui, au tout début du jeu avait une part d'aléatoire (comparé à CS par exemple) _ Les murs invisibles rendant impraticable la map Miramar au début. _ La répartition du loot totalement déséquilibrée. Et toutes ces bullet points ne sont évidemment pas exhaustives. Mais malgré ça, quel plaisir de tenir jusqu'au carré final, quand votre instinct primal d'homosapien refait surface et vous fait vous en sortir de situation que même la science exacte mathématique vous donnait 1 chance sur 100 d'en sortir, bref, ces montés d'adrénaline j'en étais accro. Mais voila, toutes les bonnes choses ont une fin, comme disait le célèbre adage. Ce qui a mis fin à cet engouement est, comme le décrivent si bien la majorité des gens de bonne foi ayant commenté avant moi, le cheat. Car si l'erreur est humaine (on peut pardonner les erreurs techniques) et l'erreur est pardonnable (si amélioration y'a), la connerie l'est tout aussi, et cette dernière, est difficilement pardonnable hélas. Ce jeu est truffé jusqu'au trognon de cheaters divers et variés, pas une seule soirée, pas une seule game, que dis-je : Pas un seul m² de map libre de tout cheat, il y'en a partout et a toutes les sauces : De celui qui tourne sur lui et qui met des  têtes à tout le monde, au wallhacker qui te look a travers le sol, c'est à en devenir parano. A tel point que, même quand on se fait tuer de manière totalement réglo, vous reportez le mec quand même..dans le doute, vous vous dites que ça mange pas de pain et surtout sait on jamais. Vous en arrivez même à faire de la discrimination à travers les pseudos, si un HuyaTv,ou un Xuan ou tout autre Zhen venait à vous tuer, vous vociférerez sur l'énergumène que vous enverrez aussitôt au bagne du report pour se faire overwatch son move.  Bref, à toi qui est arrivé au bout de mon commentaire, si tu es le descendant de Gandhi, ou de Krishnamurti, et que la notion de pardon est quelque chose d'inné, que la victoire pour toi est facultative et que l'important est de participer même si tu te fais torcher le cul a 800m par un spray d'AK (genre tu es à Pochinki et le mec est a Severny et il te one tap à l'AK : Va regarder la distance entre ces deux villes jeune néophyte), donc, oui, pourquoi pas, tu peux prendre ce jeu et y jouer (même si, vu ton profile, on aurait plutôt besoin de toi pour régler le conflit Israelo-Palestinien). En revanche, si tu fais parti de la majorité des gamers, qui veulent simplement prendre du plaisir dans un jeu compétitif et essayer de donner le meilleur d'eux durant 30 minutes, je te déconseille fortement ce jeu. Si tu décides quand même de sauter le pas, je t'aurais prévenu, arme toi de patience et d'infusion de camomille.  Amicalement,  H.",2020-01-22 23:28:49,69557,False
recommende,38,0.779088020324707,Jeu qui pourrait être vraiment excellent si la matchmaking était mieux fait. On balance sur la même map des mecs qui ont 2000 heures de jeux avec des noobs... comment voulez vous avoir une courbe de progression correct quand on a pas 10h par semaine à y consacrer... Frustrant,2020-02-22 20:42:57,8583,False
